text,sentiment,polarity,subjectivity,Preprocess
When Bran saw Jaime. # GameOfThrones # GameofThronesSeason8 # ForTheThrone # got # gots8 # BranStark # JaimeLannisterpic.twitter.com/ViEwN3Acns,Neu,0.0,0.0,when bran saw jaime gameofthrones gameofthronesseason8 forthethrone got gots8 branstark jaimelannisterpic twitter com viewn3acns
# GameofThrones # GOT # GoTS8 # JaimeLannister # BranStark # MacriGato # Macrisis # CFK2019 @ mauriciomacri @ CFKArgentinapic.twitter.com/XhWbcohKtO,Neu,0.0,0.0,gameofthrones got gots8 jaimelannister branstark macrigato macrisis cfk2019 mauriciomacri cfkargentinapic twitter com xhwbcohkto
Game of Evil VII ou Resident of Thrones VII? # GameofThrones # GameofThronesSeason8 # BranStark # GOT # GoTS8 # PS4 # XboxOneX # ResidentEvil2 # ResidentEvil # PCpic.twitter.com/00jh3mjXoO,Neg,-0.7,0.7,game of evil vii ou resident of throne vii gameofthrones gameofthronesseason8 branstark got gots8 ps4 xboxonex residentevil2 residentevil pcpic twitter com 00jh3mjxoo
~ Especial memes Bran y Jaime. ~ Spoiler del próximo capítulo entre Jaime y Bran. # WinterIsHere # GOT # GoTS8 # GameofThrones # JaimeLannister # BranStark pic.twitter.com/InjqSVRFvh,Neu,0.0,0.0,especial meme bran jaime spoiler del próximo capítulo entre jaime bran winterishere got gots8 gameofthrones jaimelannister branstark pic twitter com injqsvrfvh
# BranStark to Jamie : # GameofThrones # GOT # GoTS8 pic.twitter.com/2N4WTquNGB,Neu,0.0,0.0,branstark to jamie gameofthrones got gots8 pic twitter com 2n4wtqungb
“Night gathers,Neu,0.0,0.0,night gather
Is that me only who didn't realised that when # BranStark said that he's waiting for an old friend,Pos,0.05,0.6,is that me only who didn realised that when branstark said that he waiting for an old friend
That stare down tho. # GoTS8 # GOT # GameofThrones # GOT8 # Bran # BranStark # JamieLannister # TimesUphttps://twitter.com/iamnnabue/status/1117671027616768002 …,Neg,-0.15555555555555559,0.2888888888888889,that stare down tho gots8 got gameofthrones got8 bran branstark jamielannister timesuphttps twitter com iamnnabue status 1117671027616768002
They fuckin covered so much in first episode. Damn it was lit. # Got # GameofThronesSeason8 # ThronesDay # GoTS8 # GameOfThrones # BranStark # AryaStark # Sansa # JonSnow # Danypic.twitter.com/IOUmIH8uv4,Pos,0.25,0.3333333333333333,they fuckin covered so much in first episode damn it wa lit got gameofthronesseason8 thronesday gots8 gameofthrones branstark aryastark sansa jonsnow danypic twitter com ioumih8uv4
# JuegodeTronos # GameOfThrones # GOT # GoTS8 # GameofThronesSeason8 # JaimeLannister # BranStark Game of thrones pic.twitter.com/XUxMSZk6Un,Neg,-0.4,0.4,juegodetronos gameofthrones got gots8 gameofthronesseason8 jaimelannister branstark game of throne pic twitter com xuxmszk6un
https://youtu.be/1OoJ__sfDSM Arya stark Meeting jon snow scene.. GOT season 8 # GOT # GOTonHotstarPremium # GOT8 # GoTS8 # GOT8 # GameofThronesSeason8 # GameofThones # GameofThrones # GameOfThrones8 # AryaStark # JonSnow # DaenerysTargaryen # Khaleesi # BranStark # SansaStark # HBO,Neg,-0.2,0.6,http youtu be 1ooj__sfdsm arya stark meeting jon snow scene got season 8 got gotonhotstarpremium got8 gots8 got8 gameofthronesseason8 gameofthones gameofthrones gameofthrones8 aryastark jonsnow daenerystargaryen khaleesi branstark sansastark hbo
Jamie viendo a Bran en Invernalia. # GameofThrones # JuegodeTronos # forthethrone # GOT # gots8 # BranStark # JaimeLannisterpic.twitter.com/fbp4BEBEnJ,Neu,0.0,0.0,jamie viendo bran en invernalia gameofthrones juegodetronos forthethrone got gots8 branstark jaimelannisterpic twitter com fbp4bebenj
World will be lot better if ppl start speaking like Bran. # ToThePoint # StraightTalk # BranStark # GameofThrones # GoT # GoTS8,Pos,0.5,0.5,world will be lot better if ppl start speaking like bran tothepoint straighttalk branstark gameofthrones got gots8
Winterfell is the stage for Season 1 callbacks and reunions in the Game of Thrones Season 8 premiere. Here's our episode review. # GameofThrones # GoT # GoTS8 # ForTheThrone # Daenerys # JonSnow # AryaStark # SansaStark # BranStark # Tyrion # HBO # GoT8 # Appocalypse http://www.appocalypse.co/entertainment/game-of-thrones-season-8-episode-1-winterfell-review-s08e01/ …,Neg,-0.4,0.4,winterfell is the stage for season 1 callback and reunion in the game of throne season 8 premiere here our episode review gameofthrones got gots8 forthethrone daenerys jonsnow aryastark sansastark branstark tyrion hbo got8 appocalypse http www appocalypse co entertainment game of throne season 8 episode 1 winterfell review s08e01
Jajajajajakjajajaa..xD. # GameofThrones # GOT # GoTS8 # gamesofthronespanama # BranStark # JaimeLannisterpic.twitter.com/BGoI8iVOYX,Neu,0.0,0.0,jajajajajakjajajaa xd gameofthrones got gots8 gamesofthronespanama branstark jaimelannisterpic twitter com bgoi8ivoyx
Damn this kid is cripple and he's going everywhere while I'm perfectly healthy and yet I never leave my house # BranStark # GameOfThrones # GameofThronesSeason8 # GoTS8 # GOT pic.twitter.com/C6XX9a3x5c,Pos,0.5,0.5,damn this kid is cripple and he going everywhere while m perfectly healthy and yet never leave my house branstark gameofthrones gameofthronesseason8 gots8 got pic twitter com c6xx9a3x5c
Happy game of thrones day! # GOT # GOT8 # GoTS8 # GameOfThrones # BranStark # CerseiLannister # BrienneOfTarth,Pos,0.15000000000000002,0.7,happy game of throne day got got8 gots8 gameofthrones branstark cerseilannister brienneoftarth
"This moment! Bran: I'm waiting for an old friend."" Back then S01E01 Now S08E01 # GameofThrones # BranStark # GameofThronesSeason8 # GOT # GOT8 # GoTS8 # GOTonHotstarPremium @ Mr_AngshumanRoypic.twitter.com/LXtzm0qEvz""",Pos,0.05,0.1,this moment bran m waiting for an old friend back then s01e01 now s08e01 gameofthrones branstark gameofthronesseason8 got got8 gots8 gotonhotstarpremium mr_angshumanroypic twitter com lxtzm0qevz
Sam: ¿Y tú que haces aquí afuera? Bran: Estoy esperando a un viejo amigo. # GoTS8⁠ ⁠ # GOT⁠ # GameofThrones⁠ ⁠ # BranStark # JaimeLannisterpic.twitter.com/lv7PbW952E,Neu,0.0,0.0,sam tú que haces aquí afuera bran estoy esperando un viejo amigo gots8 got gameofthrones branstark jaimelannisterpic twitter com lv7pbw952e
# JaimeLannister and # BranStark staring each other like # Winterfell # GoTS8 # GameofThrones # GOT pic.twitter.com/2D5AqCeCIm,Neg,-0.125,0.375,jaimelannister and branstark staring each other like winterfell gots8 gameofthrones got pic twitter com 2d5aqcecim
For the night is long and full of spoilers! Anyone stay up to watch # GameOfThrones last night? @ ryanparish got up extra early to catch it before work # goTS8 # GameofThronesSeason8 # ForTheThrone # JonSnow # BranStark # AryaStark # CerseiLannister # DaenerysTargaryen # WinterIsHere # GOT pic.twitter.com/m76uUljNnp,Pos,0.0975,0.2833333333333334,for the night is long and full of spoiler anyone stay up to watch gameofthrones last night ryanparish got up extra early to catch it before work gots8 gameofthronesseason8 forthethrone jonsnow branstark aryastark cerseilannister daenerystargaryen winterishere got pic twitter com m76uuljnnp
Noooo!!! How dare it leaves me at # BranStark and # JaimeLannister staring at each other!!! Ugh! Till next week! # GoTS8 # GOT # GameofThrones,Neg,-0.152587890625,0.1875,noooo how dare it leaf me at branstark and jaimelannister staring at each other ugh till next week gots8 got gameofthrones
Sé como # BranStark # GameofThrones # GoT # GoTS8 # GameofThronesSeason8pic.twitter.com/EdC5gXmg48,Neu,0.0,0.0,sé como branstark gameofthrones got gots8 gameofthronesseason8pic twitter com edc5gxmg48
Dan dan da da dan dan da da daaan daaaan da da daaan daaaan da da daaaaaaaan # watching # series # gameofthrones # GoTS8 # GOT # S08E01 # HBO # Daenerys # JonSnow # CerseiLannister # AryaStark # JaimeLannister # TyrionLannister # SansaStark # BranStark # Melisandre # Missandei # NightKingpic.twitter.com/qJwKcTF7RT,Neu,0.0,0.0,dan dan da da dan dan da da daaan daaaan da da daaan daaaan da da daaaaaaaan watching series gameofthrones gots8 got s08e01 hbo daenerys jonsnow cerseilannister aryastark jaimelannister tyrionlannister sansastark branstark melisandre missandei nightkingpic twitter com qjwkctf7rt
Des épisodes de 1h30 ! C'est quoi ce mythe qu'on nous a vendu ? # GoTS8 # GOT # GameofThrones # AryaStark # sansastark # JonSnow # BranStark # WinterIsHere # dana,Neu,0.0,0.0,de épisodes de 1h30 est quoi ce mythe qu on nous vendu gots8 got gameofthrones aryastark sansastark jonsnow branstark winterishere dana
OMG! I teared up when # JonSnow hugged his brother # BranStark The first 5min... # GameofThrones # GameofThronesSeason8 # GoTS8 # GOT,Pos,0.25,0.3333333333333333,omg teared up when jonsnow hugged his brother branstark the first 5min gameofthrones gameofthronesseason8 gots8 got
# GameofThrones # JamieLanister cuando ve a # BranStark esperándolo en # Invernalia... # GoTS8 # got # JuegodeTronos # FortheThronepic.twitter.com/AAtaeY0wYz,Neu,0.0,0.0,gameofthrones jamielanister cuando ve branstark esperándolo en invernalia gots8 got juegodetronos forthethronepic twitter com aataey0wyz
I just found a spiral sigil pin on eBay https://www.ebay.com/itm/223482498779 … # Gameofthrones # Spiral # WhiteWalkers # Spirals # BranStark # Bran # SansaStark # Sansa # JonSnow # AryaStark # Arya # DemThrones # Dany # DaenerysTargaryen # Daenarys # CerseiLannister # Cersei # JamieLannister # GoTS8 # GOT pic.twitter.com/UVl0dB8rpP,Neu,0.0,0.0,i just found spiral sigil pin on ebay http www ebay com itm 223482498779 gameofthrones spiral whitewalkers spiral branstark bran sansastark sansa jonsnow aryastark arya demthrones dany daenerystargaryen daenarys cerseilannister cersei jamielannister gots8 got pic twitter com uvl0db8rpp
Askip Jon Snow il sera comme sa quand il va apprendre que c'est Jaime qui as poussé Bran # gameofthrones # GoTs8 # GameofThronesSeason8 # GoT # GoT8 # JonSnow # BranStark # JaimeLannister # CerseiLannisterpic.twitter.com/UTUGM75I80,Neu,0.0,0.0,askip jon snow il serum comme sa quand il va apprendre que est jaime qui a poussé bran gameofthrones gots8 gameofthronesseason8 got got8 jonsnow branstark jaimelannister cerseilannisterpic twitter com utugm75i80
# BranStark and # JaimeLannister # TheHappySoul # GameofThrones # GOT # GoTS8 # DemThronespic.twitter.com/b9eRwIARtC,Neu,0.0,0.0,branstark and jaimelannister thehappysoul gameofthrones got gots8 demthronespic twitter com b9erwiartc
Siiiiii jejejejeje palabras y hashtag como: # GameOfThrones # GOT # GoTS8 # DaenerysTargaryen # JonSnow # CerseiLannister # SansaStark # AryaStark # BranStark # TheNightKing,Neu,0.0,0.0,siiiiii jejejejeje palabras hashtag como gameofthrones got gots8 daenerystargaryen jonsnow cerseilannister sansastark aryastark branstark thenightking
¿Que fue lo peor del primer capítulo de la 8va temporada Game of Thrones? # GameofThrones # GameofThronesSeason8 # ForTheThrone # GameOfThornes # got # GoTS8 # JonSnow # SamwellTarly # Daenerys # AryaStark # BranStark # bran # HBOGOLA # HBOLAT # JuegodeTronos # GoTFinalSeason # sansastark,Neg,-0.4,0.4,que fue lo peor del primer capítulo de la 8va temporada game of throne gameofthrones gameofthronesseason8 forthethrone gameofthornes got gots8 jonsnow samwelltarly daenerys aryastark branstark bran hbogola hbolat juegodetronos gotfinalseason sansastark
¿Que fue lo mejor del primer capítulo de la 8va temporada Game of Thrones? # GameofThrones # GameofThronesSeason8 # ForTheThrone # GameOfThornes # got # GoTS8 # JonSnow # SamwellTarly # Daenerys # AryaStark # BranStark # bran # HBOGOLA # HBOLAT # JuegodeTronos # GoTFinalSeason # sansastark,Neg,-0.4,0.4,que fue lo mejor del primer capítulo de la 8va temporada game of throne gameofthrones gameofthronesseason8 forthethrone gameofthornes got gots8 jonsnow samwelltarly daenerys aryastark branstark bran hbogola hbolat juegodetronos gotfinalseason sansastark
"Ce qui se passe dans la tête de Jaime  C'est foutu la team "" @ henni_mo # GameofThrones # GameofThronesSeason8 # GoTs8 # GoT # BranStark # JaimeLannisterpic.twitter.com/m5a6Bjk6Bi""",Neu,0.0,0.0,ce qui se passe dans la tête de jaime est foutu la team henni_mo gameofthrones gameofthronesseason8 gots8 got branstark jaimelannisterpic twitter com m5a6bjk6bi
¿Que te pareció el primer capítulo de la 8va temporada Game of Thrones? # GameofThrones # GameofThronesSeason8 # ForTheThrone # GameOfThornes # got # GoTS8 # JonSnow # SamwellTarly # Daenerys # AryaStark # BranStark # bran # HBOGOLA # HBOLAT # JuegodeTronos # GoTFinalSeason # sansastark # dragon,Neg,-0.4,0.4,que te pareció el primer capítulo de la 8va temporada game of throne gameofthrones gameofthronesseason8 forthethrone gameofthornes got gots8 jonsnow samwelltarly daenerys aryastark branstark bran hbogola hbolat juegodetronos gotfinalseason sansastark dragon
# GameOfThrones # GoT # GoTS8 # GameofThronesSeason8 # BranStark # JaimeLannister 1x01 8x01pic.twitter.com/y2VAGyhonu,Neu,0.0,0.0,gameofthrones got gots8 gameofthronesseason8 branstark jaimelannister 1x01 8x01pic twitter com y2vagyhonu
Quand Jaime et venu de toute bonne volonté jusqu'à croisé Bran # JaimeLannister # BranStark # GameofThrones # GameofThronesSeason8 # GoTS8 # GoT # GoT8pic.twitter.com/bBf4GeY6W6,Neu,0.0,0.0,quand jaime et venu de toute bonne volonté jusqu à croisé bran jaimelannister branstark gameofthrones gameofthronesseason8 gots8 got got8pic twitter com bbf4gey6w6
# GameofThrones # JonSNOW # DaenerysTARGARYEN # SansaSTARK # AryaSTARK # BranSTARK # CerseiLANNISTER # ReapersGaming # JaimeLANNISTER # TyrionLANNISTER # NightKing # GOT # GOTS8 # AegonTargaryen # TheonGreyjoy # ForTheThrone # EuronGreyjoy,Neu,0.0,0.0,gameofthrones jonsnow daenerystargaryen sansastark aryastark branstark cerseilannister reapersgaming jaimelannister tyrionlannister nightking got gots8 aegontargaryen theongreyjoy forthethrone eurongreyjoy
# GameofThrones # JonSNOW # DaenerysTARGARYEN # SansaSTARK # AryaSTARK # BranSTARK # CerseiLANNISTER # ReapersGaming # JaimeLANNISTER # TyrionLANNISTER # NightKing # GOT # GOTS8 # AegonTargaryen # TheonGreyjoy # ForTheThrone # EuronGreyjoy,Neu,0.0,0.0,gameofthrones jonsnow daenerystargaryen sansastark aryastark branstark cerseilannister reapersgaming jaimelannister tyrionlannister nightking got gots8 aegontargaryen theongreyjoy forthethrone eurongreyjoy
If it seems unbelievable that all the people on # gameofthrones wouldn’t immediately unite to fight a universal threat,Neg,-0.125,0.5,if it seems unbelievable that all the people on gameofthrones wouldn immediately unite to fight universal threat
Imágenes de # BranStark y # JaimeLannister en el siguiente episodio... # GameOfThrones # GameofThronesSeason8 # GOT # GoTS8 pic.twitter.com/2CLiiC6WwU,Neu,0.0,0.0,imágenes de branstark jaimelannister en el siguiente episodio gameofthrones gameofthronesseason8 got gots8 pic twitter com 2cliic6wwu
Na boa a Sansa tava chata pra caralho nesse episódio,Neu,0.0,0.0,na boa sansa tava chata pra caralho nesse episódio
En resumen!!! # ReapersGaming # GameofThrones # JonSNOW # DaenerysTARGARYEN # SansaSTARK # AryaSTARK # BranSTARK # CerseiLANNISTER # JaimeLANNISTER # TyrionLANNISTER # NightKing # GOT # GOTS8 # AegonTargaryen,Neu,0.0,0.0,en resumen reapersgaming gameofthrones jonsnow daenerystargaryen sansastark aryastark branstark cerseilannister jaimelannister tyrionlannister nightking got gots8 aegontargaryen
En resumen!!! # ReapersGaming # GameofThrones # JonSNOW # DaenerysTARGARYEN # SansaSTARK # AryaSTARK # BranSTARK # CerseiLANNISTER # JaimeLANNISTER # TyrionLANNISTER # NightKing # GOT # GOTS8 # AegonTargaryen,Neu,0.0,0.0,en resumen reapersgaming gameofthrones jonsnow daenerystargaryen sansastark aryastark branstark cerseilannister jaimelannister tyrionlannister nightking got gots8 aegontargaryen
"Everyone talking about how bran saw jamie and acting mad but yet bran called Jamie a friend."" # GameofThrones # bran # jamie # BranStark # JamieLannister # GoT # GoTS8""",Neg,-0.3125,0.5,everyone talking about how bran saw jamie and acting mad but yet bran called jamie friend gameofthrones bran jamie branstark jamielannister got gots8
That awkward moment when you see that “OLD FRIEND” # GameofThrones # BranStark # JaimeLannister # GOT # GoTS8 pic.twitter.com/nE89Z5zzeo,Neg,-0.25,0.6,that awkward moment when you see that old friend gameofthrones branstark jaimelannister got gots8 pic twitter com ne89z5zzeo
Muchos encuentros memorable durante el episodio 8x1 de Game of Thrones pero ninguno tan épico cómo el de Jaime y Bran ... definitivamente cumplió mis expectativas. # JaimeLannister # BranStark # GOT # ForTheThrone # GOTS8 # GameofThronesSeason8 # GameofThrones pic.twitter.com/absBFVIT3e,Pos,0.04999999999999999,0.7,muchos encuentros memorable durante el episodio 8x1 de game of throne pero ninguno tan épico cómo el de jaime bran definitivamente cumplió mi expectativas jaimelannister branstark got forthethrone gots8 gameofthronesseason8 gameofthrones pic twitter com absbfvit3e
# BranStark - veio trepar na torre de novo ? # JaimeLannister - claro... escala la pra assistir de novo,Neu,0.0,0.0,branstark veio trepar na torre de novo jaimelannister claro escala la pra assistir de novo
En el próximo capítulo de Game of Thrones... # GameofThrones # Got # GameofThronesSeason8 # GoTS8 # HboGo # GOT8 # JaimeLannister # BranStark pic.twitter.com/NIwn9vxDmO,Neg,-0.4,0.4,en el próximo capítulo de game of throne gameofthrones got gameofthronesseason8 gots8 hbogo got8 jaimelannister branstark pic twitter com niwn9vxdmo
"ESTOY ESPERANDO A UN VIEJO AMIGO"" # GOT # GameofThrones # GoTS8 # BranStark (Insuperable) pic.twitter.com/qaH3fxOzQ4""",Neu,0.0,0.0,estoy esperando un viejo amigo got gameofthrones gots8 branstark insuperable pic twitter com qah3fxozq4
Me waiting for next week episode be like # GOT # GoTS8 # GameOfThrones # ForTheThrones # BranStark # AryaStark # JonSnowpic.twitter.com/dXyIzcSt9U,Neu,0.0,0.0,me waiting for next week episode be like got gots8 gameofthrones forthethrones branstark aryastark jonsnowpic twitter com dxyizcst9u
# GameofThrones # ForTheThrone # GOT # GoTS8 # DaenerysTargaryen # Daenerys # JonSnow # SansaStark # Sansa # AryaStark # BranStark # TyrionLannister # Tyrion # CerseiLannister # Cersei # BrienneofTarth # Brienne # DavosSeaworth # NightKing,Neu,0.0,0.0,gameofthrones forthethrone got gots8 daenerystargaryen daenerys jonsnow sansastark sansa aryastark branstark tyrionlannister tyrion cerseilannister cersei brienneoftarth brienne davosseaworth nightking
Bran: I had been looking for an old friend. Omg this scene hotstar *Awkward* # GameofThrones # ForTheThrone # JaimeLannister # BranStark @ GameOfThrones # GOT # GoTS8 pic.twitter.com/rqzh7Bmavc,Neg,-0.25,0.6,bran had been looking for an old friend omg this scene hotstar awkward gameofthrones forthethrone jaimelannister branstark gameofthrones got gots8 pic twitter com rqzh7bmavc
So far in 7 seasons of # GameofThrones,Pos,0.1,1.0,so far in 7 season of gameofthrones
Quand t’arrives comme ça devant chez le mec qui t’a spoilé # GameOfThrones # GameofThronesSeason8 # GOT # GoTS8 # Cersei # winterfell # Daenerys # AryaStark # BranStark pic.twitter.com/dOQdw6KQ52,Neu,0.0,0.0,quand arrives comme ça devant chez le mec qui a spoilé gameofthrones gameofthronesseason8 got gots8 cersei winterfell daenerys aryastark branstark pic twitter com doqdw6kq52
Empiezo a creer que # BranStark duerme en el patio... ... # GameofThrones # GOT # GoTS8,Neu,0.0,0.0,empiezo creer que branstark duerme en el patio gameofthrones got gots8
"Por que está aqui fora?"" ""Estou esperando por um velho amigo..."" # GameofThronesSeason8 # GameofThrones # GoTS8 # GOT # BranStark # JaimeLannisterpic.twitter.com/sktMaoWHam""",Neu,0.0,0.0,por que está aqui forum estou esperando por um velho amigo gameofthronesseason8 gameofthrones gots8 got branstark jaimelannisterpic twitter com sktmaowham
โง้ยยยแท็กโซคิ้วทึมากๆๆๆๆ # GameofThrones # GOT # GoTS8 # JonSnow # DaenerysTargaryen # AryaStark # SansaStark # BranStark # TyrionLannister # TheonGreyjoy # SamwellTarly # CerseiLannister # JaimeLannister # JorahMormontpic.twitter.com/mwjjMDVMGM,Neu,0.0,0.0,โง ยยยแท กโซค วท มากๆๆๆๆ gameofthrones got gots8 jonsnow daenerystargaryen aryastark sansastark branstark tyrionlannister theongreyjoy samwelltarly cerseilannister jaimelannister jorahmormontpic twitter com mwjjmdvmgm
THAT ENDING THOOOOOOOO!!! # JaimeLannister back to # winterfell where it all began and meeting # BranStark as soon as he gets there.. Poetic justice anyone? # GoT # GoTS8 # GameofThrones pic.twitter.com/AGGEc6ztnN,Pos,0.1875,0.375,that ending thoooooooo jaimelannister back to winterfell where it all began and meeting branstark a soon a he get there poetic justice anyone got gots8 gameofthrones pic twitter com aggec6ztnn
Gente,Neu,0.0,0.0,gente
Bran to Jamie: Yeah handless,Neu,0.0,0.0,bran to jamie yeah handle
HELP! # GameofThrones # GoTS8 # GOT # JonSnow # SansaStark # aryastark # BranStark # Daeneryspic.twitter.com/JKZ3mHShrI,Neu,0.0,0.0,help gameofthrones gots8 got jonsnow sansastark aryastark branstark daeneryspic twitter com jkz3mhshri
Quando vedo # BranStark apparire dal nulla con lo sguardo da stalker pazzoide # got # GameOfThrones # GoTS8 # GOT8pic.twitter.com/d8hh5Ba0Gt,Neu,0.0,0.0,quando vedo branstark apparire dal nulla con lo sguardo da stalker pazzoide got gameofthrones gots8 got8pic twitter com d8hh5ba0gt
Ohhh # JonSnow ya sabe quien es!! y la cara de # JaimeLannister al ver a # BranStark OMG!! # GameOfThrones # GoTS8 # GoT # WinterIsHere # ForTheThrone @ GameOfThrones WINTER IS HERE,Neu,0.0,0.0,ohhh jonsnow ya sabe quien e la cara de jaimelannister al ver branstark omg gameofthrones gots8 got winterishere forthethrone gameofthrones winter is here
# BranStark like remember the 1st episode # JaimeLannister . Welcome to # winterfell bitch # GOT # GameofThrones # GoTS8 # GOT8 # GameofThronesSeason8pic.twitter.com/AD8Kdx2wLg,Pos,0.8,0.9,branstark like remember the 1st episode jaimelannister welcome to winterfell bitch got gameofthrones gots8 got8 gameofthronesseason8pic twitter com ad8kdx2wlg
Uai!! E termina assim,Neu,0.0,0.0,uai termina assim
# JamieLannister has aged 1000 years and just saw the ghost of his past,Neg,-0.175,0.325,jamielannister ha aged 1000 year and just saw the ghost of his past
Bran just gives off very rapey vibes. # GameOfThrones # GOT # GameOfThronesSeason8 # ThronesYall # DemThrones # GoTS8 # GOT8 # BranStark,Pos,0.2,0.3,bran just give off very rapey vibe gameofthrones got gameofthronesseason8 thronesyall demthrones gots8 got8 branstark
Bran be on that creep shit. # GameOfThrones # GOT # GameOfThronesSeason8 # ThronesYall # DemThrones # GoTS8 # GOT8 # BranStark,Neg,-0.2,0.8,bran be on that creep shit gameofthrones got gameofthronesseason8 thronesyall demthrones gots8 got8 branstark
. . ..Winter is Here.. . . Yasss. # AryaStark # TyrionLannister # JonSnow # DaenerysTargaryen # BranStark # BrienneOfTarth # SamwellTarly # SansaStark # TeamStargaryen # GameofThrones # GoT # GOT8 # GoTS8 # GameofThronesSeason8 # GoTseason8,Neu,0.0,0.0,winter is here yasss aryastark tyrionlannister jonsnow daenerystargaryen branstark brienneoftarth samwelltarly sansastark teamstargaryen gameofthrones got got8 gots8 gameofthronesseason8 gotseason8
Reencontro entre Starks # BranStark # JonSnow # ForTheThrone # GoTS8 # GoT # GameofThrones pic.twitter.com/J5rmiRTXDi,Neu,0.0,0.0,reencontro entre starks branstark jonsnow forthethrone gots8 got gameofthrones pic twitter com j5rmirtxdi
la puta madre # JonSnow & # BranStark # GameofThrones # ForTheThrone # got # GoTS8,Neu,0.0,0.0,la puta madre jonsnow branstark gameofthrones forthethrone got gots8
Time for # GameOfThrones! In the end,Neu,0.0,0.0,time for gameofthrones in the end
I am ready! # GameofThrones # GoTS8 # GOT # JonSnow # SansaStark # AryaStark # BranStark # Daenerys # ForTheThrone pic.twitter.com/4EOCH7BqJ1,Pos,0.25,0.5,i am ready gameofthrones gots8 got jonsnow sansastark aryastark branstark daenerys forthethrone pic twitter com 4eoch7bqj1
Los HT de hoy: # GameofThrones # ForTheThrone # PorElTrono # JonSnow # DaenerysTargaryen # TyrionLannister # CerseiLannister # JaimeLannister # AryaStark # SansaStark # BranStark # NightKing # GoTS8 # GoT # WinterIsHere,Neu,0.0,0.0,los ht de hoy gameofthrones forthethrone poreltrono jonsnow daenerystargaryen tyrionlannister cerseilannister jaimelannister aryastark sansastark branstark nightking gots8 got winterishere
Qué asco los que ponen Juego de tronos y un montón de hashtags sólo buscando fama # GameOfThrones # JuegoDeTronos # GameOfThronesSeason8 # GOT # GoTS8 # JuegoDeTronosEnVodafone # jdt # JonSnow # Daenerys # BranStark # chamichetaspic.twitter.com/RiltLffnKJ,Neu,0.0,0.0,qué asco los que ponen juego de tronos un montón de hashtags sólo buscando fama gameofthrones juegodetronos gameofthronesseason8 got gots8 juegodetronosenvodafone jdt jonsnow daenerys branstark chamichetaspic twitter com riltlffnkj
Les estoy explotando el tw de Game Of Thrones? Se joda cb espere 2 años # GOT # GoTS8 # GameOfThrones # ForTheThrone # DaenerysTargaryen # JonSnow # AryaStark # SansaStark # BranStark # Tyrion # CerseiLannister # JaimeLannister # BrienneOfTarth # TheonGreyjoy # TheHound # Jorah,Neg,-0.4,0.4,le estoy explotando el tw de game of throne se joda cb espere 2 años got gots8 gameofthrones forthethrone daenerystargaryen jonsnow aryastark sansastark branstark tyrion cerseilannister jaimelannister brienneoftarth theongreyjoy thehound jorah
