text,sentiment,polarity,subjectivity,Preprocess
# motherofdragons # daenerystargaryen # melisandre # jonsnow # aryastark # sansastark # branstark # samtarly # TyrionLannister # CerseiLannister # JaimeLannister # varys # got # GoTS8 # GameofThrones,Neu,0.0,0.0,motherofdragons daenerystargaryen melisandre jonsnow aryastark sansastark branstark samtarly tyrionlannister cerseilannister jaimelannister varys got gots8 gameofthrones
THE. WAITING. IS. REAL. IN. LESS. THAN. THREE. HOURS. IM. SO. NOT. READY. KDIDOFID9EOFIFJFIDOEROEIIF. # GameofThrones # GoT # gots8 # DONTTOUCHMYSTARKS # ANDTGEIMPASWELL # PLUSDEANERYSCOZMARELOVESHER # KILLCERSEIONCEANDFORALL # ForTheThrone # AryaStark # Sansa # JonSnow # BranStark pic.twitter.com/vL33XjMyKj,Neg,-0.175,0.3,the waiting is real in le than three hour im so not ready kdidofid9eofifjfidoeroeiif gameofthrones got gots8 donttouchmystarks andtgeimpaswell plusdeaneryscozmarelovesher killcerseionceandforall forthethrone aryastark sansa jonsnow branstark pic twitter com vl33xjmykj
Who’s next? # DaenerysTargaryen # JonSnow # CerseiLannister # AryaStark # JaimeLannister # TyrionLannister # SansaStark # BranStark # TheHound @ GameOfThrones # GOT # GOTS8 # GOT8 # GOTfinalseason # GameOfThrones # Endgame # Forthethrone # poreltorno # winteriscoming # GameofThronesSeason8pic.twitter.com/AgwNQUQhag,Neu,0.0,0.0,who next daenerystargaryen jonsnow cerseilannister aryastark jaimelannister tyrionlannister sansastark branstark thehound gameofthrones got gots8 got8 gotfinalseason gameofthrones endgame forthethrone poreltorno winteriscoming gameofthronesseason8pic twitter com agwnquqhag
..... que no termine!!!!!! # GameofThrones # GOT # GoTS8 # HouseStark # WinterIsHere # JonSnow # Sansa # AryaStark # BranStark https://twitter.com/RottenTomatoes/status/1117400106410610693 …,Neu,0.0,0.0,que no termine gameofthrones got gots8 housestark winterishere jonsnow sansa aryastark branstark http twitter com rottentomatoes status 1117400106410610693
last but not least before I dash off,Pos,0.075,0.23333333333333334,last but not least before dash off
 Kneel,Neu,0.0,0.0,kneel
I found all emoji hashtags of Game of Thrones S8 : # GameofThrones # ForTheThrone # GOT # GoTS8 》 # JonSnow # DaenerysTargaryen # Daenerys # SansaStark # Sansa # AryaStark # BranStark # TyrionLannister # Tyrion # CerseiLannister # Cersei # NightKing # Brienneoftarth # Brienne # DavosSeaworth,Neg,-0.4,0.4,i found all emoji hashtags of game of throne s8 gameofthrones forthethrone got gots8 jonsnow daenerystargaryen daenerys sansastark sansa aryastark branstark tyrionlannister tyrion cerseilannister cersei nightking brienneoftarth brienne davosseaworth
@ IPL cricketers and their Game of Thrones Equivalents # GameOfThrones # GoT # GoTS8 # ForTheThrone # GameofThronesSeason8 # thefinalseason # DaenerysTargaryen # JonSnow # AryaStark # TyrionLannister # SansaStark # BranStark # TheHound # CerseiLannister https://www.cricadium.com/ipl-cricketers-and-their-game-of-thrones-characters-equivalents/ …,Neg,-0.4,0.4,ipl cricketer and their game of throne equivalent gameofthrones got gots8 forthethrone gameofthronesseason8 thefinalseason daenerystargaryen jonsnow aryastark tyrionlannister sansastark branstark thehound cerseilannister http www cricadium com ipl cricketer and their game of throne character equivalent
# GoTS8 # GoT # GameOfThrones # ForTheThrone # BranStark # ThreeEyedRavenpic.twitter.com/DySMXBoqir,Neu,0.0,0.0,gots8 got gameofthrones forthethrone branstark threeeyedravenpic twitter com dysmxboqir
# aryastark # khaleesi # jonsnow # cersei # nightking # sansa # tyrion # brienne # branstark # GOT # gots8 # GameofThrones,Neu,0.0,0.0,aryastark khaleesi jonsnow cersei nightking sansa tyrion brienne branstark got gots8 gameofthrones
FINALMENTE HOJE!!! Via: GOT da depressão # Series # MaratonaDeSeries # ViciadosEmSeries # GoTS8 # DominGot # GameOfThrones # GOT # ForTheThrone # WinterIsHere # DaenerysTargaryen # IronThrone # JonSnow # NightKing # SansaStark # AryaStark # BranStark # CerseiLannisterpic.twitter.com/xYobnmoMOG,Neu,0.0,0.0,finalmente hoje via got da depressão series maratonadeseries viciadosemseries gots8 domingot gameofthrones got forthethrone winterishere daenerystargaryen ironthrone jonsnow nightking sansastark aryastark branstark cerseilannisterpic twitter com xyobnmomog
# JonSnow # DaenerysTargaryen # AryaStark # SansaStark # BranStark # TyrionLannister # CerseiLannister # JaimeLannister # JorahMormont # SamwellTarly # NightKing # WhiteWalkers # ForTheThrone # GameofThrones # GOT # GoTS8,Neu,0.0,0.0,jonsnow daenerystargaryen aryastark sansastark branstark tyrionlannister cerseilannister jaimelannister jorahmormont samwelltarly nightking whitewalkers forthethrone gameofthrones got gots8
The time has come. # GameofThrones # GoTS8 # ForTheThrone # DaenerysTargaryen # MotherOfDragons # Drogon # Rhaegal # AryaStark # AGirlIsNoOne # JorahMormont # SansaStark # TyrionLannister # SamwellTarly # BrienneOfTarth # Missandei # BranStark # DavosSeaworth # Podrick # Ghost # Nymeria # GoT,Neu,0.0,0.0,the time ha come gameofthrones gots8 forthethrone daenerystargaryen motherofdragons drogon rhaegal aryastark agirlisnoone jorahmormont sansastark tyrionlannister samwelltarly brienneoftarth missandei branstark davosseaworth podrick ghost nymeria got
¡¡¡EEESSS HHHOOOYYY!!! # AryaStark # Daenerys # Tyrion # JonSnow # Cersei # Sansa # BranStark # Theon # Varys # Missandei # TheHound # Greyworm # SerDavos # GameofThrones # GoTS8 # GOT # ForTheThronepic.twitter.com/QoOXszIxwh,Neu,0.0,0.0,eeesss hhhoooyyy aryastark daenerys tyrion jonsnow cersei sansa branstark theon varys missandei thehound greyworm serdavos gameofthrones gots8 got forthethronepic twitter com qooxszixwh
HOJE TEM GAME OF THRONES PORRAAAAAAAAAAAAN # GameOfThrones # GoTS8 # GoT # JonSnow # Tyrion # Cersei # Daenerys # Sansa # WhiteWalkers # Brienne # BranStark,Neg,-0.4,0.4,hoje tem game of throne porraaaaaaaaaaaan gameofthrones gots8 got jonsnow tyrion cersei daenerys sansa whitewalkers brienne branstark
Me after seeing game of thrones season 8 and realizing there won't be a season 9 # GOT # April14 # GameofThrones # GameofThronesSeason8 # JonSnow # Khaleesi # Cersei # Sansa # AryaStark # Tyrion # JorahMormont # BranStark # HouseStark # DavosSeaworth # TheonGreyjoy # GoTS8 pic.twitter.com/HBLUWUOxt5,Neg,-0.4,0.4,me after seeing game of throne season 8 and realizing there won be season 9 got april14 gameofthrones gameofthronesseason8 jonsnow khaleesi cersei sansa aryastark tyrion jorahmormont branstark housestark davosseaworth theongreyjoy gots8 pic twitter com hbluwuoxt5
Who Seats At The Iron Throne At The End Of # GameOfThrones - Odds # BranStark - 3 # JonSnow - 3.8 # DaenerysTargaryen - 5.5 # SansaStark - 7 # NightKing - 10 # AryaStark - 19 # CerseiLannister 23 Bet Here http://bit.ly/winsgot # GOT # GOTS8 # AccessBET # HBOpic.twitter.com/0ZSZ4tW6jt,Neu,0.0,0.0,who seat at the iron throne at the end of gameofthrones odds branstark 3 jonsnow 3 8 daenerystargaryen 5 5 sansastark 7 nightking 10 aryastark 19 cerseilannister 23 bet here http bit ly winsgot got gots8 accessbet hbopic twitter com 0zsz4tw6jt
Don't mind me. Just want to do this. # GoTs8 # GoT # AryaStark # SansaStark # Daenerys # DaenerysTargaryen # JonSnow # Cersei # CerseiLannister # JaimeLannister # Tyrion # TyrionLannister # WhiteWalkers # NightKing # GameofThrones # BranStark # Brienne # BrienneOfTarth # Theon # TheonGreyjoy,Neu,0.0,0.0,don mind me just want to do this gots8 got aryastark sansastark daenerys daenerystargaryen jonsnow cersei cerseilannister jaimelannister tyrion tyrionlannister whitewalkers nightking gameofthrones branstark brienne brienneoftarth theon theongreyjoy
http://bit.ly/2G3nKhP GAME OF THRONES SEASON 8 PREDICTIONS! # gameofthrones # gots8 # got # forthethrone # Daenerys # jonsnow # sansastark # tyrionlannister # thenightking # CerseiLannister # aryastark # branstark # serjorah # samwelltarly # serdavos # euron # theon # missandei # greywormpic.twitter.com/EVRXnohhhR,Neg,-0.5,0.4,http bit ly 2g3nkhp game of throne season 8 prediction gameofthrones gots8 got forthethrone daenerys jonsnow sansastark tyrionlannister thenightking cerseilannister aryastark branstark serjorah samwelltarly serdavos euron theon missandei greywormpic twitter com evrxnohhhr
# GameOfThrones # LooseEnds: Can Bran Change the Past? https://www.theringer.com/tv/2019/4/10/18303755/game-of-thrones-loose-ends-bran-stark-change-past?utm_campaign=theringer&utm_content=entry&utm_medium=social&utm_source=twitter … via @ ringer # BranStark # ChangeThePast # News # TV # HBO # GoT # GoTS8 # GameOfThronesLooseEnds # GameOfThronesSeason8 # Season8,Neg,-0.25,0.25,gameofthrones looseends can bran change the past http www theringer com tv 2019 4 10 18303755 game of throne loose end bran stark change past utm_campaign theringer utm_content entry utm_medium social utm_source twitter via ringer branstark changethepast news tv hbo got gots8 gameofthroneslooseends gameofthronesseason8 season8
# GameofThrones # GoTS8 # gameofthronesseason8 # gameofthronessaison8 # forthethrone # whitewalkers # aryastark # BrienneOfTarth # BranStark # TheHound # DaenerysTargaryen # aegontargaryen # jonsnow #targaryen#gameofthronesfinal # songoficeandfire # GameofThrones8 # gotseason8 # gots8final # got pic.twitter.com/lZlqSI9x4q,Neu,0.0,0.0,gameofthrones gots8 gameofthronesseason8 gameofthronessaison8 forthethrone whitewalkers aryastark brienneoftarth branstark thehound daenerystargaryen aegontargaryen jonsnow targaryen gameofthronesfinal songoficeandfire gameofthrones8 gotseason8 gots8final got pic twitter com lzlqsi9x4q
# GameofThrones # GoTS8 # GOT # GoTPremiereNYC Cast # RedCarpet Premiere # Gots # Video # Premiere # TV # TVShows # BranStark # SansaStark # Sansa # DavosSeaworth # Hodor # Missandei # Melisandre # Bronn # SophieTurner # NathalieEmmanuelpic.twitter.com/1Vx5SAhTqI,Neu,0.0,0.0,gameofthrones gots8 got gotpremierenyc cast redcarpet premiere gots video premiere tv tvshows branstark sansastark sansa davosseaworth hodor missandei melisandre bronn sophieturner nathalieemmanuelpic twitter com 1vx5sahtqi
# QuestForTheThrone has come up dry in # NiagaraFalls but I'm still a # starkbannerfolk # truenorthstrongandfree # GameOfThrones # GOT # GOTS8 # ForTheThrone # thepacksurvives # JonSnow # AryaStark # SansaStark # BranStark # NightKing # hashtagsfordayspic.twitter.com/41w8S7fn7D,Neg,-0.06666666666666665,0.6,questforthethrone ha come up dry in niagarafalls but m still starkbannerfolk truenorthstrongandfree gameofthrones got gots8 forthethrone thepacksurvives jonsnow aryastark sansastark branstark nightking hashtagsfordayspic twitter com 41w8s7fn7d
# BranStark . No doubt in this. Wait wait............ WTF! # AvegersEndGame. I am predicting both # CaptainAmerica & # TonyStark gonna die in the # ENDGAME. # GameofThrones # GOT # GoTS8 # FortheThrone # HBO # Marvel,Neg,-0.625,1.0,branstark no doubt in this wait wait wtf avegersendgame am predicting both captainamerica tonystark gonna die in the endgame gameofthrones got gots8 forthethrone hbo marvel
Cripples,Neu,0.0,0.0,cripple
# KingInTheNorth # AryaStark # SansaStark # BranStark # CerseiLannister # TyrionLannister # Khaleesi # DaenerysTargaryen # motherofdragons # ForTheThrone # GOT # GameOfThrones # GoTS8 https://twitter.com/GameOfThrones/status/1102962107203682304 …,Neu,0.0,0.0,kinginthenorth aryastark sansastark branstark cerseilannister tyrionlannister khaleesi daenerystargaryen motherofdragons forthethrone got gameofthrones gots8 http twitter com gameofthrones status 1102962107203682304
"“Everything you did brought you where you are now. Where you belong # BranStark # GameofThrones # Got # GoTS8 # JonSnow # AryaStark # SansaStark""",Neu,0.0,0.0,everything you did brought you where you are now where you belong branstark gameofthrones got gots8 jonsnow aryastark sansastark
# JaimeLannister # TyrionLannister # SansaStark # BranStark # PorElTrono # ForTheThrone # got # GoTS8 # GameOfThrones # FelizFindepic.twitter.com/Nu1A3NuMvZ,Neu,0.0,0.0,jaimelannister tyrionlannister sansastark branstark poreltrono forthethrone got gots8 gameofthrones felizfindepic twitter com nu1a3numvz
While you wait for the trailer check out this!!!! https://www.youtube.com/watch?v=tsDeh8xCbnk … Because winter is coming and we must protect ourselves! # GOT # GoTS8 # GameOfThrones # TheStarks # JonSnow # BranStark # SansaStark # AryaStark # WinterIsComing # WinterIsHere,Neu,0.0,0.0,while you wait for the trailer check out this http www youtube com watch tsdeh8xcbnk because winter is coming and we must protect ourselves got gots8 gameofthrones thestarks jonsnow branstark sansastark aryastark winteriscoming winterishere
Watch this!!!!!!!!!!!!! !!!!! https://www.youtube.com/watch?v=tsDeh8xCbnk … !!!!! # GOT # GameOfThrones # HouseStark # TheStarks # Stark # JonSnow # SansaStark # AryaStark # BranStark # HBO # ZackHemsey # GoTS8 # cersei # valarmoghulis # WinterIsComing # WinterIsHere # VideoEdit # CreativeVideo # Film # TVSeries,Neg,-0.2,0.6,watch this http www youtube com watch tsdeh8xcbnk got gameofthrones housestark thestarks stark jonsnow sansastark aryastark branstark hbo zackhemsey gots8 cersei valarmoghulis winteriscoming winterishere videoedit creativevideo film tvseries
