text,sentiment,polarity,subjectivity,Preprocess
In season 7 Lord Glover voices out his treasonous thoughts and almost strats a mutiny against # jonsnow https://youtu.be/wVbLCkwFoWg We did not choose you to rules,Neu,0.0,0.0,in season 7 lord glover voice out his treasonous thought and almost strats mutiny against jonsnow http youtu be wvblckwfowg we did not choose you to rule
Lord Glover makes a beautiful speech when he re-pledged his allegiance to the Starks,Pos,0.85,1.0,lord glover make beautiful speech when he re pledged his allegiance to the starks
Our old pal Lord Glover from the TV show. Let's just say he isn't the most reliable # jonsnow and # sansa hear a sounding no from Lord Glover back in season 6 https://youtu.be/dthVy3tS54s # GameofThrones # gots8 # GOT # ForTheThronepic.twitter.com/znEVnHhQ6s,Pos,0.19999999999999998,0.2333333333333333,our old pal lord glover from the tv show let just say he isn the most reliable jonsnow and sansa hear sounding no from lord glover back in season 6 http youtu be dthvy3ts54s gameofthrones gots8 got forthethronepic twitter com znevnhhq6s
Game Of Yeşilçam (5 TL bütçe ile # GoT ) . musaethem . nrllh.zn . yaseminzzz . . # got # gameofthrones # parody # kısafilm # gots8 # aryastark # jaimelannister # branstark # jonsnow # winterishere # daenerystargaryen… https://www.instagram.com/p/BwcqqkYAtI7/?igshid=19vn44bikye1r …,Neg,-0.4,0.4,game of yeşilçam 5 tl bütçe ile got musaethem nrllh zn yaseminzzz got gameofthrones parody kısafilm gots8 aryastark jaimelannister branstark jonsnow winterishere daenerystargaryen http www instagram com bwcqqkyati7 igshid 19vn44bikye1r
@ gameofthronesbr @ gotastweets @gameofcate @ hey_mika @ carolmoreira3 @ br_got @ GOTofThrones @ ThroneFacts @ThronesUpdate # GameofThrones # GameofThronesSeason8 # thewinterishere # JonSnow # Targaryen # GoTS8 # GOT,Neu,0.0,0.0,gameofthronesbr gotastweets gameofcate hey_mika carolmoreira3 br_got gotofthrones thronefacts thronesupdate gameofthrones gameofthronesseason8 thewinterishere jonsnow targaryen gots8 got
... now knows everything! # GameofThrones # GoT # GoTS8 # ForTheThrone # JonSnow # YouKnowNothingJonSnow # KingInTheNorth # Winterfell # KitHarington # BreakingBad # Chemistry # BigBangTheory # Physics # TVSeries # socialmediacalendar # socialmediamanagement # s… https://www.instagram.com/p/BwbjkwSg-Jv/ pic.twitter.com/DDbWe9KJaq,Neu,0.0,0.0,now know everything gameofthrones got gots8 forthethrone jonsnow youknownothingjonsnow kinginthenorth winterfell kitharington breakingbad chemistry bigbangtheory physic tvseries socialmediacalendar socialmediamanagement http www instagram com bwbjkwsg jv pic twitter com ddbwe9kjaq
well really # TMI he really ruined the scene for me ! whenever I saw it I remember his ball! # KitHarington # JonSnow # Jonerys # GameofThrones # got # GoTS8 # GameofThronesSeason8 # Daenerys,Pos,0.25625,0.2,well really tmi he really ruined the scene for me whenever saw it remember his ball kitharington jonsnow jonerys gameofthrones got gots8 gameofthronesseason8 daenerys
I can’t wait until Sunday night. # teamStark # AryaStark # JonSnow # AegonTargaryen # winteriscoming # GoT # GameOfThrones # GoTS8 # oreocookiespic.twitter.com/GQML0XscaU,Neu,0.0,0.0,i can wait until sunday night teamstark aryastark jonsnow aegontargaryen winteriscoming got gameofthrones gots8 oreocookiespic twitter com gqml0xscau
# GameOfThrones # GOT # GoTS8 # ForTheThrone # JonSnow # NightKing # BranStark # AryaStark # SansaStark # Khaleesi # TyrionLannister # DaenerysTargaryen # KingInTheNorth # WhiteWalkers… https://www.instagram.com/visuallords/p/Bwaidwoh0_O/?utm_source=ig_twitter_share&igshid=ydfyk1g0svkf …,Neu,0.0,0.0,gameofthrones got gots8 forthethrone jonsnow nightking branstark aryastark sansastark khaleesi tyrionlannister daenerystargaryen kinginthenorth whitewalkers http www instagram com visuallords bwaidwoh0_o utm_source ig_twitter_share igshid ydfyk1g0svkf
“Quando se joga o jogo dos tronos,Neu,0.0,0.0,quando se joga jogo do tronos
my drawings from 2017. for sale # Daenerys # draw # drawing # art # DaenerysTargaryen # GOTS8 # got # JonSnow # gotseason8 # GameofThrones # myart # myartwork # portrait # KitHarringtonpic.twitter.com/29jbomywc0,Neu,0.0,0.0,my drawing from 2017 for sale daenerys draw drawing art daenerystargaryen gots8 got jonsnow gotseason8 gameofthrones myart myartwork portrait kitharringtonpic twitter com 29jbomywc0
Choose the rightful heir to the Iron Throne. # GameOfThrones # Daenerys # JonSnow # Jonerys @ GameOfThrones @ HBO # GoTS8 @ Game # GOT (pls RT after voting),Neg,-0.4,0.4,choose the rightful heir to the iron throne gameofthrones daenerys jonsnow jonerys gameofthrones hbo gots8 game got pls rt after voting
This is an art Jon and Daenerys in # Gots8 . . . # KitHarington # EmiliaClarke # GameofThrones # Got # Gotseason8 # Gotseason7 # kimilia # kit # milly # jonerys # jonsnow # daenerys # targaryen… https://www.instagram.com/p/BwZvSK5pk1I/?utm_source=ig_twitter_share&igshid=1phl78w37qm02 …,Neu,0.0,0.0,this is an art jon and daenerys in gots8 kitharington emiliaclarke gameofthrones got gotseason8 gotseason7 kimilia kit milly jonerys jonsnow daenerys targaryen http www instagram com bwzvsk5pk1i utm_source ig_twitter_share igshid 1phl78w37qm02
Celebrate Game of Thrones' season 8 with these adorable Funko! Pops https://buff.ly/2UHnI9C # funkopop # popfigures # actiontoy # collectibles # toyfigures # toycollection # gameofthrones # GOT # HBO # JonSnow # Daenerys # NightKing # GOTS8 # babystoreae # dubai # uaepic.twitter.com/LWtpC9VKi2,Pos,0.11249999999999999,0.7,celebrate game of throne season 8 with these adorable funko pop http buff ly 2uhni9c funkopop popfigures actiontoy collectible toyfigures toycollection gameofthrones got hbo jonsnow daenerys nightking gots8 babystoreae dubai uaepic twitter com lwtpc9vki2
Winter is Here. Which side are you on? # GameOfThrones # TheMindOfReyRey # GOT # GoTS8 # ForTheThrone # JonSnow # NightKing # BranStark # AryaStark # SansaStark # Khaleesi # TyrionLannister # DaenerysTargaryen # KingInTheNorth # WhiteWalkers # MotherOfDragons # JaimeLannister # WinterIsComingpic.twitter.com/ptTzTOavVJ,Neu,0.0,0.0,winter is here which side are you on gameofthrones themindofreyrey got gots8 forthethrone jonsnow nightking branstark aryastark sansastark khaleesi tyrionlannister daenerystargaryen kinginthenorth whitewalkers motherofdragons jaimelannister winteriscomingpic twitter com pttztoavvj
“Game of Thrones” y la producción https://www.milenio.com/opinion/alvaro-cueva/el-pozo-de-los-deseos-reprimidos/game-of-thrones-y-la-produccion … Milenio @ HBO @ HBOLAT @ GameOfThrones # GameofThrones # Bran # Daenerys # HBOGO # Sansa # Arya # Jaime # JonSnow # Cersei # GOT # GoTS8 # GOT8 # HBOpic.twitter.com/cYFPRgOr6S,Neg,-0.4,0.4,game of throne la producción http www milenio com opinion alvaro cueva el pozo de los deseos reprimidos game of throne la produccion milenio hbo hbolat gameofthrones gameofthrones bran daenerys hbogo sansa arya jaime jonsnow cersei got gots8 got8 hbopic twitter com cyfprgor6s
♡ THREAD DE GIFS DEL REENCUENTRO MÁS ESPERADO ♡ Obviamente protagonizado por # JonSnow y # AryaStark # GameofThrones # GOT # ForTheThrone # GOTS8 pic.twitter.com/9GJ2TWdq0A,Neu,0.0,0.0,thread de gifs del reencuentro más esperado obviamente protagonizado por jonsnow aryastark gameofthrones got forthethrone gots8 pic twitter com 9gj2twdq0a
SE VAN A MATAAAAAAAR # JONSNOW LPM HAZ ALGO ESTÁS EN MEDIO AMIGO DATE CUENTA PORQUE SINO PELEA DE GATAS IN COMING Y LOS WHITE WALKERS APROVECHARAN ESO A SU FAVOR # GameOfThrones # GOT # ForTheThrone # GOTS8 pic.twitter.com/kYd5W3yN2c,Neu,0.0,0.0,se van mataaaaaaar jonsnow lpm haz algo estás en medio amigo date cuenta porque sino pelea de gatas in coming los white walker aprovecharan eso su favor gameofthrones got forthethrone gots8 pic twitter com kyd5w3yn2c
Posted withrepost • @ themindofreyrey Winter is Here. Which side are you on? # GameOfThrones # TheMindOfReyRey # GOT # GoTS8 # ForTheThrone # JonSnow # NightKing # BranStark # AryaStark… https://www.instagram.com/visuallords/p/BwX6z_8hmEj/?utm_source=ig_twitter_share&igshid=ownl8ldy2wzl …,Neu,0.0,0.0,posted withrepost themindofreyrey winter is here which side are you on gameofthrones themindofreyrey got gots8 forthethrone jonsnow nightking branstark aryastark http www instagram com visuallords bwx6z_8hmej utm_source ig_twitter_share igshid ownl8ldy2wzl
Winter is Here. Which side are you on? # GameOfThrones # TheMindOfReyRey # GOT # GoTS8 # ForTheThrone # JonSnow # NightKing # BranStark # AryaStark # SansaStark # Khaleesi # TyrionLannister… https://www.instagram.com/p/BwX5bLqA6q6/?utm_source=ig_twitter_share&igshid=1mtlqe82jox23 …,Neu,0.0,0.0,winter is here which side are you on gameofthrones themindofreyrey got gots8 forthethrone jonsnow nightking branstark aryastark sansastark khaleesi tyrionlannister http www instagram com bwx5blqa6q6 utm_source ig_twitter_share igshid 1mtlqe82jox23
12$ T-SHIRT http://QWERTEE.COM # gameofthrones # got # winterishere # gots8 # demthrones # jonsnow # winteriscoming # gameofthronesseason8 # khaleesi # motherofdragons # Daenerys # Juegodetronos # stark # lannister # baratheon # jonsnow # forthethrone # got8 # winterfell # westeros # nightkingpic.twitter.com/GGlaINhW9k,Neg,-0.2,0.6,12 shirt http qwertee com gameofthrones got winterishere gots8 demthrones jonsnow winteriscoming gameofthronesseason8 khaleesi motherofdragons daenerys juegodetronos stark lannister baratheon jonsnow forthethrone got8 winterfell westeros nightkingpic twitter com gglainhw9k
New episode stills from # Gots8 episode 2 # forthethrone . . # KitHarington # EmiliaClarke # GameofThrones # Got # Gotseason8 # Gotseason7 # kimilia # kit # milly # jonerys # jonsnow # daenerys… https://www.instagram.com/p/BwXdpCChhzx/?utm_source=ig_twitter_share&igshid=7ho3vxbbcnrg …,Pos,0.13636363636363635,0.45454545454545453,new episode still from gots8 episode 2 forthethrone kitharington emiliaclarke gameofthrones got gotseason8 gotseason7 kimilia kit milly jonerys jonsnow daenerys http www instagram com bwxdpcchhzx utm_source ig_twitter_share igshid 7ho3vxbbcnrg
New stills from # Gots8 . . # KitHarington # EmiliaClarke # GameofThrones # Got # Gotseason8 # Gotseason7 # kimilia # kit # milly # jonerys # jonsnow # daenerys # targaryen # dragon # wolf # winterfell… https://www.instagram.com/p/BwXdVHkBKGQ/?utm_source=ig_twitter_share&igshid=j5sr85rrfb8v …,Pos,0.13636363636363635,0.45454545454545453,new still from gots8 kitharington emiliaclarke gameofthrones got gotseason8 gotseason7 kimilia kit milly jonerys jonsnow daenerys targaryen dragon wolf winterfell http www instagram com bwxdvhkbkgq utm_source ig_twitter_share igshid j5sr85rrfb8v
Daenerys Targaryen in # Gots8 episode 2 . . # KitHarington # EmiliaClarke # GameofThrones # Got # Gotseason8 # Gotseason7 # kimilia # kit # milly # jonerys # jonsnow # daenerys # targaryen # dragon… https://www.instagram.com/p/BwXdNbrB-jX/?utm_source=ig_twitter_share&igshid=15ck12i2m98p5 …,Neu,0.0,0.0,daenerys targaryen in gots8 episode 2 kitharington emiliaclarke gameofthrones got gotseason8 gotseason7 kimilia kit milly jonerys jonsnow daenerys targaryen dragon http www instagram com bwxdnbrb jx utm_source ig_twitter_share igshid 15ck12i2m98p5
* * . * . * . * . *. * Essa conta * . . * * * . vai compartilhar .* . * . mil spoilers de GoT * . * . . *. * . * . . # GameofThrones # got # GoTS8 # ForTheThrone # Daenerys # JonSnow pic.twitter.com/6zghYUl5ok,Neu,0.0,0.0,essa conta vai compartilhar mil spoiler de got gameofthrones got gots8 forthethrone daenerys jonsnow pic twitter com 6zghyul5ok
"¡Game of Thrones"" y su dinero! https://www.milenio.com/opinion/alvaro-cueva/el-pozo-de-los-deseos-reprimidos/game-of-thrones-y-el-dinero … @ GameOfThrones @ HBO @ HBOLAT # GameofThrones # Bran # Daenerys # HBOGO # Sansa # Arya # Jaime # JonSnow # Cersei # GOT # GoTS8 # GOT8 # HBOpic.twitter.com/vySRHXDZRZ""",Neu,0.0,0.0,game of throne su dinero http www milenio com opinion alvaro cueva el pozo de los deseos reprimidos game of throne el dinero gameofthrones hbo hbolat gameofthrones bran daenerys hbogo sansa arya jaime jonsnow cersei got gots8 got8 hbopic twitter com vysrhxdzrz
"Game of Thrones"" y su dinero! https://www.milenio.com/opinion/alvaro-cueva/el-pozo-de-los-deseos-reprimidos/game-of-thrones-y-el-dinero … @ GameOfThrones @ HBO @ HBOLAT # GameofThrones # Bran # Daenerys # HBOGO # Sansa # Arya # Jaime # JonSnow # Cersei # GOT # GoTS8 # GOT8 # HBOpic.twitter.com/VIaDwDdZvQ""",Neg,-0.5,0.4,game of throne su dinero http www milenio com opinion alvaro cueva el pozo de los deseos reprimidos game of throne el dinero gameofthrones hbo hbolat gameofthrones bran daenerys hbogo sansa arya jaime jonsnow cersei got gots8 got8 hbopic twitter com viadwddzvq
"¡Game of Thrones"" y su dinero https://www.milenio.com/opinion/alvaro-cueva/el-pozo-de-los-deseos-reprimidos/game-of-thrones-y-el-dinero … @ GameOfThrones @ HBO @ HBOLAT # GameofThrones # Bran # Daenerys # HBOGO # Sansa # Arya # Jaime # JonSnow # Cersei # GOT # GoTS8 # GOT8 # HBOpic.twitter.com/KBykp1iRyy""",Neu,0.0,0.0,game of throne su dinero http www milenio com opinion alvaro cueva el pozo de los deseos reprimidos game of throne el dinero gameofthrones hbo hbolat gameofthrones bran daenerys hbogo sansa arya jaime jonsnow cersei got gots8 got8 hbopic twitter com kbykp1iryy
# BranStark prevendo a morte de # JonSnow que ocorre nos eventos finais de Dança dos Dragões,Neu,0.0,0.0,branstark prevendo morte de jonsnow que ocorre no eventos finais de dança do dragões
"Game of Thrones"" y su dinero https://www.milenio.com/opinion/alvaro-cueva/el-pozo-de-los-deseos-reprimidos/game-of-thrones-y-el-dinero … @ GameOfThrones @ HBO @ HBOLAT # GameofThrones # Bran # Daenerys # HBOGO # Sansa # Arya # Jaime # JonSnow # Cersei # GOT # GoTS8 # GOT8 # HBOpic.twitter.com/NeNPYYmddr""",Neg,-0.4,0.4,game of throne su dinero http www milenio com opinion alvaro cueva el pozo de los deseos reprimidos game of throne el dinero gameofthrones hbo hbolat gameofthrones bran daenerys hbogo sansa arya jaime jonsnow cersei got gots8 got8 hbopic twitter com nenpyymddr
That smile thoo... # Gots8 . . . # KitHarington # EmiliaClarke # GameofThrones # Got # Gotseason8 # Gotseason7 # kimilia # kit # milly # jonerys # jonsnow # daenerys # targaryen # dragon # wolf… https://www.instagram.com/p/BwW5syKJE_Z/?utm_source=ig_twitter_share&igshid=1v89b7ow2n991 …,Pos,0.3,0.1,that smile thoo gots8 kitharington emiliaclarke gameofthrones got gotseason8 gotseason7 kimilia kit milly jonerys jonsnow daenerys targaryen dragon wolf http www instagram com bww5sykje_z utm_source ig_twitter_share igshid 1v89b7ow2n991
"¡Game of Thrones"" y el dinero! https://www.milenio.com/opinion/alvaro-cueva/el-pozo-de-los-deseos-reprimidos/game-of-thrones-y-el-dinero … @ GameOfThrones @ HBO @ HBOLAT # GameofThrones # Bran # Daenerys # HBOGO # Sansa # Arya # Jaime # JonSnow # Cersei # GOT # GoTS8 # GOT8 # HBOpic.twitter.com/c2JTeG8kCY""",Neu,0.0,0.0,game of throne el dinero http www milenio com opinion alvaro cueva el pozo de los deseos reprimidos game of throne el dinero gameofthrones hbo hbolat gameofthrones bran daenerys hbogo sansa arya jaime jonsnow cersei got gots8 got8 hbopic twitter com c2jteg8kcy
"Game of Thrones"" y el dinero! https://www.milenio.com/opinion/alvaro-cueva/el-pozo-de-los-deseos-reprimidos/game-of-thrones-y-el-dinero … @ GameOfThrones @ HBO @ HBOLAT # GameofThrones # Bran # Daenerys # HBOGO # Sansa # Arya # Jaime # JonSnow # Cersei # GOT # GoTS8 # GOT8 # HBOpic.twitter.com/NdcUURlJQY""",Neg,-0.5,0.4,game of throne el dinero http www milenio com opinion alvaro cueva el pozo de los deseos reprimidos game of throne el dinero gameofthrones hbo hbolat gameofthrones bran daenerys hbogo sansa arya jaime jonsnow cersei got gots8 got8 hbopic twitter com ndcuurljqy
On repart du côté des produits dérivés # GameofThrones avec cette fois ' # JonSnow ne sait rien' et c’est ce mug # GoT qui le dit ! # MaXoERama # MaXoEFocus # GoTS8 # ForTheThrone http://www.maxoe.com/rama/culture-news/actu-tele/jon-snow-ne-sait-rien-cest-ce-mug-game-of-thrones-qui-le-dit/ …,Neu,0.0,0.0,on repart du côté de produits dérivés gameofthrones avec cette fois jonsnow ne sait rien et est ce mug got qui le dit maxoerama maxoefocus gots8 forthethrone http www maxoe com rama culture news actu tele jon snow ne sait rien cest ce mug game of throne qui le dit
... has bent the knees,Neu,0.0,0.0,ha bent the knee
"¡Game of Thrones"" y el dinero https://www.milenio.com/opinion/alvaro-cueva/el-pozo-de-los-deseos-reprimidos/game-of-thrones-y-el-dinero … @ GameOfThrones @ HBO @ HBOLAT # GameofThrones # Bran # Daenerys # HBOGO # Sansa # Arya # Jaime # JonSnow # Cersei # GOT # GoTS8 # GOT8 # HBOpic.twitter.com/G1tltplOKh""",Neu,0.0,0.0,game of throne el dinero http www milenio com opinion alvaro cueva el pozo de los deseos reprimidos game of throne el dinero gameofthrones hbo hbolat gameofthrones bran daenerys hbogo sansa arya jaime jonsnow cersei got gots8 got8 hbopic twitter com g1tltplokh
# gameofthrones # GoT # season8 # cousins # aladdin # romance # magicdragonride # daenerys # jonsnow # GoTs8 # icequeen # motherofdragons # awholenewworld # icanshowyoutheworldpic.twitter.com/t0VwInhRVw,Neu,0.0,0.0,gameofthrones got season8 cousin aladdin romance magicdragonride daenerys jonsnow gots8 icequeen motherofdragons awholenewworld icanshowyoutheworldpic twitter com t0vwinhrvw
"Game of Thrones"" y el dinero https://www.milenio.com/opinion/alvaro-cueva/el-pozo-de-los-deseos-reprimidos/game-of-thrones-y-el-dinero … @ GameOfThrones @ HBO @ HBOLAT # GameofThrones # Bran # Daenerys # HBOGO # Sansa # Arya # Jaime # JonSnow # Cersei # GOT # GoTS8 # GOT8 # HBOpic.twitter.com/MlpfzhLPBj""",Neg,-0.4,0.4,game of throne el dinero http www milenio com opinion alvaro cueva el pozo de los deseos reprimidos game of throne el dinero gameofthrones hbo hbolat gameofthrones bran daenerys hbogo sansa arya jaime jonsnow cersei got gots8 got8 hbopic twitter com mlpfzhlpbj
For those who need some badass lines to fuel up their leadership appetite,Neu,0.0,0.0,for those who need some badass line to fuel up their leadership appetite
My favourite scene. # gameofthrones # got # jonsnow # hbo # daenerystargaryen # daenerys # stark # winteriscoming # forthethrone # khaleesi # kiss # love # illustration # meme # gots8 # motherofdragons https://www.instagram.com/p/BwV2zvJAdXm/?utm_source=ig_twitter_share&igshid=eoz4tiju44hm …,Pos,0.15,0.6,my favourite scene gameofthrones got jonsnow hbo daenerystargaryen daenerys stark winteriscoming forthethrone khaleesi kiss love illustration meme gots8 motherofdragons http www instagram com bwv2zvjadxm utm_source ig_twitter_share igshid eoz4tiju44hm
Last Sunday night is the largest night of streaming activity ever for HBO # GameOfThrones # ForTheThrone # GOTS8 # GoT # ratings # HBO # TVratings # Winterfell # JonSnow # AryaStark # BranStark # SansaStark # Daenerys # JaimeLannister # Cersei # Tyrion https://geekspin.co/game-of-thrones-season-8-premiere-ratings/ … via @ geekspinco,Neu,0.0,0.06666666666666667,last sunday night is the largest night of streaming activity ever for hbo gameofthrones forthethrone gots8 got rating hbo tvratings winterfell jonsnow aryastark branstark sansastark daenerys jaimelannister cersei tyrion http geekspin co game of throne season 8 premiere rating via geekspinco
Main cast members like Kit Harington and Emilia Clarke are reportedly making $500,Pos,0.16666666666666666,0.3333333333333333,main cast member like kit harington and emilia clarke are reportedly making 500
GAME OF PHONES! # GameofThrones # GOT # GoTS8 # JonSnow # Cersei # DavosSeaworth # AryaStark # Sansa # SamTarly # TercaDetremuraSDVpic.twitter.com/hwlXdnYq3b,Neg,-0.5,0.4,game of phone gameofthrones got gots8 jonsnow cersei davosseaworth aryastark sansa samtarly tercadetremurasdvpic twitter com hwlxdnyq3b
Poor # JonSnow can’t catch a break. # GoT # GoTS8 # GameOfThrones # GameOfThronesMemes # FlavorOfThronespic.twitter.com/WFthpfbxa6,Neg,-0.4,0.6,poor jonsnow can catch break got gots8 gameofthrones gameofthronesmemes flavorofthronespic twitter com wfthpfbxa6
They're really is really weird but they're still a hot couple # got # gameofthrones # season8 # gots8 # jonsnow # aegontargaryen # daenerystargaryen # housestark # housetargaryen # gotfanart # gameofthronesfanartpic.twitter.com/jLWixh4VL9,Neg,-0.125,0.925,they re really is really weird but they re still hot couple got gameofthrones season8 gots8 jonsnow aegontargaryen daenerystargaryen housestark housetargaryen gotfanart gameofthronesfanartpic twitter com jlwixh4vl9
C'mon # BranStark # Khaleesi # JonSnow # GameofThrones # Got # GoTS8 pic.twitter.com/V8og80PTCA,Neu,0.0,0.0,c mon branstark khaleesi jonsnow gameofthrones got gots8 pic twitter com v8og80ptca
# GameofThrones inspired keychains & custom jewelry available! House Stark / Targaryen with CZ crystal dangles $10ea + shipping,Pos,0.15,0.5,gameofthrones inspired keychains custom jewelry available house stark targaryen with cz crystal dangles 10ea shipping
# GameOfThrones # DaenerysTargaryen # JonSnow # Jonerys # GOT # ForTheThrone # GoTS8 # gotseason8 # GameofThroneseason8pic.twitter.com/8AZMb2JCdy,Neu,0.0,0.0,gameofthrones daenerystargaryen jonsnow jonerys got forthethrone gots8 gotseason8 gameofthroneseason8pic twitter com 8azmb2jcdy
# JonSnow chegou no meu portfólio! # GameofThrones # GoT # GoTS8 : http://instagram.com/mremanuelsantos pic.twitter.com/cZvg4S0zbr,Neu,0.0,0.0,jonsnow chegou no meu portfólio gameofthrones got gots8 http instagram com mremanuelsantos pic twitter com czvg4s0zbr
E os amiguinhos só de olho... # gameofthrones # got # gameofthronesseason8 # gots8 # hbo # hbogo # jonsnow # daenerystargaryen # daeneryspic.twitter.com/0R3tV8zEoo,Neu,0.0,0.0,e o amiguinhos só de olho gameofthrones got gameofthronesseason8 gots8 hbo hbogo jonsnow daenerystargaryen daeneryspic twitter com 0r3tv8zeoo
Time to marathon GOT Season 7 again # GameofThrones # GOT # GoTS8 # northremembers # KingInTheNorth # IronThrone # thedragonqueen # Targaryen # JonSnow # aegontargaryen # Stark # Winterfell # NightKing # AryaStark # Sansa # Tyrion # Daenerys # youknownothingjonsnow https://www.imdb.com/title/tt0944947/ …,Neg,-0.2,0.6,time to marathon got season 7 again gameofthrones got gots8 northremembers kinginthenorth ironthrone thedragonqueen targaryen jonsnow aegontargaryen stark winterfell nightking aryastark sansa tyrion daenerys youknownothingjonsnow http www imdb com title tt0944947
"¡Game of Thrones"" y su público! https://www.milenio.com/opinion/alvaro-cueva/el-pozo-de-los-deseos-reprimidos/game-of-thrones-y-el-publico … @ Milenio @ HBO @ HBOLAT @ GameOfThrones # GameofThrones # Bran # Daenerys # HBOGO # Sansa # Arya # Jaime # JonSnow # Cersei # GOT # GoTS8 # GOT8 # HBOpic.twitter.com/AGodJ0DyUJ""",Neu,0.0,0.0,game of throne su público http www milenio com opinion alvaro cueva el pozo de los deseos reprimidos game of throne el publico milenio hbo hbolat gameofthrones gameofthrones bran daenerys hbogo sansa arya jaime jonsnow cersei got gots8 got8 hbopic twitter com agodj0dyuj
"Game of Thrones"" y su público! https://www.milenio.com/opinion/alvaro-cueva/el-pozo-de-los-deseos-reprimidos/game-of-thrones-y-el-publico … @ Milenio @ HBO @ HBOLAT @ GameOfThrones # GameofThrones # Bran # Daenerys # HBOGO # Sansa # Arya # Jaime # JonSnow # Cersei # GOT # GoTS8 # GOT8 # HBOpic.twitter.com/lvk2ZPsh2s""",Neg,-0.5,0.4,game of throne su público http www milenio com opinion alvaro cueva el pozo de los deseos reprimidos game of throne el publico milenio hbo hbolat gameofthrones gameofthrones bran daenerys hbogo sansa arya jaime jonsnow cersei got gots8 got8 hbopic twitter com lvk2zpsh2s
"¡Game of Thrones"" y su público https://www.milenio.com/opinion/alvaro-cueva/el-pozo-de-los-deseos-reprimidos/game-of-thrones-y-el-publico … @ Milenio @ HBO @ HBOLAT @ GameOfThrones # GameofThrones # Bran # Daenerys # HBOGO # Sansa # Arya # Jaime # JonSnow # Cersei # GOT # GoTS8 # GOT8 # HBOpic.twitter.com/FwWZKG7RAf""",Neu,0.0,0.0,game of throne su público http www milenio com opinion alvaro cueva el pozo de los deseos reprimidos game of throne el publico milenio hbo hbolat gameofthrones gameofthrones bran daenerys hbogo sansa arya jaime jonsnow cersei got gots8 got8 hbopic twitter com fwwzkg7raf
Oh sentite io taggo # gotspoilers,Neu,0.0,0.0,oh sentite io taggo gotspoilers
"Game of Thrones"" y su público https://www.milenio.com/opinion/alvaro-cueva/el-pozo-de-los-deseos-reprimidos/game-of-thrones-y-el-publico … @ Milenio @ HBO @ HBOLAT @ GameOfThrones # GameofThrones # Bran # Daenerys # HBOGO # Sansa # Arya # Jaime # JonSnow # Cersei # GOT # GoTS8 # GOT8 # HBOpic.twitter.com/ZdG2wHOgjC""",Neg,-0.4,0.4,game of throne su público http www milenio com opinion alvaro cueva el pozo de los deseos reprimidos game of throne el publico milenio hbo hbolat gameofthrones gameofthrones bran daenerys hbogo sansa arya jaime jonsnow cersei got gots8 got8 hbopic twitter com zdg2whogjc
Did you notice the parallels,Neu,0.0,0.0,did you notice the parallel
"¡Game of Thrones"" y el público! https://www.milenio.com/opinion/alvaro-cueva/el-pozo-de-los-deseos-reprimidos/game-of-thrones-y-el-publico … @ Milenio @ HBO @ HBOLAT @ GameOfThrones # GameofThrones # Bran # Daenerys # HBOGO # Sansa # Arya # Jaime # JonSnow # Cersei # GOT # GoTS8 # GOT8 # HBOpic.twitter.com/sRm7X6M7S9""",Neu,0.0,0.0,game of throne el público http www milenio com opinion alvaro cueva el pozo de los deseos reprimidos game of throne el publico milenio hbo hbolat gameofthrones gameofthrones bran daenerys hbogo sansa arya jaime jonsnow cersei got gots8 got8 hbopic twitter com srm7x6m7s9
