text,sentiment,polarity,subjectivity,Preprocess
¿Que fue lo mejor del primer capítulo de la 8va temporada Game of Thrones? # GameofThrones # GameofThronesSeason8 # ForTheThrone # GameOfThornes # got # GoTS8 # JonSnow # SamwellTarly # Daenerys # AryaStark # BranStark # bran # HBOGOLA # HBOLAT # JuegodeTronos # GoTFinalSeason # sansastark,Neg,-0.4,0.4,que fue lo mejor del primer capítulo de la 8va temporada game of throne gameofthrones gameofthronesseason8 forthethrone gameofthornes got gots8 jonsnow samwelltarly daenerys aryastark branstark bran hbogola hbolat juegodetronos gotfinalseason sansastark
¿Que te pareció el primer capítulo de la 8va temporada Game of Thrones? # GameofThrones # GameofThronesSeason8 # ForTheThrone # GameOfThornes # got # GoTS8 # JonSnow # SamwellTarly # Daenerys # AryaStark # BranStark # bran # HBOGOLA # HBOLAT # JuegodeTronos # GoTFinalSeason # sansastark # dragon,Neg,-0.4,0.4,que te pareció el primer capítulo de la 8va temporada game of throne gameofthrones gameofthronesseason8 forthethrone gameofthornes got gots8 jonsnow samwelltarly daenerys aryastark branstark bran hbogola hbolat juegodetronos gotfinalseason sansastark dragon
# GameofThronesSeason8 premiered today and we cannot contain the feels! Catch the break-down here! @ GameOfThrones @ HBOINDIA # GameofThrones # GoT # GoTS8 # got # JonSnow # ForTheThrone https://www.peepingmoon.com/news/news/28240/Spoilers-Alert-Game-of-Thrones-Season-The-first-episode-is-here-and-is-so-much-more-than-what-we-expected.html …,Neu,0.0,0.0,gameofthronesseason8 premiered today and we cannot contain the feel catch the break down here gameofthrones hboindia gameofthrones got gots8 got jonsnow forthethrone http www peepingmoon com news news 28240 spoiler alert game of throne season the first episode is here and is so much more than what we expected html
love that # nedstark told # jonsnow the next time they saw each other that he'll tell him the truth about his mother .... and tonight jon went to the crypts to see ned and sam told him everything # got # gameofthrones # GameofThronesSeason8 # gameofthrones # GoTS8 # GOT8,Pos,0.125,0.325,love that nedstark told jonsnow the next time they saw each other that he ll tell him the truth about his mother and tonight jon went to the crypt to see ned and sam told him everything got gameofthrones gameofthronesseason8 gameofthrones gots8 got8
Ingenious to end S01E01 and S08E01 with the same interaction imo # GameOfThrones # GoT # GoTS8 # ForTheThrone! # JonSnow # TeamJonSnow,Pos,0.25,0.5625,ingenious to end s01e01 and s08e01 with the same interaction imo gameofthrones got gots8 forthethrone jonsnow teamjonsnow
Alors ce premier épisode de # GOTS8,Neu,0.0,0.0,alors ce premier épisode de gots8
So the first episode of # GameofThrones seemed pretty conveniently made for all characters introduction and their withstanding purpose,Pos,0.25,0.6666666666666666,so the first episode of gameofthrones seemed pretty conveniently made for all character introduction and their withstanding purpose
Por fiiin llego este hermoso momento,Neu,0.0,0.0,por fiiin llego este hermoso momento
# GameofThrones # JonSNOW # DaenerysTARGARYEN # SansaSTARK # AryaSTARK # BranSTARK # CerseiLANNISTER # ReapersGaming # JaimeLANNISTER # TyrionLANNISTER # NightKing # GOT # GOTS8 # AegonTargaryen # TheonGreyjoy # ForTheThrone # EuronGreyjoy,Neu,0.0,0.0,gameofthrones jonsnow daenerystargaryen sansastark aryastark branstark cerseilannister reapersgaming jaimelannister tyrionlannister nightking got gots8 aegontargaryen theongreyjoy forthethrone eurongreyjoy
# GameofThrones # JonSNOW # DaenerysTARGARYEN # SansaSTARK # AryaSTARK # BranSTARK # CerseiLANNISTER # ReapersGaming # JaimeLANNISTER # TyrionLANNISTER # NightKing # GOT # GOTS8 # AegonTargaryen # TheonGreyjoy # ForTheThrone # EuronGreyjoy,Neu,0.0,0.0,gameofthrones jonsnow daenerystargaryen sansastark aryastark branstark cerseilannister reapersgaming jaimelannister tyrionlannister nightking got gots8 aegontargaryen theongreyjoy forthethrone eurongreyjoy
AMAZING episode of # GameofThrones this is gonna be an awesome 6 weeks!!! # GOT # GoTS8 # WinterIsHere # JonSnow,Pos,0.8,0.95,amazing episode of gameofthrones this is gonna be an awesome 6 week got gots8 winterishere jonsnow
Nunca salieron los dragones... # GameofThrones # Got # GoTS8 # GameofThronesSeason8 # Daenerys # JonSnow pic.twitter.com/asITJSLPfH,Neu,0.0,0.0,nunca salieron los dragones gameofthrones got gots8 gameofthronesseason8 daenerys jonsnow pic twitter com asitjslpfh
# GoTS8 # GameofThrones # GOT # aryastark # AegonTargaryen # JonSnow https://twitter.com/jemelehill/status/1117625033931874307 …,Neu,0.0,0.0,gots8 gameofthrones got aryastark aegontargaryen jonsnow http twitter com jemelehill status 1117625033931874307
Quand Jon Snow apprends que la femme qui kiffer baisé est sa tante ( Daenerys ) # GameofThrones # GoTs8 # GoT # GameofThronesSeason8 # JonSnow # Daeneryspic.twitter.com/7pmMxPVuIW,Neu,0.0,0.0,quand jon snow apprends que la femme qui kiffer baisé est sa tante daenerys gameofthrones gots8 got gameofthronesseason8 jonsnow daeneryspic twitter com 7pmmxpvuiw
Nunca fuiste un bastardo. Eres # AegonTargaryen,Neu,0.0,0.0,nunca fuiste un bastardo eres aegontargaryen
Alguien sabe si telerisa prensa ya público que su repetición de la Rosa de Guadalupe apalsto todos los programas del mundo mundial y opaco el estreno de # GameofThrones # GOT # GoTS8 # Daenerys # JonSnow pic.twitter.com/30uCWsbtEw,Neu,0.0,0.0,alguien sabe si telerisa prensa ya público que su repetición de la rosa de guadalupe apalsto todos los programas del mundo mundial opaco el estreno de gameofthrones got gots8 daenerys jonsnow pic twitter com 30ucwsbtew
GoT Season 8 Episode 1 is out See more: https://bit.ly/2GmT4JF # GameofThronesSeason8 # GameofThrones # GoT # JonSnow # GoTS8 # gotseason8 # GotS8E1 # DaenerysTargaryen # Daenerys # Targaryen # ForTheThrone # WhiteWalkers # WinterIsHere # GameofThronesFinale # Lannister # Starks,Pos,0.5,0.5,got season 8 episode 1 is out see more http bit ly 2gmt4jf gameofthronesseason8 gameofthrones got jonsnow gots8 gotseason8 gots8e1 daenerystargaryen daenerys targaryen forthethrone whitewalkers winterishere gameofthronesfinale lannister starks
Jon Snow's face # GOT # GameofThrones # JonSnow # KitHarington # GoTS8 # KingInTheNorth # skydether # Khaleesipic.twitter.com/JYx2hcYfhV,Neu,0.0,0.0,jon snow face got gameofthrones jonsnow kitharington gots8 kinginthenorth skydether khaleesipic twitter com jyx2hcyfhv
The reunion we've all been waiting for.. # AryaStark X # JonSnow # AryaStark X # Gendry # Thronesyall # GameofThrones # GoTS8 # ForTheThrone # GameofThronesSeason8 # # WinterIsHere # GoT8 # GoT https://www.instagram.com/p/BwQt2ROl-Sw/?utm_source=ig_twitter_share&igshid=1av6mjjzq4df9 …,Neu,0.0,0.0,the reunion we ve all been waiting for aryastark jonsnow aryastark gendry thronesyall gameofthrones gots8 forthethrone gameofthronesseason8 winterishere got8 got http www instagram com bwqt2rol sw utm_source ig_twitter_share igshid 1av6mjjzq4df9
People of the world : Instead of retweeting if u haven't watched # GameofThrones ,Neu,0.0,0.0,people of the world instead of retweeting if haven watched gameofthrones
Saliendo un poco del tema de Game of Thrones,Neg,-0.4,0.4,saliendo un poco del tema de game of throne
Dragon Ride # GoT # DaenerysTargaryen # JonSnow # GameOfThrones # GoTS8 # ForTheThrone # thefinalseasonpic.twitter.com/c3BrZv3GYL,Neu,0.0,0.0,dragon ride got daenerystargaryen jonsnow gameofthrones gots8 forthethrone thefinalseasonpic twitter com c3brzv3gyl
@ PeteButtigieg is running for Pres and hugged,Neu,0.0,0.0,petebuttigieg is running for pres and hugged
True king of the Seven Kindoms...say no more # GOT # GoTS8 # GameOfThrones # Argentina # Humor # JonSnow # ForTheThronepic.twitter.com/SQsQrUYkeR,Pos,0.04999999999999999,0.575,true king of the seven kindoms say no more got gots8 gameofthrones argentina humor jonsnow forthethronepic twitter com sqsqruyker
A @ HBO_Brasil fica deixando a gente com aquele gostinho de quero mais e fazendo a gente ficar triste e esperar só domingo que vem # DaenerysTargaryen # JonSnow # GameOfThrones # GoT # GameofThronesSeason8 # GoTS8 https://twitter.com/JooVito38711286/status/1117621169224650753 …,Neu,0.0,0.0,a hbo_brasil fica deixando gente com aquele gostinho de quero mais fazendo gente ficar triste esperar só domingo que vem daenerystargaryen jonsnow gameofthrones got gameofthronesseason8 gots8 http twitter com joovito38711286 status 1117621169224650753
EVERYBODY STILL FIGHTING AND YET THE NK JUST FOCUSSED ON HIS TALENTS # GameOfThrones # got # NightKing # ForTheThrone # GOTS8 # CerseiLannister # JonSnow # SansaStark # TyrionLannister # AryaStark # Daenerys # EuronGreyjoy # TheonGreyjoy # TheHoundpic.twitter.com/0t7HxmkgpV,Neu,0.0,0.0,everybody still fighting and yet the nk just focussed on his talent gameofthrones got nightking forthethrone gots8 cerseilannister jonsnow sansastark tyrionlannister aryastark daenerys eurongreyjoy theongreyjoy thehoundpic twitter com 0t7hxmkgpv
If it seems unbelievable that all the people on # gameofthrones wouldn’t immediately unite to fight a universal threat,Neg,-0.125,0.5,if it seems unbelievable that all the people on gameofthrones wouldn immediately unite to fight universal threat
From one # trueking to another .... # aragorn # JonSnow # GameofThrones @ GameOfThrones @ GameOfDaily # GoT # GoTS8 # LOTR # hbo @ HBOpic.twitter.com/lRqoq4NY19,Neu,0.0,0.0,from one trueking to another aragorn jonsnow gameofthrones gameofthrones gameofdaily got gots8 lotr hbo hbopic twitter com lrqoq4ny19
Por siempre el Rey en el Norte y de los Siete Reinos # JonSnow # GameofThrones # GoTS8 # GOT,Neu,0.0,0.0,por siempre el rey en el norte de los siete reinos jonsnow gameofthrones gots8 got
When the download links work Who cares about live stream # GameofThrones # GOT # GoTS8 # GOT spoilers # JonSnow # forthethrone # downloadpic.twitter.com/3sBkxVcDbf,Pos,0.13636363636363635,0.5,when the download link work who care about live stream gameofthrones got gots8 got spoiler jonsnow forthethrone downloadpic twitter com 3sbkxvcdbf
Ain't nobody got time for that. # GameOfThrones # WinterIsHere # ForTheThrone # JonSnow # Daenerys # daenerystargaryen # AegonTargaryen # Drogon # GoTS8 # GOT pic.twitter.com/GlrlJYsqLC,Neu,0.0,0.0,ain nobody got time for that gameofthrones winterishere forthethrone jonsnow daenerys daenerystargaryen aegontargaryen drogon gots8 got pic twitter com glrljysqlc
NÃO É O ÚNICO. TAMO JUNTO IRMÃO! # Jonerys # jonsnow # Daenerys # DaenerysTargaryen # GameOfThrones # got # GoTS8 # ForTheThronehttps://twitter.com/dougvxs/status/1117619083774763008 …,Neu,0.0,0.0,não é único tamo junto irmão jonerys jonsnow daenerys daenerystargaryen gameofthrones got gots8 forthethronehttps twitter com dougvxs status 1117619083774763008
Ella es su tía y él es su sobrino. El padre de Jon es el hermano de Daenerys. Espero haberte sido de ayuda . # GoTS8 # GameofThrones # Got # GameofThronesSeason8 # JuegodeTronos # ForTheThrone # JonSnow # DaenerysTargaryen # AegonTargaryen,Neu,0.0,0.0,ella e su tía él e su sobrino el padre de jon e el hermano de daenerys espero haberte sido de ayuda gots8 gameofthrones got gameofthronesseason8 juegodetronos forthethrone jonsnow daenerystargaryen aegontargaryen
8x01 @ GameOfThrones ¡Increíble! # GameofThrones # GameofThronesSeason8 # GoT # GoTS8 # JonSnow # CerseiLannister # Daenerys # TyrionLannisterpic.twitter.com/Gf6FFm1dYn,Neu,0.0,0.0,8x01 gameofthrones increíble gameofthrones gameofthronesseason8 got gots8 jonsnow cerseilannister daenerys tyrionlannisterpic twitter com gf6ffm1dyn
# GOT # GoTS8 # GameofThrones # GameofThronesSeason8 # ForTheThrones # JamieLannister # Cersei # Khaleesi # JonSnow # dragonspic.twitter.com/Ie5TodAlee,Neu,0.0,0.0,got gots8 gameofthrones gameofthronesseason8 forthethrones jamielannister cersei khaleesi jonsnow dragonspic twitter com ie5todalee
En resumen!!! # ReapersGaming # GameofThrones # JonSNOW # DaenerysTARGARYEN # SansaSTARK # AryaSTARK # BranSTARK # CerseiLANNISTER # JaimeLANNISTER # TyrionLANNISTER # NightKing # GOT # GOTS8 # AegonTargaryen,Neu,0.0,0.0,en resumen reapersgaming gameofthrones jonsnow daenerystargaryen sansastark aryastark branstark cerseilannister jaimelannister tyrionlannister nightking got gots8 aegontargaryen
En resumen!!! # ReapersGaming # GameofThrones # JonSNOW # DaenerysTARGARYEN # SansaSTARK # AryaSTARK # BranSTARK # CerseiLANNISTER # JaimeLANNISTER # TyrionLANNISTER # NightKing # GOT # GOTS8 # AegonTargaryen,Neu,0.0,0.0,en resumen reapersgaming gameofthrones jonsnow daenerystargaryen sansastark aryastark branstark cerseilannister jaimelannister tyrionlannister nightking got gots8 aegontargaryen
# GameofThrones premiered! Watch @ CorvyxOfficial 's musicvideo # Sevendevils by @ flo_tweet In honor of # GoTS8 # GoT https://youtu.be/YvnkmV-xk3s # GOT8 # HBOGO # ForTheThrone # JonSnow # DaenerysTargaryen # KingInTheNorth # DavosSeaworth # daenerys # SevenKingdoms @ HBO # AryaStark # sansastark,Neu,0.0,0.0,gameofthrones premiered watch corvyxofficial musicvideo sevendevils by flo_tweet in honor of gots8 got http youtu be yvnkmv xk3s got8 hbogo forthethrone jonsnow daenerystargaryen kinginthenorth davosseaworth daenerys sevenkingdoms hbo aryastark sansastark
The moment dragons realize who the true king is # GoT # GoTS8 # GameofThronesSeason8 # GameofThrones # JonSnow #pic.twitter.com/Rg73k30ISH,Pos,0.35,0.65,the moment dragon realize who the true king is got gots8 gameofthronesseason8 gameofthrones jonsnow pic twitter com rg73k30ish
¿Crees que # JonSnow revele su secreto y sea quien finalmente tome el trono? Dinos tu teoría http://strendus.com.mx # GotEnStrendus # GOT # GoTS8 # DominGOT # GameOfThrones,Neu,0.0,0.0,cree que jonsnow revele su secreto sea quien finalmente tome el trono dinos tu teoría http strendus com mx gotenstrendus got gots8 domingot gameofthrones
No spoilers,Neu,0.0,0.0,no spoiler
¡¡¡ ALERTA SPOILER !!! LO QUE PIENSA HACERLE DROGON A JON,Neu,0.0,0.0,alerta spoiler lo que piensa hacerle drogon jon
"possíveis pensamentos do Drogon"" ""ele é seu sobrinho porra"" ""mamãe larga ele caraio"" ""mamãe mas você prometeu pro papai Khal Drogo"" ""fala dracarys caceta"" # GameofThrones # GoT # Daenerys # JonSnow # GoTS8 pic.twitter.com/dHoPIg0uUr""",Neu,0.0,0.0,possíveis pensamentos do drogon ele é seu sobrinho porra mamãe larga ele caraio mamãe ma você prometeu pro papai khal drogo fala dracarys caceta gameofthrones got daenerys jonsnow gots8 pic twitter com dhopig0uur
When # JonSnow & # DaenerysTargaryen kissed in front of the dragons and the way one of the # dragon looks at jon snow was like him trying to say that dude stop kissing your aunt,Neu,0.0,0.0,when jonsnow daenerystargaryen kissed in front of the dragon and the way one of the dragon look at jon snow wa like him trying to say that dude stop kissing your aunt
La nueva presentación de Game of Thrones que da pistas para la temporada final # GoTS8 # JonSnow # GoT # GameOfThrones https://adn.fm/2Gblx3U pic.twitter.com/7EjUJw48iG,Neg,-0.2,0.7,la nueva presentación de game of throne que da pistas para la temporada final gots8 jonsnow got gameofthrones http adn fm 2gblx3u pic twitter com 7ejujw48ig
# JonSnow he already killed so much in season 7. # NightKing VS # JonSnow # gameofthrones # GoT # gots8 pic.twitter.com/IiJGJHlzHw,Neu,0.0,0.1,jonsnow he already killed so much in season 7 nightking v jonsnow gameofthrones got gots8 pic twitter com iijgjhlzhw
# GameOfThrones was pretty lit # GameOfThornes # GamesOfThrones # GOT # GoTS8 # GoT8 # JonSnow # Daenerys # SansaStark # AryaStark # CerseiLannister # JaimeLannister # IronThrone # GameofThronesSeason8 # GameofThronesDay # GameOfThronesEve # WinterIsComing # winterishere see ya next weekpic.twitter.com/jfld4QiS0U,Pos,0.125,0.5,gameofthrones wa pretty lit gameofthornes gamesofthrones got gots8 got8 jonsnow daenerys sansastark aryastark cerseilannister jaimelannister ironthrone gameofthronesseason8 gameofthronesday gameofthroneseve winteriscoming winterishere see ya next weekpic twitter com jfld4qis0u
Me waiting for next week episode be like # GOT # GoTS8 # GameOfThrones # ForTheThrones # BranStark # AryaStark # JonSnow pic.twitter.com/dXyIzcSt9U,Neu,0.0,0.0,me waiting for next week episode be like got gots8 gameofthrones forthethrones branstark aryastark jonsnow pic twitter com dxyizcst9u
First Ride of # Jonsnow # GOT # GameofThrones # GOTonDSTV # GOTS8 https://twitter.com/AM_Sheikhspeare/status/1117615422747152390/video/1 …pic.twitter.com/ZLVz1pj5ML,Pos,0.25,0.3333333333333333,first ride of jonsnow got gameofthrones gotondstv gots8 http twitter com am_sheikhspeare status 1117615422747152390 video 1 pic twitter com zlvz1pj5ml
Honestly,Pos,0.6,0.9,honestly
# GameofThrones # ForTheThrone # GOT # GoTS8 # DaenerysTargaryen # Daenerys # JonSnow # SansaStark # Sansa # AryaStark # BranStark # TyrionLannister # Tyrion # CerseiLannister # Cersei # BrienneofTarth # Brienne # DavosSeaworth # NightKing,Neu,0.0,0.0,gameofthrones forthethrone got gots8 daenerystargaryen daenerys jonsnow sansastark sansa aryastark branstark tyrionlannister tyrion cerseilannister cersei brienneoftarth brienne davosseaworth nightking
So far in 7 seasons of # GameofThrones,Pos,0.1,1.0,so far in 7 season of gameofthrones
Cuánto tiempo deseé ver este hermoso reencuentro # GameOfThrones # ForTheThrone # GoTS8 # GoT # JonSnow pic.twitter.com/TFOJSJ6Z0S,Neu,0.0,0.0,cuánto tiempo deseé ver este hermoso reencuentro gameofthrones forthethrone gots8 got jonsnow pic twitter com tfojsj6z0s
When you find out you're wearing the wrong team's armor right before the big game. # GameOfThrones # GOT # GOTS8 # JonSnow # AegonTargaryen (courtesy of @ binge_mode)pic.twitter.com/HFpZVRp3PC,Neg,-0.15357142857142858,0.4839285714285715,when you find out you re wearing the wrong team armor right before the big game gameofthrones got gots8 jonsnow aegontargaryen courtesy of binge_mode pic twitter com hfpzvrp3pc
Só eu estou achando # GameOfThrones bem acelerado.. tão engolindo a maioria dos diálogos interessantes.. poxa! # HouseTargaryen # GameofThronesSeason8 # GoTS8 # GOT # DaenerysTargaryen # JonSnow,Neu,0.0,0.0,só eu estou achando gameofthrones bem acelerado tão engolindo maioria do diálogos interessantes poxa housetargaryen gameofthronesseason8 gots8 got daenerystargaryen jonsnow
Jon il vas arrivé comme ça devant les immaculés # GameofThrones # GotS8 # GoT # JonSnow # gameofthronessaison8pic.twitter.com/hciKvVVH2U,Neu,0.0,0.0,jon il va arrivé comme ça devant le immaculés gameofthrones gots8 got jonsnow gameofthronessaison8pic twitter com hcikvvvh2u
Ame esta escena!!!!!!..... # JonSnow # AryaStark # GameofThrones # GOT # GoTS8 https://twitter.com/ArgentinaDead/status/1117599817369305091 …,Neu,0.0,0.0,ame esta escena jonsnow aryastark gameofthrones got gots8 http twitter com argentinadead status 1117599817369305091
I live for THIS reunion and the Gendry and Arya scene! # AryaStark # JonSnow # GendryBaratheon # GameofThrones # GOT # GoTS8 pic.twitter.com/DhG5LfwQjp,Pos,0.17045454545454544,0.5,i live for this reunion and the gendry and arya scene aryastark jonsnow gendrybaratheon gameofthrones got gots8 pic twitter com dhg5lfwqjp
# GameofThrones # GoTS8 # got # aryastark # JonSnow S2 S2 S2 pic.twitter.com/mSKdRh2aUs,Neu,0.0,0.0,gameofthrones gots8 got aryastark jonsnow s2 s2 s2 pic twitter com mskdrh2aus
Bebitosstan lindos # AryaStark # JonSnow # GameofThrones # Got # GoTS8 # ForTheThronepic.twitter.com/BrmGSl7ub4,Neu,0.0,0.0,bebitosstan lindos aryastark jonsnow gameofthrones got gots8 forthethronepic twitter com brmgsl7ub4
eu acho que o # JonSnow pode se abdicar do trono e dar ele para # DaenerysTargaryen # GameofThrones # GOT # GoTS8,Neu,0.0,0.0,eu acho que jonsnow pode se abdicar do trono dar ele para daenerystargaryen gameofthrones got gots8
Thoughts I had while watching # episode1 of # season8 Of # GameofThrones Today! https://www.facebook.com/groups/121894355019655/permalink/329911117551310/ … # GoTS8 # GOT # ForTheThrone # WinterIsHere # JonSnow,Neu,0.0,0.0,thought had while watching episode1 of season8 of gameofthrones today http www facebook com group 121894355019655 permalink 329911117551310 gots8 got forthethrone winterishere jonsnow
EU TOU TREMENDO,Neu,0.0,0.0,eu tou tremendo
# GoTS8 # GameofThrones # GOT # AegonTargaryen # JonSnow https://twitter.com/BSKtheKing/status/1117613563437363200 …,Neu,0.0,0.0,gots8 gameofthrones got aegontargaryen jonsnow http twitter com bsktheking status 1117613563437363200
โง้ยยยแท็กโซคิ้วทึมากๆๆๆๆ # GameofThrones # GOT # GoTS8 # JonSnow # DaenerysTargaryen # AryaStark # SansaStark # BranStark # TyrionLannister # TheonGreyjoy # SamwellTarly # CerseiLannister # JaimeLannister # JorahMormontpic.twitter.com/mwjjMDVMGM,Neu,0.0,0.0,โง ยยยแท กโซค วท มากๆๆๆๆ gameofthrones got gots8 jonsnow daenerystargaryen aryastark sansastark branstark tyrionlannister theongreyjoy samwelltarly cerseilannister jaimelannister jorahmormontpic twitter com mwjjmdvmgm
# SamwellTarly só apareceu pra choramingar pelo pai e o irmão com quem ele num ia com a cara kk ridiculo. Foi só pra ter um personagem pra fazer o # JonSnow ficar com a pulga atras da orelha. Achei forçado,Neu,0.0,0.0,samwelltarly só apareceu pra choramingar pelo pai o irmão com quem ele num ia com cara kk ridiculo foi só pra ter um personagem pra fazer jonsnow ficar com pulga atras da orelha achei forçado
It's the beginning of the end. 2 years,Neu,0.0,0.0,it the beginning of the end 2 year
# GoTS8 # GameofThrones # GOT # aryastark # AegonTargaryen # JonSnow https://twitter.com/kpringer/status/1117599072427368453 …,Neu,0.0,0.0,gots8 gameofthrones got aryastark aegontargaryen jonsnow http twitter com kpringer status 1117599072427368453
# GOT # GOT8 # Gots8 # GameOfThrones # GameofThronesSeason8 # JonSnow # Daeneryshttps://twitter.com/FandomTingling/status/1117609733114847232 …,Neu,0.0,0.0,got got8 gots8 gameofthrones gameofthronesseason8 jonsnow daeneryshttps twitter com fandomtingling status 1117609733114847232
Omgggg!!!! I'm crying.. Finally it's here.. # GameofThrones # ForTheThrone # GOT # GoTS8 # DaenerysTargaryen # JonSnow pic.twitter.com/Jhe6ycrhIm,Neg,-0.1,0.8,omgggg m cry finally it here gameofthrones forthethrone got gots8 daenerystargaryen jonsnow pic twitter com jhe6ycrhim
Cuando le dicen a juanito que por fin la cheyenne es suya. # GameofThrones # JonSnow # AegonTargaryen # GoTS8 # got pic.twitter.com/XOu9LGv83g,Neu,0.0,0.0,cuando le dicen juanito que por fin la cheyenne e suya gameofthrones jonsnow aegontargaryen gots8 got pic twitter com xou9lgv83g
ABRIL CAMATE POFAVOR!!!!!! # GameOfThrones # GoT # GoTS8 # JonSnow # DaenerysTargaryen # SansaStark # AryaStark # TyrionLannisterpic.twitter.com/stDmG7513v,Neu,0.0,0.0,abril camate pofavor gameofthrones got gots8 jonsnow daenerystargaryen sansastark aryastark tyrionlannisterpic twitter com stdmg7513v
Né... # GameofThrones # GOT # GoTS8 # jonsnow # DaenerysTargaryenhttps://twitter.com/LittlePata07/status/1117610190415777793 …,Neu,0.0,0.0,né gameofthrones got gots8 jonsnow daenerystargaryenhttps twitter com littlepata07 status 1117610190415777793
Gente,Neu,0.0,0.0,gente
Prometo que no les haré spoiler,Neu,0.0,0.0,prometo que no le haré spoiler
The king of the North Jon snow~ # GameofThrones # GameofThronesSeason8 # ForTheThrone # JonSnow # GOT # GoTS8 pic.twitter.com/OJnlfcGsBt,Neu,0.0,0.0,the king of the north jon snow gameofthrones gameofthronesseason8 forthethrone jonsnow got gots8 pic twitter com ojnlfcgsbt
The king of the north or the true king of the 7 kingdoms? The man,Pos,0.35,0.65,the king of the north or the true king of the 7 kingdom the man
G.O.T was brilliant can't for the next episode. # KingOfTheNorth # Targaryen # GameofThrones # GOT # GoTS8 # JonSnow # forthethrone,Pos,0.45,0.5,g t wa brilliant can for the next episode kingofthenorth targaryen gameofthrones got gots8 jonsnow forthethrone
HELP! # GameofThrones # GoTS8 # GOT # JonSnow # SansaStark # aryastark # BranStark # Daeneryspic.twitter.com/JKZ3mHShrI,Neu,0.0,0.0,help gameofthrones gots8 got jonsnow sansastark aryastark branstark daeneryspic twitter com jkz3mhshri
Cosas que pasan no? # Gameofthoa # GameOfThrones # VerdadesOcultas # HBO # Mega # ResistireaMega # Pasapalabra # JonSnow # ElEnanoDeGameOfThrones # GameofThronesSeason8 # Got # ForTheThrone # GoTS8 # Daenerys # HboGo # DaenerysTargaryen # DominGOT # Teleseries # DomingoEspetacular # Dracaryspic.twitter.com/mriZ16xNML,Neu,0.0,0.0,cosas que pasan no gameofthoa gameofthrones verdadesocultas hbo mega resistireamega pasapalabra jonsnow elenanodegameofthrones gameofthronesseason8 got forthethrone gots8 daenerys hbogo daenerystargaryen domingot teleseries domingoespetacular dracaryspic twitter com mriz16xnml
# GoTS8 Aegon Targaryen ... Y ahora qué pasará? Que sea pronto Domingo CSM... # GOT # GameofThrones # GameofThronesSeason8 # JonSnow,Neu,0.0,0.0,gots8 aegon targaryen ahora qué pasará que sea pronto domingo csm got gameofthrones gameofthronesseason8 jonsnow
“Don’t touch my mom” kind of moment isn’t it? # got # got8 # gots8 # jonsnow # DaenerysTargaryen # drogon # gameofthrones # GameofThroneseason8pic.twitter.com/BiErHNQcff,Pos,0.6,0.9,don touch my mom kind of moment isn it got got8 gots8 jonsnow daenerystargaryen drogon gameofthrones gameofthroneseason8pic twitter com bierhnqcff
