text,sentiment,polarity,subjectivity,Preprocess
When you realize # targaryen family members are know for their silver hair & # aegontargaryen's # direwolf was # ghost # GameofThrones # Got # GoTS8 # jonsnow pic.twitter.com/tSgBDZZJhk,Neu,0.0,0.0,when you realize targaryen family member are know for their silver hair aegontargaryen direwolf wa ghost gameofthrones got gots8 jonsnow pic twitter com tsgbdzzjhk
Kit Harington about episode 4 - what does Shakespearian mean... # Gots8 . . . # KitHarington # EmiliaClarke # GameofThrones # Got # Gotseason8 # Gotseason7 # kimilia # kit # milly # jonerys # jonsnow # daenerys # targaryen… https://www.instagram.com/p/Bw92SMzpi7A/?igshid=lurijukp8ldi …,Neg,-0.3125,0.6875,kit harington about episode 4 what doe shakespearian mean gots8 kitharington emiliaclarke gameofthrones got gotseason8 gotseason7 kimilia kit milly jonerys jonsnow daenerys targaryen http www instagram com bw92smzpi7a igshid lurijukp8ldi
Check out this awesome @ GameOfThrones Final Season Cake you can make yourself! MORE: https://www.youtube.com/watch?v=BfUqnwxO9IM … # GameofThrones # GamesOfThrones # GOT # GoTS8 # Thrones # Thrones360 # DaenerysTargaryen # ForTheThrone # JonSnow # CerseiLannister # AryaStark # TheLongNight # hbo # daenerystargaryenpic.twitter.com/mI5VUTzqTO,Pos,0.5,0.8333333333333334,check out this awesome gameofthrones final season cake you can make yourself more http www youtube com watch bfuqnwxo9im gameofthrones gamesofthrones got gots8 throne thrones360 daenerystargaryen forthethrone jonsnow cerseilannister aryastark thelongnight hbo daenerystargaryenpic twitter com mi5vutzqto
If u saw this just know i wrote it just to see the faces lol ! # GameofThrones # GoTS8 # GOT # JonSnow # SansaStark # AryaStark # BranStark # Daenerys # ForTheThrone,Pos,1.0,0.7,if saw this just know wrote it just to see the face lol gameofthrones gots8 got jonsnow sansastark aryastark branstark daenerys forthethrone
# JonSnow did not shout go' to help Arya I swear some people just want to make him herohe has been saved by every major female character in the show ,Pos,0.03125,0.3333333333333333,jonsnow did not shout go to help arya swear some people just want to make him herohe ha been saved by every major female character in the show
Can # Tyrion and # Sansa Still Emerge As the True # PowerCouple on # GameOfThrones? https://www.theringer.com/game-of-thrones/2019/5/2/18526400/game-of-thrones-season-8-tyrion-sansa-budding-union-jon-daenerys?utm_campaign=theringer&utm_content=entry&utm_medium=social&utm_source=twitter … via @ ringer # News # TV # HBO # GoT # GoTS8 # GameOfThronesLooseEnds # LooseEnds # GameOfThronesSeason8 # Season8 # BuddingUnion # JonSnow # Daenerys,Pos,0.35,0.65,can tyrion and sansa still emerge a the true powercouple on gameofthrones http www theringer com game of throne 2019 5 2 18526400 game of throne season 8 tyrion sansa budding union jon daenerys utm_campaign theringer utm_content entry utm_medium social utm_source twitter via ringer news tv hbo got gots8 gameofthroneslooseends looseends gameofthronesseason8 season8 buddingunion jonsnow daenerys
The face u make when u find out u r unemployed! # GameofThrones # got # JonSnow 8x04 # Got # GoTS8 pic.twitter.com/PW2BnrIcXd,Neu,0.0,0.0,the face make when find out r unemployed gameofthrones got jonsnow 8x04 got gots8 pic twitter com pw2bnricxd
Scenes? There will be more? Emilia Clarke new interview # Gots8 . . . # KitHarington # EmiliaClarke # GameofThrones # Got # Gotseason8 # Gotseason7 # kimilia # kit # milly # jonerys # jonsnow # daenerys # targaryen # dragon… https://www.instagram.com/p/Bw85K_MpaWX/?igshid=13qtx0i4ksugh …,Pos,0.3181818181818182,0.4772727272727273,scene there will be more emilia clarke new interview gots8 kitharington emiliaclarke gameofthrones got gotseason8 gotseason7 kimilia kit milly jonerys jonsnow daenerys targaryen dragon http www instagram com bw85k_mpawx igshid 13qtx0i4ksugh
# GOTS8 # GameofThrones # GOT # JonSnow SÍ SE SACRIFICÓ POR # Arya # Gopic.twitter.com/s0cPsRzvvs,Neu,0.0,0.0,gots8 gameofthrones got jonsnow sí se sacrificó por arya gopic twitter com s0cpsrzvvs
Kit and Emilia on the set of # Gots8 in Belfast . . LaPrincesitaPM / LanaAlwaysQueen - Twitter . . . # KitHarington # EmiliaClarke # GameofThrones # Got # Gotseason8 # Gotseason7 # kimilia # kit # milly # jonerys # jonsnow… https://www.instagram.com/p/Bw8iRT3pb39/?igshid=1dv01o9z41d6x …,Neu,0.0,0.0,kit and emilia on the set of gots8 in belfast laprincesitapm lanaalwaysqueen twitter kitharington emiliaclarke gameofthrones got gotseason8 gotseason7 kimilia kit milly jonerys jonsnow http www instagram com bw8irt3pb39 igshid 1dv01o9z41d6x
"OMG just realized!!! # Jonsnow yelled Goooooooooo!!!!!"" To # AryaStark When he stood up to the !! That's how she killed the # NightKing # nightkingslayer # GameOfThrones # GOT # GoTS8 Jon Snow with the assist!!! pic.twitter.com/JRmCJQmp2v""",Neg,-0.390625,0.0,omg just realized jonsnow yelled goooooooooo to aryastark when he stood up to the that how she killed the nightking nightkingslayer gameofthrones got gots8 jon snow with the assist pic twitter com jrmcjqmp2v
# GOTS8 # GameofThrones # GOT # xmen # XMenDarkPhoenix # professorx # branstark # cyclops # jonsnow # jeangrey # wolverine # AryaStark # quicksilverpic.twitter.com/4Y8ykboYLx,Neu,0.0,0.0,gots8 gameofthrones got xmen xmendarkphoenix professorx branstark cyclops jonsnow jeangrey wolverine aryastark quicksilverpic twitter com 4y8ykboylx
Isn't Jon snow now officially unemployed? # gameofthrones # BattleOfWinterfell # JonSnow # GoTS8 # got # Nk # nightkingpic.twitter.com/36iBSvECIP,Neu,0.0,0.0,isn jon snow now officially unemployed gameofthrones battleofwinterfell jonsnow gots8 got nk nightkingpic twitter com 36ibsvecip
Imagens promocionais do episódio 8x04 de Game Of Thrones. Hora de queimar os mortos. Team Targaryen,Neg,-0.4,0.4,imagens promocionais do episódio 8x04 de game of throne hora de queimar o mortos team targaryen
# Gots8 episode 4 - new official stills . . # KitHarington # EmiliaClarke # GameofThrones # Got # Gotseason8 # Gotseason7 # kimilia # kit # milly # jonerys # jonsnow # daenerys # targaryen # dragon # wolf # winterfell # westeros # hbo… https://www.instagram.com/p/Bw7gUoKAQKA/?igshid=xctxz7j7ckrg …,Pos,0.13636363636363635,0.45454545454545453,gots8 episode 4 new official still kitharington emiliaclarke gameofthrones got gotseason8 gotseason7 kimilia kit milly jonerys jonsnow daenerys targaryen dragon wolf winterfell westeros hbo http www instagram com bw7guokaqka igshid xctxz7j7ckrg
New stills from # Gots8 episode 4 . . # KitHarington # EmiliaClarke # GameofThrones # Got # Gotseason8 # Gotseason7 # kimilia # kit # milly # jonerys # jonsnow # daenerys # targaryen # dragon # wolf # winterfell # westeros # hbo… https://www.instagram.com/p/Bw7fn-EAk84/?igshid=ad2vwdgt8j1d …,Pos,0.13636363636363635,0.45454545454545453,new still from gots8 episode 4 kitharington emiliaclarke gameofthrones got gotseason8 gotseason7 kimilia kit milly jonerys jonsnow daenerys targaryen dragon wolf winterfell westeros hbo http www instagram com bw7fn eak84 igshid ad2vwdgt8j1d
New # Gots8 episode 4 stills . . # KitHarington # EmiliaClarke # GameofThrones # Got # Gotseason8 # Gotseason7 # kimilia # kit # milly # jonerys # jonsnow # daenerys # targaryen # dragon # wolf # winterfell # westeros # hbo… https://www.instagram.com/p/Bw7fYgEAuP0/?igshid=1bqzgaqraqj7x …,Pos,0.13636363636363635,0.45454545454545453,new gots8 episode 4 still kitharington emiliaclarke gameofthrones got gotseason8 gotseason7 kimilia kit milly jonerys jonsnow daenerys targaryen dragon wolf winterfell westeros hbo http www instagram com bw7fygeaup0 igshid 1bqzgaqraqj7x
# GameOfThrones # Season8: Who Is the # Prince Who Was Promised? https://www.theringer.com/game-of-thrones/2019/5/1/18525169/prince-promised-azor-ahai-jon-snow-daenerys-arya-stark-long-night?utm_campaign=theringer&utm_content=entry&utm_medium=social&utm_source=twitter … via @ ringer # AzorAhai # JonSnow # Daenerys # AryaStark # LongNight # News # TV # HBO # GoT # GoTS8 # GameOfThronesLooseEnds # LooseEnds # GameOfThronesSeason8,Neu,0.0,0.0,gameofthrones season8 who is the prince who wa promised http www theringer com game of throne 2019 5 1 18525169 prince promised azor ahai jon snow daenerys arya stark long night utm_campaign theringer utm_content entry utm_medium social utm_source twitter via ringer azorahai jonsnow daenerys aryastark longnight news tv hbo got gots8 gameofthroneslooseends looseends gameofthronesseason8
Hey! Meet Khan from Pakistan Hi Peter! # GOT8 # GameofThrones # GoTS8 # GOT # PeterDinklage # TyrionLannister # tyrion # AryaStark # SansaStark # Cersei # JonSnow # DaenerysTargaryenpic.twitter.com/a1mBxu03Hn,Neu,0.0,0.0,hey meet khan from pakistan hi peter got8 gameofthrones gots8 got peterdinklage tyrionlannister tyrion aryastark sansastark cersei jonsnow daenerystargaryenpic twitter com a1mbxu03hn
# NightGathers # Longclaw # JonSnow # GoT # GameOfThrones # GoTS8 # ValyrianSteel # TaketheBlack # NotToday https://www.instagram.com/p/Bw5usE0lVFRa_mKNY9RWwiVGYgZjR6nAou35do0/?utm_source=ig_twitter_share&igshid=du6p7cfgx4b0 …,Neu,0.0,0.0,nightgathers longclaw jonsnow got gameofthrones gots8 valyriansteel taketheblack nottoday http www instagram com bw5use0lvfra_mkny9rwwivgygzjr6naou35do0 utm_source ig_twitter_share igshid du6p7cfgx4b0
I believe this is the true meaning and conclusion to # ASongofIceandFire and will be important at the end of # GameofThrones # Family # HouseStark # Arya # JonSnow # aegontargaryen # ASOIAF # GOT # GoTS8 pic.twitter.com/I6wWK3YLiF,Pos,0.375,0.825,i believe this is the true meaning and conclusion to asongoficeandfire and will be important at the end of gameofthrones family housestark arya jonsnow aegontargaryen asoiaf got gots8 pic twitter com i6wwk3ylif
@ BellaRamsey Thank you my lady ! # GameofThrones # GOT # GOTS08E03 # GoTS8 # got # Arya # JonSnow # DaenerysTargaryen # NightKing,Neu,0.0,0.0,bellaramsey thank you my lady gameofthrones got gots08e03 gots8 got arya jonsnow daenerystargaryen nightking
Maybe ... maybe we get something good next week. Maybe... . . # Gots8 . . # KitHarington # EmiliaClarke # GameofThrones # Got # Gotseason8 # Gotseason7 # kimilia # kit # milly # jonerys # jonsnow # daenerys # targaryen # dragon… https://www.instagram.com/p/Bw5akCXA0L2/?igshid=gz2y1y2nvx3q …,Pos,0.35,0.30000000000000004,maybe maybe we get something good next week maybe gots8 kitharington emiliaclarke gameofthrones got gotseason8 gotseason7 kimilia kit milly jonerys jonsnow daenerys targaryen dragon http www instagram com bw5akcxa0l2 igshid gz2y1y2nvx3q
When you survived watching # TheLongNight but still defending yourself against fans' theories: # GameofThrones # GoT # TheLongNight # GOTS8 # GOTS8 # DaenerysTargaryen # Daenerys # Cersei # JonSnow # TyrionLannister # ForTheThronepic.twitter.com/TQAcOOVkL5,Neu,0.0,0.0,when you survived watching thelongnight but still defending yourself against fan theory gameofthrones got thelongnight gots8 gots8 daenerystargaryen daenerys cersei jonsnow tyrionlannister forthethronepic twitter com tqacoovkl5
I don't get 15 million $ per episode still no money for # ghost?? # jonsnow # starks # GameofThrones # got # GoTS8,Neu,0.0,0.0,i don get 15 million per episode still no money for ghost jonsnow starks gameofthrones got gots8
The only good decision he made the entire battle? # got # gameofthrones # GoTS8 # jonsnow # samtarlypic.twitter.com/1WiLHXjZPR,Pos,0.2333333333333333,0.7416666666666667,the only good decision he made the entire battle got gameofthrones gots8 jonsnow samtarlypic twitter com 1wilhxjzpr
# GameOfThrones # GoTS8 # GOTGR # GOT # Littlefinger # AryaStark # Cersei # DaenerysTargaryen # JonSnow # Melisandrepic.twitter.com/5T5WRR6zsG,Neu,0.0,0.0,gameofthrones gots8 gotgr got littlefinger aryastark cersei daenerystargaryen jonsnow melisandrepic twitter com 5t5wrr6zsg
Cenas vazadas do episódio 4 mostram que o Ghost sobreviveu e que ta full pistola porque o Jon mandou ele pra linha de frente enquanto foi dar uma volta de dragão. # GameofThrones # got # gots8 # NotToday # Ghost # JonSnow # Rhaegalpic.twitter.com/XMaNdKVMl3,Pos,0.35,0.55,cenas vazadas do episódio 4 mostram que ghost sobreviveu que ta full pistola porque jon mandou ele pra linha de frente enquanto foi dar uma volta de dragão gameofthrones got gots8 nottoday ghost jonsnow rhaegalpic twitter com xmandkvml3
The beggining of the great battle of Winterfell. # Gots8 episode 3 # thelongnight . . . # KitHarington # EmiliaClarke # GameofThrones # Got # Gotseason8 # Gotseason7 # kimilia # kit # milly # jonerys # jonsnow # daenerys… https://www.instagram.com/p/Bw4nejtgFKK/?igshid=zuvhf8s8pmue …,Pos,0.8,0.75,the beggining of the great battle of winterfell gots8 episode 3 thelongnight kitharington emiliaclarke gameofthrones got gotseason8 gotseason7 kimilia kit milly jonerys jonsnow daenerys http www instagram com bw4nejtgfkk igshid zuvhf8s8pmue
Emilia Clarke at # Gots8 The Long Night screening in LA with D&D . . # KitHarington # EmiliaClarke # GameofThrones # Got # Gotseason8 # Gotseason7 # kimilia # kit # milly # jonerys # jonsnow # daenerys # targaryen # dragon # wolf… https://www.instagram.com/p/Bw4ey2kARuM/?igshid=19y5py0jbsfsj …,Neg,-0.05,0.4,emilia clarke at gots8 the long night screening in la with d kitharington emiliaclarke gameofthrones got gotseason8 gotseason7 kimilia kit milly jonerys jonsnow daenerys targaryen dragon wolf http www instagram com bw4ey2karum igshid 19y5py0jbsfsj
what's gonna happen to the Azor Ahai prophecy now?! i cant predict it but at least 19:31 in this vid came true! http://bit.ly/2G3nKhP # gameofthrones # gots8 # got # forthethrone # Daenerys # jonsnow # sansa # theon # tyrion # thenightking # Cersei # aryastark # branstark # crypts # arya,Pos,0.06875,0.525,what gonna happen to the azor ahai prophecy now cant predict it but at least 19 31 in this vid came true http bit ly 2g3nkhp gameofthrones gots8 got forthethrone daenerys jonsnow sansa theon tyrion thenightking cersei aryastark branstark crypt arya
More ScreenCaps - # Gots8 episode 3 - # thelongnight . Mostly Jon and Dany and the dragons. . . # KitHarington # EmiliaClarke # GameofThrones # Got # Gotseason8 # Gotseason7 # kimilia # kit # milly # jonerys # jonsnow… https://www.instagram.com/p/Bw3-Kjfg2l-/?igshid=8byh47gpfci5 …,Pos,0.5,0.5,more screencaps gots8 episode 3 thelongnight mostly jon and dany and the dragon kitharington emiliaclarke gameofthrones got gotseason8 gotseason7 kimilia kit milly jonerys jonsnow http www instagram com bw3 kjfg2l igshid 8byh47gpfci5
Sekiz sezondur # WinterIsComing deyip üçüncü bölümde bitireceklerini hiç düşünmemiştim. Kalan üç bölümde # CerseiLannister ile uğraşacaklarını da anlamış olduk. # NightKing 'ten beter eder diye düşünüyorum. # gameofthrones # GoTS8 # GOT # NotToday # JonSnow # Khaleesi # AryaStark # series,Neu,0.0,0.0,sekiz sezondur winteriscoming deyip üçüncü bölümde bitireceklerini hiç düşünmemiştim kalan üç bölümde cerseilannister ile uğraşacaklarını da anlamış olduk nightking ten beter eder diye düşünüyorum gameofthrones gots8 got nottoday jonsnow khaleesi aryastark series
Who deserves to sit on the Iron Throne? # GameOfThrones # GoT # Got8x03 # GoTS8 # JonSnow # CerseiLannister # Arya # DaenerysTargaryen,Neu,0.0,0.0,who deserves to sit on the iron throne gameofthrones got got8x03 gots8 jonsnow cerseilannister arya daenerystargaryen
┃┃╱╲ Na ┃╱╱╲╲ minha ╱╱╭╮╲╲ casa ▔▏┗┛▕▔ não entra ╱▔▔▔▔▔▔▔▔▔▔╲ hater de Game of Thrones ╱╱┏┳┓╭╮┏┳┓ ╲╲ ▔▏┗┻┛┃┃┗┻┛▕▔ # GameofThrones # got # gots8 # Arya # Melisandre # BranStark # Theon # JonSnow # DaenerysTargaryen,Neg,-0.4,0.4,na minha casa não entra hater de game of throne gameofthrones got gots8 arya melisandre branstark theon jonsnow daenerystargaryen
Things that disappear when you need them the most!! # GameOfThrones # Got # GoTS8 # GOTS8E3 # JonSnow # Euroleaguepic.twitter.com/Os8qeaicN0,Pos,0.78125,0.5,thing that disappear when you need them the most gameofthrones got gots8 gots8e3 jonsnow euroleaguepic twitter com os8qeaicn0
Jon Snow ist der geborene Marketeer. Er ist authentisch,Neu,0.0,0.0,jon snow ist der geborene marketeer er ist authentisch
Well I am not a fan of character # AryaStark too efficient too smart without any logical explanation. # BattleOfWinterfell # GameofThrones # GoT # GameofThronesSeason8 # GoTS8 # NightKing # JonSnow # TVSeriespic.twitter.com/6OyeXpKqxc,Pos,0.23214285714285715,0.44642857142857145,well am not fan of character aryastark too efficient too smart without any logical explanation battleofwinterfell gameofthrones got gameofthronesseason8 gots8 nightking jonsnow tvseriespic twitter com 6oyexpkqxc
Really # JonSnow is an idiot in the battle # GameOfThrones # BattleofWinterfell # GoTS8 # got # GOTS8E3,Neg,-0.30000000000000004,0.5,really jonsnow is an idiot in the battle gameofthrones battleofwinterfell gots8 got gots8e3
More # daenerys and # jorahmormont promotional pics from # Gots8 episode 3 . . # KitHarington # EmiliaClarke # GameofThrones # Got # Gotseason8 # Gotseason7 # kimilia # kit # milly # jonerys # jonsnow # daenerys # targaryen # dragon… https://www.instagram.com/p/Bw2aMGMg0Lr/?igshid=c8028mmwnjt8 …,Pos,0.5,0.5,more daenerys and jorahmormont promotional pic from gots8 episode 3 kitharington emiliaclarke gameofthrones got gotseason8 gotseason7 kimilia kit milly jonerys jonsnow daenerys targaryen dragon http www instagram com bw2amgmg0lr igshid c8028mmwnjt8
I hope next episode have some hopeful Jon and Dany scene. # GameOfThrones # JonSnow # DaenerysTargaryen # Daenerys # got # GoTS8 # BattleofWinterfell,Neu,0.0,0.0,i hope next episode have some hopeful jon and dany scene gameofthrones jonsnow daenerystargaryen daenerys got gots8 battleofwinterfell
example like Lara Coft in Tomb Raider ..... # AryaStark is just a bad ass character ..... My Opinion - # GOT # Stark # Daneris # JonSnow # Sansa # SansaStark # Gendry ... 2/2 .... @ GameOfThrones # GameofThrones # GOTS8,Neg,-0.44999999999999996,0.6333333333333333,example like lara coft in tomb raider aryastark is just bad as character my opinion got stark daneris jonsnow sansa sansastark gendry 2 2 gameofthrones gameofthrones gots8
Now Watch Game of Thrones Season 8 Episode 3 Online Free Live::>> https://www.reddit.com/live/12v2gloik11yy/ … # GameofThronesSeason8 # GameOfThronesEve # GameofThronesDay # GameofThrones # GOT # GoTS8 # Livestream # WinterIsHere # HBO # DavosSeaworth # ForTheThrone # Got8 # JonSnow pic.twitter.com/AJgVZVs1kL,Neu,0.0,0.6000000000000001,now watch game of throne season 8 episode 3 online free live http www reddit com live 12v2gloik11yy gameofthronesseason8 gameofthroneseve gameofthronesday gameofthrones got gots8 livestream winterishere hbo davosseaworth forthethrone got8 jonsnow pic twitter com ajgvzvs1kl
Watch Game of Thrones Season 8 Episode 3 Online Free Replay @Live::>> https://www.reddit.com/live/12v2gloik11yy/ … # GameofThronesSeason8 # GameOfThronesEve # GameofThronesDay # GameofThrones # GOT # GoTS8 # Livestream # WinterIsHere # HBO # DavosSeaworth # ForTheThrone # Got8 # JonSnow pic.twitter.com/TwGL96asdH,Neu,0.0,0.6000000000000001,watch game of throne season 8 episode 3 online free replay live http www reddit com live 12v2gloik11yy gameofthronesseason8 gameofthroneseve gameofthronesday gameofthrones got gots8 livestream winterishere hbo davosseaworth forthethrone got8 jonsnow pic twitter com twgl96asdh
# Gots8 screening yesterday in Los Angeles . . # KitHarington # EmiliaClarke # GameofThrones # Got # Gotseason8 # Gotseason7 # kimilia # kit # milly # jonerys # jonsnow # daenerys # targaryen # dragon # wolf # winterfell # westeros… https://www.instagram.com/p/Bw2Pem6geQq/?igshid=sgwja836fbgc …,Neu,0.0,0.0,gots8 screening yesterday in los angeles kitharington emiliaclarke gameofthrones got gotseason8 gotseason7 kimilia kit milly jonerys jonsnow daenerys targaryen dragon wolf winterfell westeros http www instagram com bw2pem6geqq igshid sgwja836fbgc
Ayer viendo el capítulo de # gameofthrones # GOT # Got8x03 # GOTs8 # NotToday # AryaStark # Jorah # JonSnow # Theon # NightKing # TheBattleForWinterfellpic.twitter.com/L51d4OvB0D,Neu,0.0,0.0,ayer viendo el capítulo de gameofthrones got got8x03 gots8 nottoday aryastark jorah jonsnow theon nightking thebattleforwinterfellpic twitter com l51d4ovb0d
U know what I would have loved to see? in that scene that dany fell of # Drogon # Ghost joins # Jorah to rescue! # gameofthrones # BattleOfWinterfell # got # GOTS8E3 # gots8 # DaenerysTargaryen # daenerys # JonSnow # Jonerys # JorahMormontpic.twitter.com/f54zGNh2Gc,Pos,0.875,0.8,u know what would have loved to see in that scene that dany fell of drogon ghost join jorah to rescue gameofthrones battleofwinterfell got gots8e3 gots8 daenerystargaryen daenerys jonsnow jonerys jorahmormontpic twitter com f54zgnh2gc
Can't put it more simpler than that. # GoTS8 # got # GameofThrones # NightKing # JonSnow # DaenerysTargaryen # BattleOfWinterfellhttps://twitter.com/socraticjuan/status/1122689312116572160 …,Pos,0.5,0.5,can put it more simpler than that gots8 got gameofthrones nightking jonsnow daenerystargaryen battleofwinterfellhttps twitter com socraticjuan status 1122689312116572160
# GameofThrones delivers the traditional ninth episode early with The Long Night. Here's our comprehensive review,Pos,0.016666666666666666,0.4833333333333334,gameofthrones delivers the traditional ninth episode early with the long night here our comprehensive review
Game revealed - about that iconic moment . . # Gots8 . . # KitHarington # EmiliaClarke # GameofThrones # Got # Gotseason8 # Gotseason7 # kimilia # kit # milly # jonerys # jonsnow # daenerys # targaryen # dragon # wolf # winterfell… https://www.instagram.com/p/Bw12rVzgdWx/?igshid=t6zy1z1ifmtn …,Pos,0.04999999999999999,0.45,game revealed about that iconic moment gots8 kitharington emiliaclarke gameofthrones got gotseason8 gotseason7 kimilia kit milly jonerys jonsnow daenerys targaryen dragon wolf winterfell http www instagram com bw12rvzgdwx igshid t6zy1z1ifmtn
Jon Snow. He'll be my forever hero. my King. # Gots8 . . # KitHarington # EmiliaClarke # GameofThrones # Got # Gotseason8 # Gotseason7 # kimilia # kit # milly # jonerys # jonsnow # daenerys # targaryen # dragon # wolf… https://www.instagram.com/p/Bw1v7KhAgKE/?igshid=1fsv0o4lxe4yr …,Neu,0.0,0.0,jon snow he ll be my forever hero my king gots8 kitharington emiliaclarke gameofthrones got gotseason8 gotseason7 kimilia kit milly jonerys jonsnow daenerys targaryen dragon wolf http www instagram com bw1v7khagke igshid 1fsv0o4lxe4yr
[SPOILER] Eu entendo que é difícil compreender e há até quem fique com raiva,Neu,0.0,0.0,spoiler eu entendo que é difícil compreender há até quem fique com raiva
When # Melisandre spoiled the 8x03 & 8x06 episodes of # GameofThrones long time a go... (3x06 - The Climb) # GOT # GoTS8 # ForTheThrone # JonSnow # AegonTargaryen # Daenerys # SansaStark # AryaStark # BranStark # CerseiLannister # NightKing # WhiteWalkerspic.twitter.com/EbxtBRLjCD,Neg,-0.05,0.4,when melisandre spoiled the 8x03 8x06 episode of gameofthrones long time go 3x06 the climb got gots8 forthethrone jonsnow aegontargaryen daenerys sansastark aryastark branstark cerseilannister nightking whitewalkerspic twitter com ebxtbrljcd
More Stills - # Gots8 episode 3 . . . # KitHarington # EmiliaClarke # GameofThrones # Got # Gotseason8 # Gotseason7 # kimilia # kit # milly # jonerys # jonsnow # daenerys # targaryen # dragon # wolf # winterfell # westeros # hbo… https://www.instagram.com/p/Bw1e-YRgdzZ/?igshid=1w7jq75v9d1l4 …,Pos,0.5,0.5,more still gots8 episode 3 kitharington emiliaclarke gameofthrones got gotseason8 gotseason7 kimilia kit milly jonerys jonsnow daenerys targaryen dragon wolf winterfell westeros hbo http www instagram com bw1e yrgdzz igshid 1w7jq75v9d1l4
Nos próximos episódios de # GameOfThrones,Neu,0.0,0.0,no próximos episódios de gameofthrones
That scene was amazing. My fav. # Gots8 w music and original. # jonerys . . . # KitHarington # EmiliaClarke # GameofThrones # Got # Gotseason8 # Gotseason7 # kimilia # kit # milly # jonerys # jonsnow # daenerys # targaryen… https://www.instagram.com/p/Bw1aD6dgFKY/?igshid=1brytg5ygw695 …,Pos,0.48750000000000004,0.825,that scene wa amazing my fav gots8 music and original jonerys kitharington emiliaclarke gameofthrones got gotseason8 gotseason7 kimilia kit milly jonerys jonsnow daenerys targaryen http www instagram com bw1ad6dgfky igshid 1brytg5ygw695
# DaenerysTargaryen se convierte en # JonSnow. Madre mía lo que hacen algunas para reinar en los 7 reinos # GameOfThrones # JuegoDeTronos # GOT # GoTS8 # TheFinalSeason # ForTheThrone # PorElTrono # EmiliaClarke # KitHaringtonpic.twitter.com/RZK3bTgobt,Neu,0.0,0.0,daenerystargaryen se convierte en jonsnow madre mía lo que hacen algunas para reinar en los 7 reinos gameofthrones juegodetronos got gots8 thefinalseason forthethrone poreltrono emiliaclarke kitharingtonpic twitter com rzk3btgobt
Was für eine Schlacht! Episch. # GameofThrones # got # GOTS8E3 # Got8x03 # gots8 # jonsnow # DaenerysTargaryen # SandorClegane # Melisandre # JamieLannister,Neu,0.0,0.0,wa für eine schlacht episch gameofthrones got gots8e3 got8x03 gots8 jonsnow daenerystargaryen sandorclegane melisandre jamielannister
