text,sentiment,polarity,subjectivity,Preprocess
¡¡¡EEESSS HHHOOOYYY!!! # AryaStark # Daenerys # Tyrion # JonSnow # Cersei # Sansa # BranStark # Theon # Varys # Missandei # TheHound # Greyworm # SerDavos # GameofThrones # GoTS8 # GOT # ForTheThronepic.twitter.com/QoOXszIxwh,Neu,0.0,0.0,eeesss hhhoooyyy aryastark daenerys tyrion jonsnow cersei sansa branstark theon varys missandei thehound greyworm serdavos gameofthrones gots8 got forthethronepic twitter com qooxszixwh
Happy New # GameOfThrones Season! May the last season bring you warmth,Pos,0.3234848484848485,0.5070707070707071,happy new gameofthrones season may the last season bring you warmth
A mi porque PESADA y peor con GOT,Neu,0.0,0.0,a mi porque pesada peor con got
Winter is here..... # got # ForTheThrone # gameofthrones # gots8 # jonsnow,Neu,0.0,0.0,winter is here got forthethrone gameofthrones gots8 jonsnow
Happy # GameOfThrones Day Many predictions circulating on final # GoTS8 outcome Would be interesting to see Whitewalkers defeated,Pos,0.45,0.75,happy gameofthrones day many prediction circulating on final gots8 outcome would be interesting to see whitewalkers defeated
!!!!!!!OFFICIAL!!!!!! A very popular theory of GoT says that the last episode ends in an asylum. The whole series was just imagination of Jon Snow,Pos,0.32666666666666666,0.48888888888888893,official very popular theory of got say that the last episode end in an asylum the whole series wa just imagination of jon snow
WINTER IS HERE… we’ll be posting episode reviews every Wed/Thur on our Fuse Assurance Fb pg http://www.facebook.com/FuseAssurance @ gameofthrones @ johnbradleywest # GOT # GoTS8 # insurance # GameofThrones # Season8 # WinterisComing # WinterisHere # NightKing # WhiteWalkers # JonSnow # DaenerysTargaryenpic.twitter.com/LLH5mTjq8q,Neu,0.0,0.0,winter is here we ll be posting episode review every wed thur on our fuse assurance fb pg http www facebook com fuseassurance gameofthrones johnbradleywest got gots8 insurance gameofthrones season8 winteriscoming winterishere nightking whitewalkers jonsnow daenerystargaryenpic twitter com llh5mtjq8q
WINTER IS HERE… we’ll be posting episode reviews every Wed/Thur on our Fuse Assurance Fbpg http://www.facebook.com/FuseAssurance @ gameofthrones @ johnbradleywest # GOT # GoTS8 # insurance # GameofThrones # Season8 # WinterisComing # WinterisHere # NightKing # WhiteWalkers # JonSnow # DaenerysTargaryenpic.twitter.com/F0r0svSNvs,Neu,0.0,0.0,winter is here we ll be posting episode review every wed thur on our fuse assurance fbpg http www facebook com fuseassurance gameofthrones johnbradleywest got gots8 insurance gameofthrones season8 winteriscoming winterishere nightking whitewalkers jonsnow daenerystargaryenpic twitter com f0r0svsnvs
Good Morning Thrones Fans! The final season of # GOT is almost upon us so I've decided to redo an old video. Check out my Top 10 # GameOfThrones Deaths! https://bit.ly/2UYeg0S # ForTheThrone # FinalSeason # JonSnow # TyrionLannister # ForTheThrone # GoTS8 # HBO # rt # retweet # followpic.twitter.com/DKdVyld77r,Pos,0.4,0.575,good morning throne fan the final season of got is almost upon u so ve decided to redo an old video check out my top 10 gameofthrones death http bit ly 2uyeg0s forthethrone finalseason jonsnow tyrionlannister forthethrone gots8 hbo rt retweet followpic twitter com dkdvyld77r
# TravelReady # AreYouReady # WhosExcited # OnlyGoTFanWillUnderstand # GoTFanKnows # IYKWIM # GoT # GoTS8 # GoTFinalSeason # GameofThrones # GameofThronesSeason8 # TheFinalSeason # ForTheThrone # EndGame # JonSnow # Westeros # Essospic.twitter.com/oIEFbKob7A,Neu,0.0,0.0,travelready areyouready whosexcited onlygotfanwillunderstand gotfanknows iykwim got gots8 gotfinalseason gameofthrones gameofthronesseason8 thefinalseason forthethrone endgame jonsnow westeros essospic twitter com oiefbkob7a
# WinterisHere @ johnniewalker_ . . . . . # johnniewalker # winterishere # BattleoftheBastards # GoTS8 # gameofthrones # cheers # valueonliquor # winterfell # JonSnow # arya # GOT… https://www.instagram.com/p/BwOn_wjhIAZ/?utm_source=ig_twitter_share&igshid=gmot6jy9zltz …,Neu,0.0,0.0,winterishere johnniewalker_ johnniewalker winterishere battleofthebastards gots8 gameofthrones cheer valueonliquor winterfell jonsnow arya got http www instagram com bwon_wjhiaz utm_source ig_twitter_share igshid gmot6jy9zltz
Love these two # Gots8 . . # KitHarington # EmiliaClarke # GameofThrones # Got # Gotseason8 # Gotseason7 # kimilia # kit # milly # jonerys # jonsnow # daenerys # targaryen # dragon # wolf… https://www.instagram.com/p/BwOY5PUgI_A/?utm_source=ig_twitter_share&igshid=1wcjdkizkcmam …,Pos,0.5,0.6,love these two gots8 kitharington emiliaclarke gameofthrones got gotseason8 gotseason7 kimilia kit milly jonerys jonsnow daenerys targaryen dragon wolf http www instagram com bwoy5pugi_a utm_source ig_twitter_share igshid 1wcjdkizkcmam
Começando os preparativos # ForTheThrone # GameofThrones # got # GoTS8 # Daenerys # DaenerysTargaryen # jonsnow # NightKingpic.twitter.com/f7pzO7tjha,Neu,0.0,0.0,começando o preparativos forthethrone gameofthrones got gots8 daenerys daenerystargaryen jonsnow nightkingpic twitter com f7pzo7tjha
It's TODAY!!! # deathandboobies # GOT # GameofThrones # GoTS8 # AryaStark # jonsnow # DaenerysTargaryen # GendryBaratheon # sansastarkhttps://youtu.be/0PuS1gSbLyI,Neu,0.0,0.0,it today deathandboobies got gameofthrones gots8 aryastark jonsnow daenerystargaryen gendrybaratheon sansastarkhttps youtu be 0pus1gsblyi
Ansiosissima pra Game of Thrones hihi # GameofThrones # got # gots8 # ForTheThrone # NightKing # WinterIsHere # DaenerysTargaryen # JonSnow pic.twitter.com/a8UXfBvzIX,Neg,-0.4,0.4,ansiosissima pra game of throne hihi gameofthrones got gots8 forthethrone nightking winterishere daenerystargaryen jonsnow pic twitter com a8uxfbvzix
HOJE TEM GAME OF THRONES PORRAAAAAAAAAAAAN # GameOfThrones # GoTS8 # GoT # JonSnow # Tyrion # Cersei # Daenerys # Sansa # WhiteWalkers # Brienne # BranStark,Neg,-0.4,0.4,hoje tem game of throne porraaaaaaaaaaaan gameofthrones gots8 got jonsnow tyrion cersei daenerys sansa whitewalkers brienne branstark
Horarios para ver la premier de la temporada final Game of Thrones /Juego de Tronos. # GameofThrones # GameofThronesSeason8 # GOT # GoTS8 # JuegodeTronos # winteriscoming # hbo # hbolat # JonSnow # DaenerysTargaryen # Daenerys # CerseiLannister # Cersei # AryaStark # TyrionLannister # Tyrion # rtpic.twitter.com/hkGoMuVqqx,Neg,-0.2,0.7,horarios para ver la premier de la temporada final game of throne juego de tronos gameofthrones gameofthronesseason8 got gots8 juegodetronos winteriscoming hbo hbolat jonsnow daenerystargaryen daenerys cerseilannister cersei aryastark tyrionlannister tyrion rtpic twitter com hkgomuvqqx
"Just heard someone say it's cold...winter is coming""...I'm like ""heck yeah it is"" # GOT # GoTS8 # # gendrya # GameofThrones # JonSnow""",Neu,0.0,0.0,just heard someone say it cold winter is coming m like heck yeah it is got gots8 gendrya gameofthrones jonsnow
Caralho,Neu,0.0,0.0,caralho
# GameofThronesSeason8 # GameofThrones # GOT # GoTS8 # khaleesi # JonSnow # AryaStark # SansaStark # TyrionLannister # NightKing # Cersei # winterisnow # WinterIsComingpic.twitter.com/H8gPwjQCbB,Neu,0.0,0.0,gameofthronesseason8 gameofthrones got gots8 khaleesi jonsnow aryastark sansastark tyrionlannister nightking cersei winterisnow winteriscomingpic twitter com h8gpwjqcbb
This @ gameofthrone Season 1-7 Recap Video is so cool! @ hbo @ emilia_clarke @ sophiet @ iamlenaheadey @ maisie_williams @ kitharingtonn @ peterdinklage # CreateBetterTogether # GameOfThrones # ForTheThrone # GoTS8 # YourFateAwaits # WinterIsComing # got # hbo # jonsnow # daenerystargaryenpic.twitter.com/QC0YEQqV90,Pos,0.4375,0.65,this gameofthrone season 1 7 recap video is so cool hbo emilia_clarke sophiet iamlenaheadey maisie_williams kitharingtonn peterdinklage createbettertogether gameofthrones forthethrone gots8 yourfateawaits winteriscoming got hbo jonsnow daenerystargaryenpic twitter com qc0yeqqv90
So you’re all caught up with # GameofThrones and not squeamish about gray characters,Neu,0.0,0.0,so you re all caught up with gameofthrones and not squeamish about gray character
1 día. La # GranGuerra está aquí. # GameOfThrones # GOTS8 # GoT # HBOLAT @ HBOLAT @ GameOfThrones # WinterIsHere # ForTheThrone # WinterIsComing # Dracarys # JonSnow # SansaStark # AryaStark # DaenerysTargaryen # JaimeLannister,Neu,0.0,0.0,1 día la granguerra está aquí gameofthrones gots8 got hbolat hbolat gameofthrones winterishere forthethrone winteriscoming dracarys jonsnow sansastark aryastark daenerystargaryen jaimelannister
Suraj Bharjatya's Game of Thrones # GOT # GameOfThrones # GoTS8 # GameofThronesSeason8 # JonSnow # DaenerysTargaryen # HotstarPremiumhttps://twitter.com/DisneyplusHSP/status/1116741510475603970 …,Neg,-0.4,0.4,suraj bharjatya game of throne got gameofthrones gots8 gameofthronesseason8 jonsnow daenerystargaryen hotstarpremiumhttps twitter com disneyplushsp status 1116741510475603970
GAME OF THRONES Season 7 Recap! In the penultimate season,Neg,-0.5,0.4,game of throne season 7 recap in the penultimate season
GAME OF THRONES Season 7 Recap! In the penultimate season,Neg,-0.5,0.4,game of throne season 7 recap in the penultimate season
"Completed rewatching all 7 seasons of GoT (took a few weeks). Watched all The Cast Remembers"" clips",Neg,-0.2,0.1,completed rewatching all 7 season of got took few week watched all the cast remembers clip
Saba? That you? . . . . . . # got # GameofThrones # PowerRangers # saba # whiteranger # whitewalker # WorldsCollide # JonSnow # tommyoliver # notshelby # itmaybebritishbutthisdidntcomeoutofbirmingham # GameofThronesSeason8 # GoTS8 # thewallhasfallen # ifyouwatchedpowerrangersyouwouldknowpic.twitter.com/Hdajqw1h80,Neu,0.0,0.0,saba that you got gameofthrones powerrangers saba whiteranger whitewalker worldscollide jonsnow tommyoliver notshelby itmaybebritishbutthisdidntcomeoutofbirmingham gameofthronesseason8 gots8 thewallhasfallen ifyouwatchedpowerrangersyouwouldknowpic twitter com hdajqw1h80
Me after seeing game of thrones season 8 and realizing there won't be a season 9 # GOT # April14 # GameofThrones # GameofThronesSeason8 # JonSnow # Khaleesi # Cersei # Sansa # AryaStark # Tyrion # JorahMormont # BranStark # HouseStark # DavosSeaworth # TheonGreyjoy # GoTS8 pic.twitter.com/HBLUWUOxt5,Neg,-0.4,0.4,me after seeing game of throne season 8 and realizing there won be season 9 got april14 gameofthrones gameofthronesseason8 jonsnow khaleesi cersei sansa aryastark tyrion jorahmormont branstark housestark davosseaworth theongreyjoy gots8 pic twitter com hbluwuoxt5
2 días. La # GranGuerra está aquí. # GameOfThrones # GOTS8 # GoT # HBOLAT @ HBOLAT @ GameOfThrones # WinterIsHere # ForTheThrone # WinterIsComing # ForTheThrone # Dracarys # JonSnow # SansaStark # AryaStark # DaenerysTargaryen # JaimeLannister,Neu,0.0,0.0,2 días la granguerra está aquí gameofthrones gots8 got hbolat hbolat gameofthrones winterishere forthethrone winteriscoming forthethrone dracarys jonsnow sansastark aryastark daenerystargaryen jaimelannister
Kit Harington at Belfast Premier of # Gots8 . . # KitHarington # EmiliaClarke # GameofThrones # Got # Gotseason8 # Gotseason7 # kimilia # kit # milly # jonerys # jonsnow # daenerys # targaryen # dragon… https://www.instagram.com/p/BwKerx4gDwG/?utm_source=ig_twitter_share&igshid=fjahf7f9f4m5 …,Neu,0.0,0.0,kit harington at belfast premier of gots8 kitharington emiliaclarke gameofthrones got gotseason8 gotseason7 kimilia kit milly jonerys jonsnow daenerys targaryen dragon http www instagram com bwkerx4gdwg utm_source ig_twitter_share igshid fjahf7f9f4m5
Con que no mueran # JonSnow o # AryaStark estoy más que bien. @ GameOfThrones @ GRRMspeaking # GameOfThrones # ForTheThrone # GeorgeRRMartin # GoT # GoTS8 # Pictoline http://instagram.com/p/BwKdc4uBoPO/,Neu,0.0,0.0,con que no mueran jonsnow aryastark estoy más que bien gameofthrones grrmspeaking gameofthrones forthethrone georgerrmartin got gots8 pictoline http instagram com bwkdc4ubopo
Who Seats At The Iron Throne At The End Of # GameOfThrones - Odds # BranStark - 3 # JonSnow - 3.8 # DaenerysTargaryen - 5.5 # SansaStark - 7 # NightKing - 10 # AryaStark - 19 # CerseiLannister 23 Bet Here http://bit.ly/winsgot # GOT # GOTS8 # AccessBET # HBOpic.twitter.com/0ZSZ4tW6jt,Neu,0.0,0.0,who seat at the iron throne at the end of gameofthrones odds branstark 3 jonsnow 3 8 daenerystargaryen 5 5 sansastark 7 nightking 10 aryastark 19 cerseilannister 23 bet here http bit ly winsgot got gots8 accessbet hbopic twitter com 0zsz4tw6jt
# gots8 - cast first day on set . . # forthethrone . . # KitHarington # EmiliaClarke # GameofThrones # Got # Gotseason8 # Gotseason7 # kimilia # kit # milly # jonerys # jonsnow # daenerys # targaryen… https://www.instagram.com/p/BwKYBReAwtV/?utm_source=ig_twitter_share&igshid=f27uhu3orwgo …,Pos,0.25,0.3333333333333333,gots8 cast first day on set forthethrone kitharington emiliaclarke gameofthrones got gotseason8 gotseason7 kimilia kit milly jonerys jonsnow daenerys targaryen http www instagram com bwkybreawtv utm_source ig_twitter_share igshid f27uhu3orwgo
“Ele nunca foi um bastardo. Ele é o herdeiro do Trono de Ferro.” A temporada final chega nesse Domingo,Neu,0.0,1.0,ele nunca foi um bastardo ele é herdeiro do trono de ferro temporada final chega nesse domingo
"I drink and I know things""- Tyrion Lannister. Get the best of both worlds for the big premiere with Red Eye Louies. # GOT # GOTS8 # GameofThrones # Khaleesi # Daenerys # JonSnow # Stark # Targaryen # NightKing # Dragons # Vodquila # Rumquila # REL # RedEyeLouies # Rum # Tequila # Vodka # winepic.twitter.com/nYdJ7klZl8""",Pos,0.2,0.25,i drink and know thing tyrion lannister get the best of both world for the big premiere with red eye louies got gots8 gameofthrones khaleesi daenerys jonsnow stark targaryen nightking dragon vodquila rumquila rel redeyelouies rum tequila vodka winepic twitter com nydj7klzl8
"I drink and I know things""- Tyrion Lannister. Get the best of both worlds for the big premiere with Red Eye Louies. # GOT # GOTS8 # GameofThrones # Khaleesi # Daenerys # JonSnow # Stark # Targaryen # NightKing # Dragons # Vodquila # Rumquila # REL # RedEyeLouies # Rum # Tequila # Vodka # winepic.twitter.com/lWRTVTRFNs""",Pos,0.2,0.25,i drink and know thing tyrion lannister get the best of both world for the big premiere with red eye louies got gots8 gameofthrones khaleesi daenerys jonsnow stark targaryen nightking dragon vodquila rumquila rel redeyelouies rum tequila vodka winepic twitter com lwrtvtrfns
"I drink and I know things""- Tyrion Lannister. Get the best of both worlds for the big premiere with Red Eye Louies. # GOT # GOTS8 # GameofThrones # Khaleesi # Daenerys # JonSnow # Stark # Targaryen # NightKing # Dragons # Vodquila # Rumquila # REL # RedEyeLouies # Rum # Tequila # Vodka # winepic.twitter.com/eOwW5vTfAW""",Pos,0.2,0.25,i drink and know thing tyrion lannister get the best of both world for the big premiere with red eye louies got gots8 gameofthrones khaleesi daenerys jonsnow stark targaryen nightking dragon vodquila rumquila rel redeyelouies rum tequila vodka winepic twitter com eoww5vtfaw
¿Cuál fue la muerte más impactante de Game of Thrones? # GameofThrones # GOTS8 # got # JuegodeTronos # HBO # domingot # domingo # JonSnow # TyrionLannister # JaimeLannister # ramsaybolton # Stark # HouseStark # Lannister # aryastark # brienneoftarth # DaenerysTargaryen # series # ForTheThrone,Neg,-0.30000000000000004,0.5,cuál fue la muerte más impactante de game of throne gameofthrones gots8 got juegodetronos hbo domingot domingo jonsnow tyrionlannister jaimelannister ramsaybolton stark housestark lannister aryastark brienneoftarth daenerystargaryen series forthethrone
GAME OF THRONES Season 6 Recap! All attentions turn back to... Full recap at https://lnkd.in/dTiz4qh @ gameofthrones # GOT # season8 # GameofThrones # WinterisComing # JonSnow # DaenerysTargaryen # love # lifechoice # lovelife # lifeinsurance # fuseassurance # GoTS8 # KitHarington # insurancepic.twitter.com/E6y27i7Q3a,Pos,0.0875,0.3875,game of throne season 6 recap all attention turn back to full recap at http lnkd in dtiz4qh gameofthrones got season8 gameofthrones winteriscoming jonsnow daenerystargaryen love lifechoice lovelife lifeinsurance fuseassurance gots8 kitharington insurancepic twitter com e6y27i7q3a
MEJORES MOMENTOS DE GOT ¿Coincidís? ¿Cuáles son los mejores para vos? Te leemos # GameofThrones # GOT # ForTheThrone # JonSnow # kinginthenorth # Daenerys # motherofdragons # SansaStark # AryaStark # CerseiLannister # JaimeLannister # TyrionLannister # SamwellTarly # GoTS8 pic.twitter.com/jytzoxGXh3,Neu,0.0,0.0,mejores momentos de got coincidís cuáles son los mejores para vos te leemos gameofthrones got forthethrone jonsnow kinginthenorth daenerys motherofdragons sansastark aryastark cerseilannister jaimelannister tyrionlannister samwelltarly gots8 pic twitter com jytzoxgxh3
Oh winter came alright... Bet you didn't realize Dany and Jon are related. Bring on Season 8! 2 more sleeps! # goT # gameofthrones # goTS8 # daenerystargaryen # jonsnow # dragons… https://www.instagram.com/p/BwJm_XHAQtY/?utm_source=ig_twitter_share&igshid=1qrl24xg32abm …,Pos,0.3125,0.45,oh winter came alright bet you didn realize dany and jon are related bring on season 8 2 more sleep got gameofthrones gots8 daenerystargaryen jonsnow dragon http www instagram com bwjm_xhaqty utm_source ig_twitter_share igshid 1qrl24xg32abm
Winter is coming - Buenos Aires # GOT # GoTS8 # GameofThrones # JonSnow # Jonerys # Daenerys @ Kit_Haringtcn @ emiliaclarkepic.twitter.com/Aqx39ownSj,Neu,0.0,0.0,winter is coming buenos aire got gots8 gameofthrones jonsnow jonerys daenerys kit_haringtcn emiliaclarkepic twitter com aqx39ownsj
Don't mind me. Just want to do this. # GoTs8 # GoT # AryaStark # SansaStark # Daenerys # DaenerysTargaryen # JonSnow # Cersei # CerseiLannister # JaimeLannister # Tyrion # TyrionLannister # WhiteWalkers # NightKing # GameofThrones # BranStark # Brienne # BrienneOfTarth # Theon # TheonGreyjoy,Neu,0.0,0.0,don mind me just want to do this gots8 got aryastark sansastark daenerys daenerystargaryen jonsnow cersei cerseilannister jaimelannister tyrion tyrionlannister whitewalkers nightking gameofthrones branstark brienne brienneoftarth theon theongreyjoy
And we will fight for the Kingdoms that are ours. For life # ForTheThrone # DaenerysTargaryen # GameOfThrones # gots8 # got # GoTCopingSkills # Daenerys # DaenerysTargaryen # dragons # NightKing # JonSnow # CerseiLannister # Cersei # TyrionLannister # Tyrion pic.twitter.com/kRqPqr7aW5pic.twitter.com/3UsRtjZiBw,Neu,0.0,0.0,and we will fight for the kingdom that are ours for life forthethrone daenerystargaryen gameofthrones gots8 got gotcopingskills daenerys daenerystargaryen dragon nightking jonsnow cerseilannister cersei tyrionlannister tyrion pic twitter com krqpqr7aw5pic twitter com 3usrtjzibw
Making the vision clear... Miss me? Or still unsure about the fight? # ForTheThrone # DaenerysTargaryen # GameOfThrones # gots8 # got # GoTCopingSkills # Daenerys # DaenerysTargaryen # dragons # NightKing # JonSnow # CerseiLannister # Cersei # TyrionLannister # Tyrionpic.twitter.com/kRqPqr7aW5,Pos,0.10000000000000002,0.3833333333333333,making the vision clear miss me or still unsure about the fight forthethrone daenerystargaryen gameofthrones gots8 got gotcopingskills daenerys daenerystargaryen dragon nightking jonsnow cerseilannister cersei tyrionlannister tyrionpic twitter com krqpqr7aw5
¿Cuál fue el mejor enfrentamiento de Game of Thrones? # GameofThrones # GOTS8 # got # JuegodeTronos # HBO # domingot # domingo # JonSnow # TyrionLannister # JaimeLannister # ramsaybolton # Stark # HouseStark # Lannister # aryastark # brienneoftarth # DaenerysTargaryen # series # ForTheThrone,Neg,-0.30000000000000004,0.5,cuál fue el mejor enfrentamiento de game of throne gameofthrones gots8 got juegodetronos hbo domingot domingo jonsnow tyrionlannister jaimelannister ramsaybolton stark housestark lannister aryastark brienneoftarth daenerystargaryen series forthethrone
¿Cuál es el mejor personaje de Game of Thrones? # GameofThrones # GOTS8 # got # JuegodeTronos # HBO # domingot # domingo # JonSnow # TyrionLannister # JaimeLannister # ramsaybolton # Stark # HouseStark # Lannister # aryastark # SansaStark # DaenerysTargaryen # Encuesta # series # GOT7 # ForTheThrone,Neg,-0.30000000000000004,0.5,cuál e el mejor personaje de game of throne gameofthrones gots8 got juegodetronos hbo domingot domingo jonsnow tyrionlannister jaimelannister ramsaybolton stark housestark lannister aryastark sansastark daenerystargaryen encuesta series got7 forthethrone
¿Quién va a morir al final de Game of Thrones? # GameofThrones # GOTS8 # got # JuegodeTronos # HBO # domingot # domingo # JonSnow # TyrionLannister # JaimeLannister # ramsaybolton # Stark # HouseStark # Lannister # aryastark # SansaStark # DaenerysTargaryen # Encuesta # series # GOT7 # ForTheThrone,Neg,-0.20000000000000004,0.6666666666666666,quién va morir al final de game of throne gameofthrones gots8 got juegodetronos hbo domingot domingo jonsnow tyrionlannister jaimelannister ramsaybolton stark housestark lannister aryastark sansastark daenerystargaryen encuesta series got7 forthethrone
¿Cuál es la mejor batalla de Game of Thrones? # GameofThrones # GOTS8 # got # JuegodeTronos # HBO # domingot # domingo # JonSnow # TyrionLannister # JaimeLannister # ramsaybolton # Stark # HouseStark # Lannister # aryastark # SansaStark # DaenerysTargaryen # Encuesta # series # GOT7 # ForTheThrone,Neg,-0.30000000000000004,0.5,cuál e la mejor batalla de game of throne gameofthrones gots8 got juegodetronos hbo domingot domingo jonsnow tyrionlannister jaimelannister ramsaybolton stark housestark lannister aryastark sansastark daenerystargaryen encuesta series got7 forthethrone
Pfffff tres dias para Juego de Tronos madre mia ¿ Que pasara ? # JuegodeTronos # GameOfThrones # ForTheThrone # Thedeathiscoming # JonSnow # DaenerysTargaryen # Westeros # Winterfell # Dragonstone # Kingslanding # GOT # GoTS8 # HBO,Neu,0.0,0.0,pfffff tres dia para juego de tronos madre mia que pasara juegodetronos gameofthrones forthethrone thedeathiscoming jonsnow daenerystargaryen westeros winterfell dragonstone kingslanding got gots8 hbo
3 días. La # GranGuerra está aquí. # GameOfThrones # GOTS8 # GoT # HBOLAT @ HBOLAT @ GameOfThrones # WinterIsHere # ForTheThrone # WinterIsComing # ForTheThrone # Dracarys # JonSnow # SansaStark # AryaStark # DaenerysTargaryen # JaimeLannister,Neu,0.0,0.0,3 días la granguerra está aquí gameofthrones gots8 got hbolat hbolat gameofthrones winterishere forthethrone winteriscoming forthethrone dracarys jonsnow sansastark aryastark daenerystargaryen jaimelannister
It’s Time to # Embrace the # Heart of # GameOfThrones: # Incest https://www.theringer.com/tv/2019/4/11/18305245/game-of-thrones-incest-daenerys-jon-snow?utm_campaign=theringer&utm_content=entry&utm_medium=social&utm_source=twitter … via @ ringer # Daenerys # JonSnow # News # TV # HBO # GoT # GoTS8 # GameOfThronesLooseEnds # LooseEnds # GameOfThronesSeason8 # Premiere # Season8,Neu,0.0,0.0,it time to embrace the heart of gameofthrones incest http www theringer com tv 2019 4 11 18305245 game of throne incest daenerys jon snow utm_campaign theringer utm_content entry utm_medium social utm_source twitter via ringer daenerys jonsnow news tv hbo got gots8 gameofthroneslooseends looseends gameofthronesseason8 premiere season8
GAME OF THRONES Season 5 Recap! With families and old alliances torn to pieces... Full recap at https://lnkd.in/dTiz4qh @ gameofthrones # GOT # season8 # GameofThrones # WinterisComing # JonSnow # DaenerysTargaryen # love # lifechoice # lovelife # lifeinsurance # fuseassurance # GoTS8 pic.twitter.com/HtMzV7uO2t,Pos,0.11249999999999999,0.4375,game of throne season 5 recap with family and old alliance torn to piece full recap at http lnkd in dtiz4qh gameofthrones got season8 gameofthrones winteriscoming jonsnow daenerystargaryen love lifechoice lovelife lifeinsurance fuseassurance gots8 pic twitter com htmzv7uo2t
SEGUIMOS CON LAS CURIOSIDADES DE GOT # GameofThrones # GOT # GoTS8 # ForTheThrone # JonSnow # kinginthenorth # Daenerys # motherofdragons # emiliaclarke # sansastark # sophieturner # aryastark # maisewilliams # cerseilannister # jaimelannister # tyrtyrionlannister # samwelltarlypic.twitter.com/s2solkeKrz,Neu,0.0,0.0,seguimos con la curiosidades de got gameofthrones got gots8 forthethrone jonsnow kinginthenorth daenerys motherofdragons emiliaclarke sansastark sophieturner aryastark maisewilliams cerseilannister jaimelannister tyrtyrionlannister samwelltarlypic twitter com s2solkekrz
# PowerRanking the 25 # MostAnticipated # Reunions in # GameOfThrones # Season 8 https://www.theringer.com/tv/2019/4/11/18305013/game-of-thrones-season-8-reunions-arya-jon-jaime-bran-melisandre-davos?utm_campaign=theringer&utm_content=entry&utm_medium=social&utm_source=twitter … via @ ringer # Arya # JonSnow # Jaime # Bran # Melisandre # Davos # News # TV # HBO # GoT # GoTS8 # GameOfThronesLooseEnds # LooseEnds # GameOfThronesSeason8,Neu,0.0,0.0,powerranking the 25 mostanticipated reunion in gameofthrones season 8 http www theringer com tv 2019 4 11 18305013 game of throne season 8 reunion arya jon jaime bran melisandre davos utm_campaign theringer utm_content entry utm_medium social utm_source twitter via ringer arya jonsnow jaime bran melisandre davos news tv hbo got gots8 gameofthroneslooseends looseends gameofthronesseason8
