text,sentiment,polarity,subjectivity,Preprocess
*SPOILERS* # SansaStark : What do dragons eat anyway.. # DaenerysTargaryen : Whatever they want! # GameofThrones India spoilers # GOT # GoTS8 # GOT8 time @ GameOfThrones @ hotstartweetspic.twitter.com/OZF02dLcRD,Neu,0.0,0.0,spoiler sansastark what do dragon eat anyway daenerystargaryen whatever they want gameofthrones india spoiler got gots8 got8 time gameofthrones hotstartweetspic twitter com ozf02dlcrd
8 years later and # SansaStark STILL pisses me off.. I really can't figure out what ppl see in her she LITERALLY think that she made herself and out bested the rest I mean,Neg,-0.0375,0.29583333333333334,8 year later and sansastark still piss me off really can figure out what ppl see in her she literally think that she made herself and out bested the rest mean
TIA! Yo tb Hoy he sido muy team Sansa. A Danerys cada vez la soporto menos hoy se ha lucido también... Agg! # TeamSansa y # TeamArya # AryaStark # SansaStark # GameofThrones # GameofThronesSeason8 # GoTS8 # GOT,Neu,0.0,0.0,tia yo tb hoy he sido muy team sansa danerys cada vez la soporto menos hoy se ha lucido también agg teamsansa teamarya aryastark sansastark gameofthrones gameofthronesseason8 gots8 got
NO SOPORTO A # SANSA # SansaStark # GOT # GameofThrones # GoTS8,Neu,0.0,0.0,no soporto sansa sansastark got gameofthrones gots8
HELP! # GameofThrones # GoTS8 # GOT # JonSnow # SansaStark # aryastark # BranStark # Daeneryspic.twitter.com/JKZ3mHShrI,Neu,0.0,0.0,help gameofthrones gots8 got jonsnow sansastark aryastark branstark daeneryspic twitter com jkz3mhshri
Qual tem mais chance de morrer? # daenerystargaryen # JonSnow # CerseiLannister # SansaStark # Sansa # GameofThrones # GameofThronesSeason8 # GOT # GOT8 # GotS8,Neu,0.0,0.0,qual tem mais chance de morrer daenerystargaryen jonsnow cerseilannister sansastark sansa gameofthrones gameofthronesseason8 got got8 gots8
Espere 2 años para el pu*o primer capítulo me deje asi... 1 semana mas tengo q esperar para ver q pasa lpmqlrp!!!!!!! # GameofThrones # GoTS8 # GOT # ForTheThrone # GoTS8E1 # WinterIsHere # AegonTargeryan # JonSnow # AryaStark # DaenerysTargaryen # SansaStark # JorahMormont # TyrionLannister,Neu,0.0,0.0,espere 2 años para el pu primer capítulo me deje asi 1 semana ma tengo esperar para ver pasa lpmqlrp gameofthrones gots8 got forthethrone gots8e1 winterishere aegontargeryan jonsnow aryastark daenerystargaryen sansastark jorahmormont tyrionlannister
BEST PART OF EPISODE Sansa: “I used to think you were the the clever man of all” SUCK IT TYRION!! Ask Cersei for help... PFFF!!! Idiot! # GoT # GameOfThrones # GoTS8 # SansaStark,Pos,0.16954210069444442,0.6444444444444445,best part of episode sansa used to think you were the the clever man of all suck it tyrion ask cersei for help pfff idiot got gameofthrones gots8 sansastark
"Did you bend your knee to save the north or because you love her?"" —Sansa Stark # ForTheThrone # GameOfThrones # GoT # GoTS8 # SansaStark""",Pos,0.15,0.6,did you bend your knee to save the north or because you love her sansa stark forthethrone gameofthrones got gots8 sansastark
Quais são suas apostas para o trono de ferro? # daenerystargaryen # JonSnow # CerseiLannister # SansaStark # Sansa # GameofThrones # GameofThronesSeason8 # GOT # GOT8 # GotS8,Neu,0.0,0.0,quais são suas apostas para trono de ferro daenerystargaryen jonsnow cerseilannister sansastark sansa gameofthrones gameofthronesseason8 got got8 gots8
Well that just scared the shit out of me! # GameofThronesSeason8 # GameOfThrones # GoT # GoTS8 # AryaStark # JonSnow # SansaStark # TyrionLannister # Tormund,Neg,-0.25,0.8,well that just scared the shit out of me gameofthronesseason8 gameofthrones got gots8 aryastark jonsnow sansastark tyrionlannister tormund
Dany please tell me you’re not asking the man to choose between you and his sister? # GameOfThrones # GOT # GameOfThronesSeason8 # ThronesYall # DemThrones # GoTS8 # GOT8 # DaenerysTargaryen # JonSnow # SansaStark,Neu,0.0,0.0,dany please tell me you re not asking the man to choose between you and his sister gameofthrones got gameofthronesseason8 thronesyall demthrones gots8 got8 daenerystargaryen jonsnow sansastark
Ultimate Lucky you @ joejonas # JoeJonas # SansaStark # GameofThrones # GOTS8 # GOT # GOTonHotstarPremiumhttps://twitter.com/joejonas/status/1117584457001603073 …,Pos,0.16666666666666666,0.9166666666666667,ultimate lucky you joejonas joejonas sansastark gameofthrones gots8 got gotonhotstarpremiumhttps twitter com joejonas status 1117584457001603073
I forgot to pee before 9pm # GameofThronesSeason8 # GameOfThrones # GoT # GoTS8 # AryaStark # JonSnow # SansaStark # TyrionLannister,Neu,0.0,0.0,i forgot to pee before 9pm gameofthronesseason8 gameofthrones got gots8 aryastark jonsnow sansastark tyrionlannister
. . ..Winter is Here.. . . Yasss. # AryaStark # TyrionLannister # JonSnow # DaenerysTargaryen # BranStark # BrienneOfTarth # SamwellTarly # SansaStark # TeamStargaryen # GameofThrones # GoT # GOT8 # GoTS8 # GameofThronesSeason8 # GoTseason8,Neu,0.0,0.0,winter is here yasss aryastark tyrionlannister jonsnow daenerystargaryen branstark brienneoftarth samwelltarly sansastark teamstargaryen gameofthrones got got8 gots8 gameofthronesseason8 gotseason8
# SansaStark makes a good point though. The North is not prepared to care for all of these people. # GameofThrones # GoT # GoTS8,Pos,0.7,0.6000000000000001,sansastark make good point though the north is not prepared to care for all of these people gameofthrones got gots8
I actually really like Sansa and Tyrion together. # GameOfThrones # GOT # GameOfThronesSeason8 # ThronesYall # DemThrones # GoTS8 # GOT8 # TyrionLannister # SansaStark,Pos,0.2,0.2,i actually really like sansa and tyrion together gameofthrones got gameofthronesseason8 thronesyall demthrones gots8 got8 tyrionlannister sansastark
Sansa has mastered the ancient art of the resting bitch face # GameofThrones # GoT # GoTS8 # sansastark # HouseStark # ForTheThrone # ForTheWatch,Neu,0.0,0.0,sansa ha mastered the ancient art of the resting bitch face gameofthrones got gots8 sansastark housestark forthethrone forthewatch
I’ve never been more excited for winter! # GameofThronesSeason8 # GameOfThrones # GoT # GoTS8 # AryaStark # JonSnow # SansaStark # TyrionLannister,Pos,0.484375,0.625,i ve never been more excited for winter gameofthronesseason8 gameofthrones got gots8 aryastark jonsnow sansastark tyrionlannister
LA NUEVA INTRO!!!!!!!!!!!!!! # GameOfThrones # GOT # GoTS8 # JonSnow # DaenerysTargaryen # SansaStark # AegonTargaryen # AryaStarkpic.twitter.com/rjQWLNuSux,Neu,0.0,0.0,la nueva intro gameofthrones got gots8 jonsnow daenerystargaryen sansastark aegontargaryen aryastarkpic twitter com rjqwlnusux
É bom colocar um casaco: o inverno chegou em Westeros # GoT # GOTS8 @ hbo @ GameOfThrones # GameofThrones # DaenerysTargaryen # AryaStark # SansaStark # HBO # FireAndIce # GOT # JonSnow,Pos,0.05,1.0,é bom colocar um casaco inverno chegou em westeros got gots8 hbo gameofthrones gameofthrones daenerystargaryen aryastark sansastark hbo fireandice got jonsnow
@ HBOLAT ME ESTA MATANDO CON SUS PROPOSICIONALES A TAN SOLO TRES PUTOS MINUTOS!!!!! # GameOfThrones # GOT # GoTS8 # JonSnow # DaenerysTargaryen # SansaStark # AegonTargaryen # AryaStarkpic.twitter.com/WdQdKNO7vA,Neu,0.0,0.0,hbolat me esta matando con sus proposicionales tan solo tres putos minutos gameofthrones got gots8 jonsnow daenerystargaryen sansastark aegontargaryen aryastarkpic twitter com wdqdkno7va
I am ready! # GameofThrones # GoTS8 # GOT # JonSnow # SansaStark # AryaStark # BranStark # Daenerys # ForTheThrone pic.twitter.com/4EOCH7BqJ1,Pos,0.25,0.5,i am ready gameofthrones gots8 got jonsnow sansastark aryastark branstark daenerys forthethrone pic twitter com 4eoch7bqj1
MUST PROTECC THE STARK GIRLS AT ALL COST # AryaStark # SansaStark # ForTheThrone # GameOfThrones # GoT # GoTS8 https://twitter.com/GameOfThrones/status/1117585830497984514 …,Neg,-0.2,0.6,must protecc the stark girl at all cost aryastark sansastark forthethrone gameofthrones got gots8 http twitter com gameofthrones status 1117585830497984514
HOY VUELVE # GameOfThrones # SansaStark # GoTS8 # GOT @ SophieT @ GameOfThronespic.twitter.com/2EwrkSCHk6,Neu,0.0,0.0,hoy vuelve gameofthrones sansastark gots8 got sophiet gameofthronespic twitter com 2ewrkschk6
1h to # GameofThrones # GoT # GoTS8 # WinterIsHere # jonsnow # DaenerysTargaryen # SansaStark # aryastarkpic.twitter.com/GSfOUx2KHG,Neu,0.0,0.0,1h to gameofthrones got gots8 winterishere jonsnow daenerystargaryen sansastark aryastarkpic twitter com gsfoux2khg
Los HT de hoy: # GameofThrones # ForTheThrone # PorElTrono # JonSnow # DaenerysTargaryen # TyrionLannister # CerseiLannister # JaimeLannister # AryaStark # SansaStark # BranStark # NightKing # GoTS8 # GoT # WinterIsHere,Neu,0.0,0.0,los ht de hoy gameofthrones forthethrone poreltrono jonsnow daenerystargaryen tyrionlannister cerseilannister jaimelannister aryastark sansastark branstark nightking gots8 got winterishere
Amen # GameofThrones # GOT # GoTS8 # ForTheThrone # winterishere # HouseStark # JonSnow # Tyrion # AryaStark # DaenerysTargaryen # JaimeLannister # sansastark https://twitter.com/pictoline/status/1117566335934922753 …,Neu,0.0,0.0,amen gameofthrones got gots8 forthethrone winterishere housestark jonsnow tyrion aryastark daenerystargaryen jaimelannister sansastark http twitter com pictoline status 1117566335934922753
Les estoy explotando el tw de Game Of Thrones? Se joda cb espere 2 años # GOT # GoTS8 # GameOfThrones # ForTheThrone # DaenerysTargaryen # JonSnow # AryaStark # SansaStark # BranStark # Tyrion # CerseiLannister # JaimeLannister # BrienneOfTarth # TheonGreyjoy # TheHound # Jorah,Neg,-0.4,0.4,le estoy explotando el tw de game of throne se joda cb espere 2 años got gots8 gameofthrones forthethrone daenerystargaryen jonsnow aryastark sansastark branstark tyrion cerseilannister jaimelannister brienneoftarth theongreyjoy thehound jorah
# motherofdragons # daenerystargaryen # melisandre # jonsnow # aryastark # sansastark # branstark # samtarly # TyrionLannister # CerseiLannister # JaimeLannister # varys # got # GoTS8 # GameofThrones,Neu,0.0,0.0,motherofdragons daenerystargaryen melisandre jonsnow aryastark sansastark branstark samtarly tyrionlannister cerseilannister jaimelannister varys got gots8 gameofthrones
Happy Game of Thrones Day! # gameofthrones # GOT8 # GoTS8 # got # WinterIsHere # JonSnow # SansaStark # GameofThronesSeason8 # KitHarington # babieswithhairpic.twitter.com/X6DZL5DALp,Pos,0.15000000000000002,0.7,happy game of throne day gameofthrones got8 gots8 got winterishere jonsnow sansastark gameofthronesseason8 kitharington babieswithhairpic twitter com x6dzl5dalp
595 days and now,Neu,0.0,0.0,595 day and now
Who’s next? # DaenerysTargaryen # JonSnow # CerseiLannister # AryaStark # JaimeLannister # TyrionLannister # SansaStark # BranStark # TheHound @ GameOfThrones # GOT # GOTS8 # GOT8 # GOTfinalseason # GameOfThrones # Endgame # Forthethrone # poreltorno # winteriscoming # GameofThronesSeason8pic.twitter.com/AgwNQUQhag,Neu,0.0,0.0,who next daenerystargaryen jonsnow cerseilannister aryastark jaimelannister tyrionlannister sansastark branstark thehound gameofthrones got gots8 got8 gotfinalseason gameofthrones endgame forthethrone poreltorno winteriscoming gameofthronesseason8pic twitter com agwnquqhag
Hoy. La # GranGuerra está aquí. # DominGoT # GameOfThrones # GOTS8 # GoT # HBOLAT @ HBOLAT @ GameOfThrones # WinterIsHere # ForTheThrone # WinterIsComing # Dracarys # JonSnow # SansaStark # AryaStark # DaenerysTargaryen # JaimeLannister,Neu,0.0,0.0,hoy la granguerra está aquí domingot gameofthrones gots8 got hbolat hbolat gameofthrones winterishere forthethrone winteriscoming dracarys jonsnow sansastark aryastark daenerystargaryen jaimelannister
Lady of Winterfell # SansaStark http://www.instagram.com/mafer_baruta # GameOfThrones # ForTheThrone # got # GoTS8 # ArtOfTheDay # illustration # DigitalArtist # characterdesign # SophieTurnerpic.twitter.com/9auuouA08J,Neu,0.0,0.0,lady of winterfell sansastark http www instagram com mafer_baruta gameofthrones forthethrone got gots8 artoftheday illustration digitalartist characterdesign sophieturnerpic twitter com 9auuoua08j
@ gameofthrones tonight on # HBO # runlocaldrinklocal # beer5k # ForTheThrone # GameofThrones # GOT # WinterIsComing # SummerIsComing # winterishere # ironthrone # jonsnow # winterfell # yourfateawaits # GoTS8 # summergoals # daenerystargaryen # aryastark # sansastark # emiliaclarke # kitharingtonpic.twitter.com/q8urXcQfb0,Neu,0.0,0.0,gameofthrones tonight on hbo runlocaldrinklocal beer5k forthethrone gameofthrones got winteriscoming summeriscoming winterishere ironthrone jonsnow winterfell yourfateawaits gots8 summergoals daenerystargaryen aryastark sansastark emiliaclarke kitharingtonpic twitter com q8urxcqfb0
 Kneel,Neu,0.0,0.0,kneel
I found all emoji hashtags of Game of Thrones S8 : # GameofThrones # ForTheThrone # GOT # GoTS8 》 # JonSnow # DaenerysTargaryen # Daenerys # SansaStark # Sansa # AryaStark # BranStark # TyrionLannister # Tyrion # CerseiLannister # Cersei # NightKing # Brienneoftarth # Brienne # DavosSeaworth,Neg,-0.4,0.4,i found all emoji hashtags of game of throne s8 gameofthrones forthethrone got gots8 jonsnow daenerystargaryen daenerys sansastark sansa aryastark branstark tyrionlannister tyrion cerseilannister cersei nightking brienneoftarth brienne davosseaworth
@ IPL cricketers and their Game of Thrones Equivalents # GameOfThrones # GoT # GoTS8 # ForTheThrone # GameofThronesSeason8 # thefinalseason # DaenerysTargaryen # JonSnow # AryaStark # TyrionLannister # SansaStark # BranStark # TheHound # CerseiLannister https://www.cricadium.com/ipl-cricketers-and-their-game-of-thrones-characters-equivalents/ …,Neg,-0.4,0.4,ipl cricketer and their game of throne equivalent gameofthrones got gots8 forthethrone gameofthronesseason8 thefinalseason daenerystargaryen jonsnow aryastark tyrionlannister sansastark branstark thehound cerseilannister http www cricadium com ipl cricketer and their game of throne character equivalent
FINALMENTE HOJE!!! Via: GOT da depressão # Series # MaratonaDeSeries # ViciadosEmSeries # GoTS8 # DominGot # GameOfThrones # GOT # ForTheThrone # WinterIsHere # DaenerysTargaryen # IronThrone # JonSnow # NightKing # SansaStark # AryaStark # BranStark # CerseiLannisterpic.twitter.com/xYobnmoMOG,Neu,0.0,0.0,finalmente hoje via got da depressão series maratonadeseries viciadosemseries gots8 domingot gameofthrones got forthethrone winterishere daenerystargaryen ironthrone jonsnow nightking sansastark aryastark branstark cerseilannisterpic twitter com xyobnmomog
# JonSnow # DaenerysTargaryen # AryaStark # SansaStark # BranStark # TyrionLannister # CerseiLannister # JaimeLannister # JorahMormont # SamwellTarly # NightKing # WhiteWalkers # ForTheThrone # GameofThrones # GOT # GoTS8,Neu,0.0,0.0,jonsnow daenerystargaryen aryastark sansastark branstark tyrionlannister cerseilannister jaimelannister jorahmormont samwelltarly nightking whitewalkers forthethrone gameofthrones got gots8
Mis chicas,Neu,0.0,0.0,mi chicas
The time has come. # GameofThrones # GoTS8 # ForTheThrone # DaenerysTargaryen # MotherOfDragons # Drogon # Rhaegal # AryaStark # AGirlIsNoOne # JorahMormont # SansaStark # TyrionLannister # SamwellTarly # BrienneOfTarth # Missandei # BranStark # DavosSeaworth # Podrick # Ghost # Nymeria # GoT,Neu,0.0,0.0,the time ha come gameofthrones gots8 forthethrone daenerystargaryen motherofdragons drogon rhaegal aryastark agirlisnoone jorahmormont sansastark tyrionlannister samwelltarly brienneoftarth missandei branstark davosseaworth podrick ghost nymeria got
Tan cerca y tan lejos del estreno. # DominGOT # ForTheThrone # GameOfThrones # GOT # WinterIsHere # GOTS8 # Daenerys # JonSnow # SansaStark # NightKingpic.twitter.com/dSYDVpCVPS,Neu,0.0,0.0,tan cerca tan lejos del estreno domingot forthethrone gameofthrones got winterishere gots8 daenerys jonsnow sansastark nightkingpic twitter com dsydvpcvps
It's TODAY!!! # deathandboobies # GOT # GameofThrones # GoTS8 # AryaStark # jonsnow # DaenerysTargaryen # GendryBaratheon # sansastark https://youtu.be/0PuS1gSbLyI,Neu,0.0,0.0,it today deathandboobies got gameofthrones gots8 aryastark jonsnow daenerystargaryen gendrybaratheon sansastark http youtu be 0pus1gsblyi
# GameofThronesSeason8 # GameofThrones # GOT # GoTS8 # khaleesi # JonSnow # AryaStark # SansaStark # TyrionLannister # NightKing # Cersei # winterisnow # WinterIsComingpic.twitter.com/H8gPwjQCbB,Neu,0.0,0.0,gameofthronesseason8 gameofthrones got gots8 khaleesi jonsnow aryastark sansastark tyrionlannister nightking cersei winterisnow winteriscomingpic twitter com h8gpwjqcbb
2 reactions when I come to Winterfell: Sansa: f*ck John bent the knee Arya: DRAGONS # GameofThrones # GoTS8 # ForTheThrone # GoT # DaenerysTargaryen # Daenerys # NightKing # SansaStark # sansapic.twitter.com/V2AkKfNjIu,Neu,0.0,0.0,2 reaction when come to winterfell sansa ck john bent the knee arya dragon gameofthrones gots8 forthethrone got daenerystargaryen daenerys nightking sansastark sansapic twitter com v2akkfnjiu
1 día. La # GranGuerra está aquí. # GameOfThrones # GOTS8 # GoT # HBOLAT @ HBOLAT @ GameOfThrones # WinterIsHere # ForTheThrone # WinterIsComing # Dracarys # JonSnow # SansaStark # AryaStark # DaenerysTargaryen # JaimeLannister,Neu,0.0,0.0,1 día la granguerra está aquí gameofthrones gots8 got hbolat hbolat gameofthrones winterishere forthethrone winteriscoming dracarys jonsnow sansastark aryastark daenerystargaryen jaimelannister
The Rightful Queen # GameOfThrones # GoTPremiereBelfast # GOT # GoTS8 # ForTheThrone # Sansa # SansaStark pic.twitter.com/bbOUma1sro,Neu,0.0,0.0,the rightful queen gameofthrones gotpremierebelfast got gots8 forthethrone sansa sansastark pic twitter com bbouma1sro
2 días. La # GranGuerra está aquí. # GameOfThrones # GOTS8 # GoT # HBOLAT @ HBOLAT @ GameOfThrones # WinterIsHere # ForTheThrone # WinterIsComing # ForTheThrone # Dracarys # JonSnow # SansaStark # AryaStark # DaenerysTargaryen # JaimeLannister,Neu,0.0,0.0,2 días la granguerra está aquí gameofthrones gots8 got hbolat hbolat gameofthrones winterishere forthethrone winteriscoming forthethrone dracarys jonsnow sansastark aryastark daenerystargaryen jaimelannister
Who Seats At The Iron Throne At The End Of # GameOfThrones - Odds # BranStark - 3 # JonSnow - 3.8 # DaenerysTargaryen - 5.5 # SansaStark - 7 # NightKing - 10 # AryaStark - 19 # CerseiLannister 23 Bet Here http://bit.ly/winsgot # GOT # GOTS8 # AccessBET # HBOpic.twitter.com/0ZSZ4tW6jt,Neu,0.0,0.0,who seat at the iron throne at the end of gameofthrones odds branstark 3 jonsnow 3 8 daenerystargaryen 5 5 sansastark 7 nightking 10 aryastark 19 cerseilannister 23 bet here http bit ly winsgot got gots8 accessbet hbopic twitter com 0zsz4tw6jt
MEJORES MOMENTOS DE GOT ¿Coincidís? ¿Cuáles son los mejores para vos? Te leemos # GameofThrones # GOT # ForTheThrone # JonSnow # kinginthenorth # Daenerys # motherofdragons # SansaStark # AryaStark # CerseiLannister # JaimeLannister # TyrionLannister # SamwellTarly # GoTS8 pic.twitter.com/jytzoxGXh3,Neu,0.0,0.0,mejores momentos de got coincidís cuáles son los mejores para vos te leemos gameofthrones got forthethrone jonsnow kinginthenorth daenerys motherofdragons sansastark aryastark cerseilannister jaimelannister tyrionlannister samwelltarly gots8 pic twitter com jytzoxgxh3
Don't mind me. Just want to do this. # GoTs8 # GoT # AryaStark # SansaStark # Daenerys # DaenerysTargaryen # JonSnow # Cersei # CerseiLannister # JaimeLannister # Tyrion # TyrionLannister # WhiteWalkers # NightKing # GameofThrones # BranStark # Brienne # BrienneOfTarth # Theon # TheonGreyjoy,Neu,0.0,0.0,don mind me just want to do this gots8 got aryastark sansastark daenerys daenerystargaryen jonsnow cersei cerseilannister jaimelannister tyrion tyrionlannister whitewalkers nightking gameofthrones branstark brienne brienneoftarth theon theongreyjoy
¿Cuál es el mejor personaje de Game of Thrones? # GameofThrones # GOTS8 # got # JuegodeTronos # HBO # domingot # domingo # JonSnow # TyrionLannister # JaimeLannister # ramsaybolton # Stark # HouseStark # Lannister # aryastark # SansaStark # DaenerysTargaryen # Encuesta # series # GOT7 # ForTheThrone,Neg,-0.30000000000000004,0.5,cuál e el mejor personaje de game of throne gameofthrones gots8 got juegodetronos hbo domingot domingo jonsnow tyrionlannister jaimelannister ramsaybolton stark housestark lannister aryastark sansastark daenerystargaryen encuesta series got7 forthethrone
¿Quién va a morir al final de Game of Thrones? # GameofThrones # GOTS8 # got # JuegodeTronos # HBO # domingot # domingo # JonSnow # TyrionLannister # JaimeLannister # ramsaybolton # Stark # HouseStark # Lannister # aryastark # SansaStark # DaenerysTargaryen # Encuesta # series # GOT7 # ForTheThrone,Neg,-0.20000000000000004,0.6666666666666666,quién va morir al final de game of throne gameofthrones gots8 got juegodetronos hbo domingot domingo jonsnow tyrionlannister jaimelannister ramsaybolton stark housestark lannister aryastark sansastark daenerystargaryen encuesta series got7 forthethrone
¿Cuál es la mejor batalla de Game of Thrones? # GameofThrones # GOTS8 # got # JuegodeTronos # HBO # domingot # domingo # JonSnow # TyrionLannister # JaimeLannister # ramsaybolton # Stark # HouseStark # Lannister # aryastark # SansaStark # DaenerysTargaryen # Encuesta # series # GOT7 # ForTheThrone,Neg,-0.30000000000000004,0.5,cuál e la mejor batalla de game of throne gameofthrones gots8 got juegodetronos hbo domingot domingo jonsnow tyrionlannister jaimelannister ramsaybolton stark housestark lannister aryastark sansastark daenerystargaryen encuesta series got7 forthethrone
3 días. La # GranGuerra está aquí. # GameOfThrones # GOTS8 # GoT # HBOLAT @ HBOLAT @ GameOfThrones # WinterIsHere # ForTheThrone # WinterIsComing # ForTheThrone # Dracarys # JonSnow # SansaStark # AryaStark # DaenerysTargaryen # JaimeLannister,Neu,0.0,0.0,3 días la granguerra está aquí gameofthrones gots8 got hbolat hbolat gameofthrones winterishere forthethrone winteriscoming forthethrone dracarys jonsnow sansastark aryastark daenerystargaryen jaimelannister
SEGUIMOS CON LAS CURIOSIDADES DE GOT # GameofThrones # GOT # GoTS8 # ForTheThrone # JonSnow # kinginthenorth # Daenerys # motherofdragons # emiliaclarke # sansastark # sophieturner # aryastark # maisewilliams # cerseilannister # jaimelannister # tyrtyrionlannister # samwelltarlypic.twitter.com/s2solkeKrz,Neu,0.0,0.0,seguimos con la curiosidades de got gameofthrones got gots8 forthethrone jonsnow kinginthenorth daenerys motherofdragons emiliaclarke sansastark sophieturner aryastark maisewilliams cerseilannister jaimelannister tyrtyrionlannister samwelltarlypic twitter com s2solkekrz
http://bit.ly/2G3nKhP GAME OF THRONES SEASON 8 PREDICTIONS! # gameofthrones # gots8 # got # forthethrone # Daenerys # jonsnow # sansastark # tyrionlannister # thenightking # CerseiLannister # aryastark # branstark # serjorah # samwelltarly # serdavos # euron # theon # missandei # greywormpic.twitter.com/EVRXnohhhR,Neg,-0.5,0.4,http bit ly 2g3nkhp game of throne season 8 prediction gameofthrones gots8 got forthethrone daenerys jonsnow sansastark tyrionlannister thenightking cerseilannister aryastark branstark serjorah samwelltarly serdavos euron theon missandei greywormpic twitter com evrxnohhhr
4 días. La # GranGuerra está aquí. # GameOfThrones # GOTS8 # GoT # HBOLAT @ HBOLAT @ GameOfThrones # WinterIsHere # ForTheThrone # WinterIsComing # ForTheThrone # Dracarys # JonSnow # SansaStark # AryaStark # DaenerysTargaryen # JaimeLannister,Neu,0.0,0.0,4 días la granguerra está aquí gameofthrones gots8 got hbolat hbolat gameofthrones winterishere forthethrone winteriscoming forthethrone dracarys jonsnow sansastark aryastark daenerystargaryen jaimelannister
CURIOSIDADES GOT Vol II # GameofThrones # GOT # GoTS8 # ForTheThrone # JonSnow # kinginthenorth # KitHarington # Daenerys # motherofdragons # emiliaclarke # sansastark # sophieturner # aryastark # maisewilliams # cerseilannister # jaimelannister # tyrionlannister # peterdinklage # samwelltarlypic.twitter.com/z5P3tcrdKS,Neu,0.0,0.0,curiosidades got vol ii gameofthrones got gots8 forthethrone jonsnow kinginthenorth kitharington daenerys motherofdragons emiliaclarke sansastark sophieturner aryastark maisewilliams cerseilannister jaimelannister tyrionlannister peterdinklage samwelltarlypic twitter com z5p3tcrdks
Be like the Hound . . # GameOfThrones # GoT # JonSnow # HouseStark # GameOfThronesMemes # Khaleesi # Lannister # Cersei # JaimeLannister # TyrionLannister # ValarMorghulis # SansaStark # AryaStark # Daenerys # maisiewilliams # emiliaclarke # KitHarington # GameOfThronesSeason8 # GoTS8 pic.twitter.com/6ZZVd0cXzz,Neu,0.0,0.0,be like the hound gameofthrones got jonsnow housestark gameofthronesmemes khaleesi lannister cersei jaimelannister tyrionlannister valarmorghulis sansastark aryastark daenerys maisiewilliams emiliaclarke kitharington gameofthronesseason8 gots8 pic twitter com 6zzvd0cxzz
5 días. La # GranGuerra está aquí. # GameOfThrones # GOTS8 # GoT # HBOLAT @ HBOLAT @ GameOfThrones # WinterIsHere # ForTheThrone # WinterIsComing # ForTheThrone # Dracarys # JonSnow # SansaStark # AryaStark # DaenerysTargaryen # JaimeLannister,Neu,0.0,0.0,5 días la granguerra está aquí gameofthrones gots8 got hbolat hbolat gameofthrones winterishere forthethrone winteriscoming forthethrone dracarys jonsnow sansastark aryastark daenerystargaryen jaimelannister
