text,sentiment,polarity,subjectivity,Preprocess
I’m scared lol # GoT # GameOfThrones # GOTS8 # AryaStark # JonSnow # AegonTargaryen # TyrionLannister # JaimeLannister # Gendry # SansaStark,Pos,0.8,0.7,i scared lol got gameofthrones gots8 aryastark jonsnow aegontargaryen tyrionlannister jaimelannister gendry sansastark
Do y’all see how FIERCE # SansaStark is looking in that battle suit though??? # GameOfThrones # GoT # GoTS8 pic.twitter.com/eXqQAG62Jg,Neu,0.0,0.0,do all see how fierce sansastark is looking in that battle suit though gameofthrones got gots8 pic twitter com exqqag62jg
In the end,Neu,0.0,0.0,in the end
Winterfell's Daughter. https://www.patreon.com/dpillustrations # ASOIAF # GOT # GoTS8 # GameofThrones # GameofThronesSeason8 # SansaStark # PatreonRewardspic.twitter.com/ghtRDxIlyB,Neu,0.0,0.0,winterfell daughter http www patreon com dpillustrations asoiaf got gots8 gameofthrones gameofthronesseason8 sansastark patreonrewardspic twitter com ghtrdxilyb
For everything that happened in the MASSIVE Season 8 premiere of # GameofThrones,Neu,0.0,1.0,for everything that happened in the massive season 8 premiere of gameofthrones
Game of Thrones is on at 2AM on Sky Atlantic,Neg,-0.4,0.4,game of throne is on at 2am on sky atlantic
# whowillwinthethrone Mi cuartos están con # sansastark # got # gots8 # gameofthrones # fotthethrone # hbo # xfinity https://www.instagram.com/p/BwhPN1qhvUv/?utm_source=ig_twitter_share&igshid=1462r24ngdx2i …,Neu,0.0,0.0,whowillwinthethrone mi cuartos están con sansastark got gots8 gameofthrones fotthethrone hbo xfinity http www instagram com bwhpn1qhvuv utm_source ig_twitter_share igshid 1462r24ngdx2i
It's tough being # Sansa. To be a Lady of Winterfell and a caring sister at the same time. # GameOfThrones # GoT # GotS8 # HBO # SansaStark # Winterfell # LadyOfWinterfell # Starks # AryaStark # BranStark # RickonStark # RobbStark # JonSnow # socialmediacalenda… https://www.instagram.com/p/BwgowRGgZGU/ pic.twitter.com/6jIcuUyIvW,Neg,-0.19444444444444445,0.4791666666666667,it tough being sansa to be lady of winterfell and caring sister at the same time gameofthrones got gots8 hbo sansastark winterfell ladyofwinterfell starks aryastark branstark rickonstark robbstark jonsnow socialmediacalenda http www instagram com bwgowrggzgu pic twitter com 6jicuuyivw
Oh my,Neu,0.0,0.0,oh my
Got # dragons? Whether you're a # GOT fan or # cat lover ,Neu,0.0,0.0,got dragon whether you re got fan or cat lover
# GameOfThrones # GOT # GoTS8 # ForTheThrone # JonSnow # NightKing # BranStark # AryaStark # SansaStark # Khaleesi # TyrionLannister # DaenerysTargaryen # KingInTheNorth # WhiteWalkers… https://www.instagram.com/visuallords/p/Bwaidwoh0_O/?utm_source=ig_twitter_share&igshid=ydfyk1g0svkf …,Neu,0.0,0.0,gameofthrones got gots8 forthethrone jonsnow nightking branstark aryastark sansastark khaleesi tyrionlannister daenerystargaryen kinginthenorth whitewalkers http www instagram com visuallords bwaidwoh0_o utm_source ig_twitter_share igshid ydfyk1g0svkf
# GOT # GoTS8 # SansaStark # GameofThrones @ SophieTpic.twitter.com/d9RnIuEukx,Neu,0.0,0.0,got gots8 sansastark gameofthrones sophietpic twitter com d9rniueukx
Winter is Here. Which side are you on? # GameOfThrones # TheMindOfReyRey # GOT # GoTS8 # ForTheThrone # JonSnow # NightKing # BranStark # AryaStark # SansaStark # Khaleesi # TyrionLannister # DaenerysTargaryen # KingInTheNorth # WhiteWalkers # MotherOfDragons # JaimeLannister # WinterIsComingpic.twitter.com/ptTzTOavVJ,Neu,0.0,0.0,winter is here which side are you on gameofthrones themindofreyrey got gots8 forthethrone jonsnow nightking branstark aryastark sansastark khaleesi tyrionlannister daenerystargaryen kinginthenorth whitewalkers motherofdragons jaimelannister winteriscomingpic twitter com pttztoavvj
Estamos de acuerdo con que estas dos protagonizaron escenas con el juego de la mirada matadora? En cualquier momento una iba a morir y sentía que esa sería # Daenerys porque # SansaStark por poco y la deja bajo tierra # GameOfThrones # GOT # ForTheThrone # GOTS8 pic.twitter.com/vnl0DRlegX,Neu,0.0,0.0,estamos de acuerdo con que estas do protagonizaron escenas con el juego de la mirada matadora en cualquier momento una iba morir sentía que esa sería daenerys porque sansastark por poco la deja bajo tierra gameofthrones got forthethrone gots8 pic twitter com vnl0drlegx
Winter is Here. Which side are you on? # GameOfThrones # TheMindOfReyRey # GOT # GoTS8 # ForTheThrone # JonSnow # NightKing # BranStark # AryaStark # SansaStark # Khaleesi # TyrionLannister… https://www.instagram.com/p/BwX5bLqA6q6/?utm_source=ig_twitter_share&igshid=1mtlqe82jox23 …,Neu,0.0,0.0,winter is here which side are you on gameofthrones themindofreyrey got gots8 forthethrone jonsnow nightking branstark aryastark sansastark khaleesi tyrionlannister http www instagram com bwx5blqa6q6 utm_source ig_twitter_share igshid 1mtlqe82jox23
No paro de reírme con este # GOT # MeanGirls # GameofThrones # Daenerys # SansaStark # GoTS8 pic.twitter.com/HwH3gr5Weh,Neu,0.0,0.0,no paro de reírme con este got meangirls gameofthrones daenerys sansastark gots8 pic twitter com hwh3gr5weh
Last Sunday night is the largest night of streaming activity ever for HBO # GameOfThrones # ForTheThrone # GOTS8 # GoT # ratings # HBO # TVratings # Winterfell # JonSnow # AryaStark # BranStark # SansaStark # Daenerys # JaimeLannister # Cersei # Tyrion https://geekspin.co/game-of-thrones-season-8-premiere-ratings/ … via @ geekspinco,Neu,0.0,0.06666666666666667,last sunday night is the largest night of streaming activity ever for hbo gameofthrones forthethrone gots8 got rating hbo tvratings winterfell jonsnow aryastark branstark sansastark daenerys jaimelannister cersei tyrion http geekspin co game of throne season 8 premiere rating via geekspinco
“Many underestimated you,Pos,0.5,0.5,many underestimated you
Famous quotes from Game of Thrones! # GameofThrones # GOT # GOTS8 # khaleesi # SansaStark # AryaStark # MaiseWilliams # EmiliaClarke # SophieTurner # Melisandre # CariceVanHouten # Ygritte # RoseLeslie # IndiaBriefs,Neu,0.0,0.7,famous quote from game of throne gameofthrones got gots8 khaleesi sansastark aryastark maisewilliams emiliaclarke sophieturner melisandre caricevanhouten ygritte roseleslie indiabriefs
O episódio 8x01 é cheio de referências ao 1x01. Termina e começa do mesmo jeito. Mas tem uma coisa que ninguém imaginaria era ver esses três lideres da porra toda e que logo o Tyrion seria a Mão # GameOfThrones # GOT # GOTs8 # SansaStark # JonSnow # DaenerysTargaryen # Tyrionpic.twitter.com/hHu79hDrqI,Neu,0.0,0.0,o episódio 8x01 é cheio de referências ao 1x01 termina começa do mesmo jeito ma tem uma coisa que ninguém imaginaria era ver es três lideres da porra toda que logo tyrion seria mão gameofthrones got gots8 sansastark jonsnow daenerystargaryen tyrionpic twitter com hhu79hdrqi
Reunião de família sem shade não é reunião de família # gameofthrones # GoTS8 # got # SansaStark # DaenerysTargaryen # JonSnowpic.twitter.com/ZccjxPJeNR,Neu,0.0,0.0,reunião de família sem shade não é reunião de família gameofthrones gots8 got sansastark daenerystargaryen jonsnowpic twitter com zccjxpjenr
# SheIsQueen and will sit on the throne # SansaStark # GameofThrones # GameofThronesSeason8 # GOT # GoTS8 https://twitter.com/cosmickorra/status/1117441445147947010 …,Neu,0.0,0.0,sheisqueen and will sit on the throne sansastark gameofthrones gameofthronesseason8 got gots8 http twitter com cosmickorra status 1117441445147947010
The Lady of Winterfell: Sansa Stark # gameofthrones # season8 # got # fanart # gameofthronesfanart # gameofthronesseason8 # gots8 # sansastark # ladyofwinter # housestarkpic.twitter.com/Xt1pM6sqBd,Neg,-0.2,0.6,the lady of winterfell sansa stark gameofthrones season8 got fanart gameofthronesfanart gameofthronesseason8 gots8 sansastark ladyofwinter housestarkpic twitter com xt1pm6sqbd
Quando # Daenerys osa MINACCIARE # Sansa vita mia # GameofThrones # GOT # GOTS8 # ForTheThrone # TronodiSpade # IlTronoDiSpade # SansaStark # DaenerysTargaryen # Nontoccaremeelamiafamigliapic.twitter.com/XNhO2qZjnq,Neu,0.0,0.0,quando daenerys osa minacciare sansa vita mia gameofthrones got gots8 forthethrone tronodispade iltronodispade sansastark daenerystargaryen nontoccaremeelamiafamigliapic twitter com xnho2qzjnq
Via @ nypl: # amreading # GameOfThrones # GOT # GOTS8 # readinglist # AryaStark # BranStark # SansaStark # DaenerysTargaryen # JonSnow # TyrionLannister # Cersei # Brienne # SamwellTarly # Yara # Theon # readingcommunity # ReadingForPleasure https://www.nypl.org/blog/2019/04/12/only-titles-that-matter-for-thrones-characters?utm_source=twitter.com&utm_medium=referral&utm_campaign=SocialFlow …,Neu,0.0,0.0,via nypl amreading gameofthrones got gots8 readinglist aryastark branstark sansastark daenerystargaryen jonsnow tyrionlannister cersei brienne samwelltarly yara theon readingcommunity readingforpleasure http www nypl org blog 2019 04 12 only title that matter for throne character utm_source twitter com utm_medium referral utm_campaign socialflow
Check out our # GameofThrones # fanreaction @ YouTube video https://youtu.be/Sc279s0_9Bk such a great episode! # GOT # GoTS8 # GameofThronesSeason8 @ HBO @ Skybound # SansaStark # SamwellTarly # JonSnow # AryaStark # brandonstark # DaenerysTargaryen # Tyrion # CerseiLannister,Pos,0.5,0.625,check out our gameofthrones fanreaction youtube video http youtu be sc279s0_9bk such great episode got gots8 gameofthronesseason8 hbo skybound sansastark samwelltarly jonsnow aryastark brandonstark daenerystargaryen tyrion cerseilannister
Se prendió la cosa # SansaStark # DaenerysTargaryen # GameOfThrones # GoTS8 # Got # ForTheThronepic.twitter.com/tsmS1XVawR,Neu,0.0,0.0,se prendió la cosa sansastark daenerystargaryen gameofthrones gots8 got forthethronepic twitter com tsms1xvawr
Bran be like Hello sisterfucker # GameofThrones # GoT # GoTS8 # GOT8 # GotS8E1 # JamieLannister # BranStark # JonSnow # Daenerys # SansaStark # Sansa # AryaStark # Cersei # CerseiLannister # TheNightKing # Tyrion # Winterfell # kingslandingpic.twitter.com/0hazGH2TCq,Neu,0.0,0.0,bran be like hello sisterfucker gameofthrones got gots8 got8 gots8e1 jamielannister branstark jonsnow daenerys sansastark sansa aryastark cersei cerseilannister thenightking tyrion winterfell kingslandingpic twitter com 0hazgh2tcq
Last night after the episode Every. Single. Trend. was about # GameOfThrones all of the characters # GoT trending # ForTheThrone # GoTs8 # BranStark # SansaStark # AryaStark # Daenerys # JaimeLannister # Cersei # JonSnow # Gendry # WinterIsHere # TyrionLannisterpic.twitter.com/lqr3fVxPZl,Neg,-0.03571428571428571,0.14047619047619048,last night after the episode every single trend wa about gameofthrones all of the character got trending forthethrone gots8 branstark sansastark aryastark daenerys jaimelannister cersei jonsnow gendry winterishere tyrionlannisterpic twitter com lqr3fvxpzl
Hope to see # SansaStark getting rid of suffering she had throughout previous seasons (1-7) # GoT # GameofThrones # GoTS8,Neg,-0.16666666666666666,0.16666666666666666,hope to see sansastark getting rid of suffering she had throughout previous season 1 7 got gameofthrones gots8
# GameofThrones S8 E1 Out # JonSnow # AryaStark # Daenerys # SansaStark # GOT # GoTS8 # ForTheThronepic.twitter.com/xL34Bo8gIQ,Neu,0.0,0.0,gameofthrones s8 e1 out jonsnow aryastark daenerys sansastark got gots8 forthethronepic twitter com xl34bo8giq
“Night gathers,Neu,0.0,0.0,night gather
What if # GameofThrones is made in Tamil @ shrutihaasan as # SansaStark # ShrutiHaasan # GOT # Sansa # GoTS8 # GOT8 # GOT8x01https://twitter.com/VCDtweets/status/1117751984012922881 …,Neu,0.0,0.0,what if gameofthrones is made in tamil shrutihaasan a sansastark shrutihaasan got sansa gots8 got8 got8x01https twitter com vcdtweets status 1117751984012922881
What if # GameofThrones is made in Tamil @ shrutihaasan as # SansaStark # ShrutiHaasan # GOT # Sansa # GoTS8 # GOT8 # GOT8x01pic.twitter.com/3lh9xIVA36,Neu,0.0,0.0,what if gameofthrones is made in tamil shrutihaasan a sansastark shrutihaasan got sansa gots8 got8 got8x01pic twitter com 3lh9xiva36
"What do dragons eat anyway?"" ""Whatever they want!"" # GOT # GameofThrones # GoTS8 # Dragon # SansaStark # DaenerysTargaryen # Quote # TVQuote # Sansa # Daenerys""",Neu,0.0,0.0,what do dragon eat anyway whatever they want got gameofthrones gots8 dragon sansastark daenerystargaryen quote tvquote sansa daenerys
# GAMEOFTHRONES The final season is here # JuegodeTronos,Neu,0.0,1.0,gameofthrones the final season is here juegodetronos
Io con quelli che vogliono # SansaStark sul Trono,Neu,0.0,0.0,io con quelli che vogliono sansastark sul trono
https://youtu.be/1OoJ__sfDSM Arya stark Meeting jon snow scene.. GOT season 8 # GOT # GOTonHotstarPremium # GOT8 # GoTS8 # OnlyOneThalaAjithSir # GameofThronesSeason8 # GameofThones # GameofThrones # GameOfThrones8 # AryaStark # JonSnow # WC2019Squad # Khaleesi # thalapathy # SansaStark # HBO,Neg,-0.2,0.6,http youtu be 1ooj__sfdsm arya stark meeting jon snow scene got season 8 got gotonhotstarpremium got8 gots8 onlyonethalaajithsir gameofthronesseason8 gameofthones gameofthrones gameofthrones8 aryastark jonsnow wc2019squad khaleesi thalapathy sansastark hbo
https://youtu.be/1OoJ__sfDSM Arya stark Meeting jon snow scene.. GOT season 8 # GOT # GOTonHotstarPremium # GOT8 # GoTS8 # GOT8 # GameofThronesSeason8 # GameofThones # GameofThrones # GameOfThrones8 # AryaStark # JonSnow # DaenerysTargaryen # Khaleesi # BranStark # SansaStark # HBO,Neg,-0.2,0.6,http youtu be 1ooj__sfdsm arya stark meeting jon snow scene got season 8 got gotonhotstarpremium got8 gots8 got8 gameofthronesseason8 gameofthones gameofthrones gameofthrones8 aryastark jonsnow daenerystargaryen khaleesi branstark sansastark hbo
# JuegodeTronos # GameOfThrones # GOT # GoTS8 # GameofThronesSeason8 # SansaStark Game of thrones pic.twitter.com/rdV3GdIoRv,Neg,-0.4,0.4,juegodetronos gameofthrones got gots8 gameofthronesseason8 sansastark game of throne pic twitter com rdv3gdiorv
# JuegodeTronos # GameOfThrones # GOT # GoTS8 # GameofThronesSeason8 # SansaStark # TyrionLannisterpic.twitter.com/nPu3bdeELl,Neu,0.0,0.0,juegodetronos gameofthrones got gots8 gameofthronesseason8 sansastark tyrionlannisterpic twitter com npu3bdeell
Winterfell is the stage for Season 1 callbacks and reunions in the Game of Thrones Season 8 premiere. Here's our episode review. # GameofThrones # GoT # GoTS8 # ForTheThrone # Daenerys # JonSnow # AryaStark # SansaStark # BranStark # Tyrion # HBO # GoT8 # Appocalypse http://www.appocalypse.co/entertainment/game-of-thrones-season-8-episode-1-winterfell-review-s08e01/ …,Neg,-0.4,0.4,winterfell is the stage for season 1 callback and reunion in the game of throne season 8 premiere here our episode review gameofthrones got gots8 forthethrone daenerys jonsnow aryastark sansastark branstark tyrion hbo got8 appocalypse http www appocalypse co entertainment game of throne season 8 episode 1 winterfell review s08e01
# WTF happened on # GameOfThrones??? # SansaStark and # AryaStark lost most of their beauty. So that sucks. At least # Arya is still cute. # CerseiLannister and # DaenerysTargaryen are still beautiful. (probably much makeup) # GoT # GoT8 # GoTs8 # GameOfThronesSeason8 # Cersei # Daenerys,Pos,0.1357142857142857,0.6285714285714287,wtf happened on gameofthrones sansastark and aryastark lost most of their beauty so that suck at least arya is still cute cerseilannister and daenerystargaryen are still beautiful probably much makeup got got8 gots8 gameofthronesseason8 cersei daenerys
# GameofThrones # JonSnow # HBO # DaenerysTargaryen # aryastark # sansastark # emiliaclarke # winteriscoming # forthethrone # kitharington # stark # targaryen # GoTS8 # GOT # gameofthronesmemes # tyrionlannister # gameofthronesseason # sophieturner # maisiewilliams # khaleesi # gotseasonpic.twitter.com/v8h4aX6PaS,Neg,-0.2,0.6,gameofthrones jonsnow hbo daenerystargaryen aryastark sansastark emiliaclarke winteriscoming forthethrone kitharington stark targaryen gots8 got gameofthronesmemes tyrionlannister gameofthronesseason sophieturner maisiewilliams khaleesi gotseasonpic twitter com v8h4ax6pas
# Sansa and # Dany are already clashing. Clash of queens? # gameofthrones # GoT # GameofThronesSeason8 # GoTS8 # SansaStark pic.twitter.com/yHGXnDHKqi,Neu,0.0,0.0,sansa and dany are already clashing clash of queen gameofthrones got gameofthronesseason8 gots8 sansastark pic twitter com yhgxndhkqi
Dan dan da da dan dan da da daaan daaaan da da daaan daaaan da da daaaaaaaan # watching # series # gameofthrones # GoTS8 # GOT # S08E01 # HBO # Daenerys # JonSnow # CerseiLannister # AryaStark # JaimeLannister # TyrionLannister # SansaStark # BranStark # Melisandre # Missandei # NightKingpic.twitter.com/qJwKcTF7RT,Neu,0.0,0.0,dan dan da da dan dan da da daaan daaaan da da daaan daaaan da da daaaaaaaan watching series gameofthrones gots8 got s08e01 hbo daenerys jonsnow cerseilannister aryastark jaimelannister tyrionlannister sansastark branstark melisandre missandei nightkingpic twitter com qjwkctf7rt
Des épisodes de 1h30 ! C'est quoi ce mythe qu'on nous a vendu ? # GoTS8 # GOT # GameofThrones # AryaStark # sansastark # JonSnow # BranStark # WinterIsHere # dana,Neu,0.0,0.0,de épisodes de 1h30 est quoi ce mythe qu on nous vendu gots8 got gameofthrones aryastark sansastark jonsnow branstark winterishere dana
I just found a spiral sigil pin on eBay https://www.ebay.com/itm/223482498779 … # Gameofthrones # Spiral # WhiteWalkers # Spirals # BranStark # Bran # SansaStark # Sansa # JonSnow # AryaStark # Arya # DemThrones # Dany # DaenerysTargaryen # Daenarys # CerseiLannister # Cersei # JamieLannister # GoTS8 # GOT pic.twitter.com/UVl0dB8rpP,Neu,0.0,0.0,i just found spiral sigil pin on ebay http www ebay com itm 223482498779 gameofthrones spiral whitewalkers spiral branstark bran sansastark sansa jonsnow aryastark arya demthrones dany daenerystargaryen daenarys cerseilannister cersei jamielannister gots8 got pic twitter com uvl0db8rpp
por favor necesito un gif de Sansa barriendo a Dany hahahaha esa mirada es lo mejor! # GameofThrones # GoTS8 # GOT # ForTheThrone # DaenerysTargaryen # SansaStark,Pos,0.25,0.5,por favor necesito un gif de sansa barriendo dany hahahaha esa mirada e lo mejor gameofthrones gots8 got forthethrone daenerystargaryen sansastark
Siiiiii jejejejeje palabras y hashtag como: # GameOfThrones # GOT # GoTS8 # DaenerysTargaryen # JonSnow # CerseiLannister # SansaStark # AryaStark # BranStark # TheNightKing,Neu,0.0,0.0,siiiiii jejejejeje palabras hashtag como gameofthrones got gots8 daenerystargaryen jonsnow cerseilannister sansastark aryastark branstark thenightking
¿Que fue lo peor del primer capítulo de la 8va temporada Game of Thrones? # GameofThrones # GameofThronesSeason8 # ForTheThrone # GameOfThornes # got # GoTS8 # JonSnow # SamwellTarly # Daenerys # AryaStark # BranStark # bran # HBOGOLA # HBOLAT # JuegodeTronos # GoTFinalSeason # sansastark,Neg,-0.4,0.4,que fue lo peor del primer capítulo de la 8va temporada game of throne gameofthrones gameofthronesseason8 forthethrone gameofthornes got gots8 jonsnow samwelltarly daenerys aryastark branstark bran hbogola hbolat juegodetronos gotfinalseason sansastark
¿Que fue lo mejor del primer capítulo de la 8va temporada Game of Thrones? # GameofThrones # GameofThronesSeason8 # ForTheThrone # GameOfThornes # got # GoTS8 # JonSnow # SamwellTarly # Daenerys # AryaStark # BranStark # bran # HBOGOLA # HBOLAT # JuegodeTronos # GoTFinalSeason # sansastark,Neg,-0.4,0.4,que fue lo mejor del primer capítulo de la 8va temporada game of throne gameofthrones gameofthronesseason8 forthethrone gameofthornes got gots8 jonsnow samwelltarly daenerys aryastark branstark bran hbogola hbolat juegodetronos gotfinalseason sansastark
¿Que te pareció el primer capítulo de la 8va temporada Game of Thrones? # GameofThrones # GameofThronesSeason8 # ForTheThrone # GameOfThornes # got # GoTS8 # JonSnow # SamwellTarly # Daenerys # AryaStark # BranStark # bran # HBOGOLA # HBOLAT # JuegodeTronos # GoTFinalSeason # sansastark # dragon,Neg,-0.4,0.4,que te pareció el primer capítulo de la 8va temporada game of throne gameofthrones gameofthronesseason8 forthethrone gameofthornes got gots8 jonsnow samwelltarly daenerys aryastark branstark bran hbogola hbolat juegodetronos gotfinalseason sansastark dragon
# GameofThrones # JonSNOW # DaenerysTARGARYEN # SansaSTARK # AryaSTARK # BranSTARK # CerseiLANNISTER # ReapersGaming # JaimeLANNISTER # TyrionLANNISTER # NightKing # GOT # GOTS8 # AegonTargaryen # TheonGreyjoy # ForTheThrone # EuronGreyjoy,Neu,0.0,0.0,gameofthrones jonsnow daenerystargaryen sansastark aryastark branstark cerseilannister reapersgaming jaimelannister tyrionlannister nightking got gots8 aegontargaryen theongreyjoy forthethrone eurongreyjoy
# GameofThrones # JonSNOW # DaenerysTARGARYEN # SansaSTARK # AryaSTARK # BranSTARK # CerseiLANNISTER # ReapersGaming # JaimeLANNISTER # TyrionLANNISTER # NightKing # GOT # GOTS8 # AegonTargaryen # TheonGreyjoy # ForTheThrone # EuronGreyjoy,Neu,0.0,0.0,gameofthrones jonsnow daenerystargaryen sansastark aryastark branstark cerseilannister reapersgaming jaimelannister tyrionlannister nightking got gots8 aegontargaryen theongreyjoy forthethrone eurongreyjoy
# GOT spoiler alert. If only # ektakapoor has control from # GoTS8 the show would run for 10 more seasons just based on # SansaStark & # DaenerysTargaryen drama. # GameofThronesSeason8 # GameOfThrones,Pos,0.25,0.75,got spoiler alert if only ektakapoor ha control from gots8 the show would run for 10 more season just based on sansastark daenerystargaryen drama gameofthronesseason8 gameofthrones
EVERYBODY STILL FIGHTING AND YET THE NK JUST FOCUSSED ON HIS TALENTS # GameOfThrones # got # NightKing # ForTheThrone # GOTS8 # CerseiLannister # JonSnow # SansaStark # TyrionLannister # AryaStark # Daenerys # EuronGreyjoy # TheonGreyjoy # TheHoundpic.twitter.com/0t7HxmkgpV,Neu,0.0,0.0,everybody still fighting and yet the nk just focussed on his talent gameofthrones got nightking forthethrone gots8 cerseilannister jonsnow sansastark tyrionlannister aryastark daenerys eurongreyjoy theongreyjoy thehoundpic twitter com 0t7hxmkgpv
Na boa a Sansa tava chata pra caralho nesse episódio,Neu,0.0,0.0,na boa sansa tava chata pra caralho nesse episódio
En resumen!!! # ReapersGaming # GameofThrones # JonSNOW # DaenerysTARGARYEN # SansaSTARK # AryaSTARK # BranSTARK # CerseiLANNISTER # JaimeLANNISTER # TyrionLANNISTER # NightKing # GOT # GOTS8 # AegonTargaryen,Neu,0.0,0.0,en resumen reapersgaming gameofthrones jonsnow daenerystargaryen sansastark aryastark branstark cerseilannister jaimelannister tyrionlannister nightking got gots8 aegontargaryen
En resumen!!! # ReapersGaming # GameofThrones # JonSNOW # DaenerysTARGARYEN # SansaSTARK # AryaSTARK # BranSTARK # CerseiLANNISTER # JaimeLANNISTER # TyrionLANNISTER # NightKing # GOT # GOTS8 # AegonTargaryen,Neu,0.0,0.0,en resumen reapersgaming gameofthrones jonsnow daenerystargaryen sansastark aryastark branstark cerseilannister jaimelannister tyrionlannister nightking got gots8 aegontargaryen
# GameofThrones premiered! Watch @ CorvyxOfficial 's musicvideo # Sevendevils by @ flo_tweet In honor of # GoTS8 # GoT https://youtu.be/YvnkmV-xk3s # GOT8 # HBOGO # ForTheThrone # JonSnow # DaenerysTargaryen # KingInTheNorth # DavosSeaworth # daenerys # SevenKingdoms @ HBO # AryaStark # sansastark,Neu,0.0,0.0,gameofthrones premiered watch corvyxofficial musicvideo sevendevils by flo_tweet in honor of gots8 got http youtu be yvnkmv xk3s got8 hbogo forthethrone jonsnow daenerystargaryen kinginthenorth davosseaworth daenerys sevenkingdoms hbo aryastark sansastark
No spoilers,Neu,0.0,0.0,no spoiler
# GameOfThrones was pretty lit # GameOfThornes # GamesOfThrones # GOT # GoTS8 # GoT8 # JonSnow # Daenerys # SansaStark # AryaStark # CerseiLannister # JaimeLannister # IronThrone # GameofThronesSeason8 # GameofThronesDay # GameOfThronesEve # WinterIsComing # winterishere see ya next weekpic.twitter.com/jfld4QiS0U,Pos,0.125,0.5,gameofthrones wa pretty lit gameofthornes gamesofthrones got gots8 got8 jonsnow daenerys sansastark aryastark cerseilannister jaimelannister ironthrone gameofthronesseason8 gameofthronesday gameofthroneseve winteriscoming winterishere see ya next weekpic twitter com jfld4qis0u
# GameofThrones # ForTheThrone # GOT # GoTS8 # DaenerysTargaryen # Daenerys # JonSnow # SansaStark # Sansa # AryaStark # BranStark # TyrionLannister # Tyrion # CerseiLannister # Cersei # BrienneofTarth # Brienne # DavosSeaworth # NightKing,Neu,0.0,0.0,gameofthrones forthethrone got gots8 daenerystargaryen daenerys jonsnow sansastark sansa aryastark branstark tyrionlannister tyrion cerseilannister cersei brienneoftarth brienne davosseaworth nightking
โง้ยยยแท็กโซคิ้วทึมากๆๆๆๆ # GameofThrones # GOT # GoTS8 # JonSnow # DaenerysTargaryen # AryaStark # SansaStark # BranStark # TyrionLannister # TheonGreyjoy # SamwellTarly # CerseiLannister # JaimeLannister # JorahMormontpic.twitter.com/mwjjMDVMGM,Neu,0.0,0.0,โง ยยยแท กโซค วท มากๆๆๆๆ gameofthrones got gots8 jonsnow daenerystargaryen aryastark sansastark branstark tyrionlannister theongreyjoy samwelltarly cerseilannister jaimelannister jorahmormontpic twitter com mwjjmdvmgm
ABRIL CAMATE POFAVOR!!!!!! # GameOfThrones # GoT # GoTS8 # JonSnow # DaenerysTargaryen # SansaStark # AryaStark # TyrionLannisterpic.twitter.com/stDmG7513v,Neu,0.0,0.0,abril camate pofavor gameofthrones got gots8 jonsnow daenerystargaryen sansastark aryastark tyrionlannisterpic twitter com stdmg7513v
